total_index,keyword_source,full_name,html_url,create_date,update_date,pushed_date,language,stars,forks,watchers,open_issues,is_fork,topics,description
131,"""responsible"" AND ""AI""",mikeroyal/Computer-Vision-Guide,https://github.com/mikeroyal/Computer-Vision-Guide,2021-08-15T22:16:15+00:00,2025-05-22T00:39:59+00:00,2022-01-09T22:06:40+00:00,Python,26,7,26,0,False,"['computer-vision', 'deep-learning', 'machine-learning', 'opencv', 'opencv-cpp', 'opencv-dnn', 'opencv-library', 'opencv-python', 'awesome', 'awesome-list', 'awesome-computer-vision']",Computer Vision Guide 
132,"""responsible"" AND ""AI""",LinWeizheDragon/Knowledge-Aware-Graph-Enhanced-GPT-2-for-Dialogue-State-Tracking,https://github.com/LinWeizheDragon/Knowledge-Aware-Graph-Enhanced-GPT-2-for-Dialogue-State-Tracking,2021-08-30T11:22:12+00:00,2023-10-17T22:39:38+00:00,2021-11-11T00:59:31+00:00,Python,25,9,25,0,False,[],"This is the official repository of EMNLP 2021 paper ""Knowledge-Aware Graph-Enhanced GPT-2 for Dialogue State Tracking""."
133,"""responsible"" AND ""AI""",horizon3ai/vcenter_saml_login,https://github.com/horizon3ai/vcenter_saml_login,2021-09-27T19:38:04+00:00,2025-05-31T23:32:30+00:00,2023-09-01T02:34:25+00:00,Python,508,93,508,13,False,[],A tool to extract the IdP cert from vCenter backups and log in as Administrator
134,"""responsible"" AND ""AI""",horizon3ai/CVE-2021-38647,https://github.com/horizon3ai/CVE-2021-38647,2021-09-16T02:11:36+00:00,2025-05-13T18:31:42+00:00,2021-09-16T10:39:04+00:00,Python,234,54,234,0,False,[],Proof on Concept Exploit for CVE-2021-38647 (OMIGOD)
135,"""responsible"" AND ""AI""",horizon3ai/proxyshell,https://github.com/horizon3ai/proxyshell,2021-09-04T15:34:03+00:00,2025-05-27T17:20:52+00:00,2023-08-25T22:42:24+00:00,Python,114,35,114,1,False,[],"Proof of Concept for CVE-2021-34473, CVE-2021-34523, and CVE-2021-31207"
136,"""responsible"" AND ""AI""",PacktPublishing/Serverless-ETL-and-Analytics-with-AWS-Glue,https://github.com/PacktPublishing/Serverless-ETL-and-Analytics-with-AWS-Glue,2021-09-27T06:15:51+00:00,2025-04-02T23:36:01+00:00,2023-10-02T11:37:14+00:00,Python,48,35,48,0,False,[],"Serverless ETL and Analytics with AWS Glue, published by Packt"
137,"""responsible"" AND ""AI""",mikeroyal/Autonomous-Systems-Guide,https://github.com/mikeroyal/Autonomous-Systems-Guide,2021-09-12T19:34:47+00:00,2025-04-25T03:55:33+00:00,2022-01-09T22:11:58+00:00,Python,34,11,34,0,False,"['machine-learning', 'autonomous-vehicles', 'autonomous-robots', 'automated-machine-learning', 'automation', 'awesome', 'awesome-list', 'drones', 'resources', 'robotics', 'rover', 'automated-systems']",Autonomous Systems Guide
138,"""responsible"" AND ""AI""",mikeroyal/Deep-Learning-Guide,https://github.com/mikeroyal/Deep-Learning-Guide,2021-09-19T21:29:34+00:00,2025-03-06T16:05:02+00:00,2022-02-06T20:38:02+00:00,Python,31,5,31,0,False,"['deep-learning', 'artificial-intelligence', 'computer-science', 'ai', 'machine-learning', 'awesome', 'awesome-list', 'awesome-readme', 'awesome-resources']",Deep learning Guide.
139,"""responsible"" AND ""AI""",cylynx/verifyml,https://github.com/cylynx/verifyml,2021-09-15T10:18:32+00:00,2024-10-01T19:38:09+00:00,2022-02-07T08:18:44+00:00,Python,23,3,23,2,False,"['responsible-ai', 'fairness', 'fairness-ai', 'machine-learning', 'machine-bias', 'veritas', 'model-card']",Open-source toolkit to help companies implement responsible AI workflows.
140,"""responsible"" AND ""AI""",ps1899/AI-Trading-Bot,https://github.com/ps1899/AI-Trading-Bot,2021-09-05T12:37:34+00:00,2025-05-17T20:32:09+00:00,2023-01-04T23:36:36+00:00,Python,22,8,22,0,False,"['algorithmic-trading', 'finance', 'computer-science', 'python', 'trading-bot', 'trading-strategies', 'neural-networks', 'eod', 'json-api', 'alpaca-trading-api', 'alpaca', 'paper-trading', 'markets', 'cloud-computing', 'gcp-storage']",Alpaca AI Paper-trading bot using Python
141,"""responsible"" AND ""AI""",yudhisteer/Face-Recognition-with-Masks,https://github.com/yudhisteer/Face-Recognition-with-Masks,2021-09-19T09:30:05+00:00,2025-04-30T08:23:42+00:00,2021-12-20T07:31:57+00:00,Python,20,2,20,0,False,"['face-recognition', 'covid-19', 'face-detection', 'convolutional-neural-networks', 'mask-detection', 'inception-architecture', 'resnet', 'ssd-mobilenet', 'inception-resnet-v2']","This project involves automating the attendance system of RT Knits using Face Recognition. Due to Covid-19, people are obliged to wear masks hence, the system is successful in recognizing people despite wearing masks."
142,"""responsible"" AND ""AI""",mindspore-ai/models,https://github.com/mindspore-ai/models,2021-10-15T06:38:37+00:00,2025-05-29T06:14:33+00:00,2023-07-17T12:52:03+00:00,Python,361,101,361,15,False,[],
143,"""responsible"" AND ""AI""",rhijjawi/NextDNS-API,https://github.com/rhijjawi/NextDNS-API,2021-10-18T21:25:36+00:00,2025-05-30T01:28:11+00:00,2023-10-24T20:41:45+00:00,Python,60,15,60,3,False,"['api', 'dns']","I was getting increasingly frustrated with NextDNS's lack of API. I wanted to manage things on the fly. So, I did the most logical thing. I built a python library to control my NextDNS account. I decided to make it public because why not?"
144,"""responsible"" AND ""AI""",microsoft/med-deadend,https://github.com/microsoft/med-deadend,2021-10-07T20:36:38+00:00,2025-05-27T05:13:52+00:00,2022-11-15T15:41:21+00:00,Python,49,18,49,1,False,[],Code for the Medical Deadend Paper at NeurIPS 2021
145,"""responsible"" AND ""AI""",mikeroyal/PyTorch-Guide,https://github.com/mikeroyal/PyTorch-Guide,2021-10-03T20:38:25+00:00,2025-05-27T14:27:26+00:00,2022-01-03T22:37:32+00:00,Python,29,3,29,0,False,"['pytorch', 'machine-learning', 'deep-learning', 'neural-networks', 'cuda', 'neural-network', 'awesome', 'awesome-list', 'awesome-readme', 'ai', 'artificial-intelligence', 'awesome-resources', 'computer-vision', 'deep-neural-networks', 'lists', 'ml', 'mlops', 'awesome-deep-learning', 'awesome-machine-learning']",PyTorch Guide
146,"""responsible"" AND ""AI""",mikeroyal/TensorFlow-Guide,https://github.com/mikeroyal/TensorFlow-Guide,2021-10-03T20:38:10+00:00,2024-12-20T05:28:23+00:00,2022-01-03T22:38:17+00:00,Python,16,4,16,0,False,"['tensorflow', 'tensorflowjs', 'machine-learning', 'deep-learning', 'deep-neural-networks', 'awesome', 'awesome-list', 'awesome-readme', 'awesome-resources', 'deep-neural-network', 'keras', 'keras-neural-networks', 'keras-tensorflow', 'lists', 'tensoflow2-gpu', 'tensorboard', 'tensorflow-experiments', 'tensorflow-lite', 'tesnorflow-serving', 'awesome-machine-learning']",TensorFlow Guide
147,"""responsible"" AND ""AI""",microsoft/StyleSwin,https://github.com/microsoft/StyleSwin,2021-11-30T03:41:33+00:00,2025-05-27T02:01:30+00:00,2024-07-30T21:00:17+00:00,Python,532,51,532,12,False,"['computer-vision', 'deep-learning', 'deep-neural-networks', 'pytorch', 'generative-adversarial-network', 'gans', 'image-generation', 'image-synthesis', 'styleswin', 'transformer']",[CVPR 2022] StyleSwin: Transformer-based GAN for High-resolution Image Generation
148,"""responsible"" AND ""AI""",naver-ai/hypermix,https://github.com/naver-ai/hypermix,2021-11-18T07:19:39+00:00,2025-02-21T11:17:56+00:00,2021-12-20T04:25:21+00:00,Python,62,2,62,1,False,[],Code for text augmentation method leveraging large-scale language models
149,"""responsible"" AND ""AI""",necarlson97/codex-ai-sublime,https://github.com/necarlson97/codex-ai-sublime,2021-11-10T13:43:12+00:00,2025-03-18T14:00:53+00:00,2023-02-22T13:37:27+00:00,Python,15,2,15,1,False,[],"A sublime-text package that uses cutting edge AI to write code with you, leveraging OpenAI's 'Codex' AI"
150,"""responsible"" AND ""AI""",UxxHans/Rainbow_Cats_Universal_FPS_Aimbot_Experiment_Only,https://github.com/UxxHans/Rainbow_Cats_Universal_FPS_Aimbot_Experiment_Only,2021-11-30T06:48:40+00:00,2024-08-29T14:18:24+00:00,2022-05-31T06:30:33+00:00,Python,10,1,10,5,False,"['aimbot', 'anti-cheat', 'explore']",An experiment of auto-aim mechanic for all FPS games using neural network and AI humanoid posture recognition. The main section of the code was not released. Discussion of anti-cheat only.
151,"""responsible"" AND ""AI""",credo-ai/credoai_lens,https://github.com/credo-ai/credoai_lens,2021-12-10T19:06:41+00:00,2025-03-08T16:18:17+00:00,2024-06-13T21:30:08+00:00,Python,47,9,47,0,False,"['responsible-ai', 'machine-learning', 'ml', 'ethical-artificial-intelligence', 'assessment', 'data-science', 'artificial-intelligence', 'ai', 'jupyter', 'python', 'fairness-ml', 'fairness-ai', 'visualization', 'reporting']","Credo AI Lens is a comprehensive assessment framework for AI systems. Lens standardizes model and data assessment, and acts as a central gateway to assessments created in the open source community."
152,"""responsible"" AND ""AI""",microsoft/responsible-ai-toolbox-genbit,https://github.com/microsoft/responsible-ai-toolbox-genbit,2021-12-20T21:02:22+00:00,2025-05-23T21:27:33+00:00,2024-08-20T16:26:14+00:00,Python,46,10,46,1,False,"['data-science', 'fairness-ai', 'fairness-ml', 'gender', 'gender-bias', 'jupyter', 'machine-learning', 'natural-language', 'natural-language-processing', 'fairnness']",A tool for gender bias identification in text. Part of Microsoft's Responsible AI toolbox. 
153,"""responsible"" AND ""AI""",ai-forever/ReadingPipeline,https://github.com/ai-forever/ReadingPipeline,2021-12-28T08:35:45+00:00,2025-05-17T16:23:52+00:00,2023-02-06T14:54:33+00:00,Python,25,7,25,0,False,"['object-detection', 'ocr', 'pytorch', 'segmentation', 'text-recognition']",Text reading pipeline that combines segmentation and OCR-models.
154,"""responsible"" AND ""AI""",lynnlangit/learning-ethical-ai,https://github.com/lynnlangit/learning-ethical-ai,2021-12-15T21:05:46+00:00,2025-03-12T22:25:40+00:00,2024-12-08T21:31:28+00:00,Python,14,5,14,0,False,"['ai', 'ethics', 'machine-learning', 'tensorflow']",Resources to learn how to implement ethical AI
155,"""responsible"" AND ""AI""",FeatureCloud/FeatureCloud,https://github.com/FeatureCloud/FeatureCloud,2021-12-15T11:00:13+00:00,2025-03-05T10:33:01+00:00,2024-12-16T19:55:51+00:00,Python,11,2,11,1,False,[],
156,"""responsible"" AND ""AI""",MaheepChaudhary/Causality-in-Trustworthy-Machine-Learning,https://github.com/MaheepChaudhary/Causality-in-Trustworthy-Machine-Learning,2022-01-02T20:05:07+00:00,2025-05-29T23:19:36+00:00,2023-08-28T12:56:10+00:00,Python,93,8,93,0,False,"['computer-vision', 'causal-inference', 'causality', 'counterfactual-explanations', 'counterfactual']",The repository contains lists of papers on causality and how relevant techniques are being used to further enhance deep learning era computer vision solutions.
157,"""responsible"" AND ""AI""",ckoshka/personate,https://github.com/ckoshka/personate,2022-02-18T01:17:51+00:00,2024-08-28T04:24:19+00:00,2022-03-19T06:45:59+00:00,Python,32,4,32,2,False,[],A zero-shot chatbot library for large language models
158,"""responsible"" AND ""AI""",alcatrazEscapee/FactorioProcessorV5,https://github.com/alcatrazEscapee/FactorioProcessorV5,2022-02-14T16:48:10+00:00,2023-09-16T15:05:43+00:00,2022-05-18T14:18:13+00:00,Python,19,0,19,0,False,[],Toolchain for a custom Factorio processor.
159,"""responsible"" AND ""AI""",tie-set/simple-fl,https://github.com/tie-set/simple-fl,2022-02-13T22:36:59+00:00,2025-03-28T22:15:31+00:00,2022-10-12T18:33:20+00:00,Python,11,13,11,0,False,[],"This repository contains a simplified federated learning codebase designed mainly for personal or educational purposes. You can use the code from this repo for a commercial use too. However, we will not be responsible for any issues, or damages caused by using the code. For TieSet's official version of STADLE platform, please visit www.stadle.ai"
160,"""responsible"" AND ""AI""",CelebV-HQ/CelebV-HQ,https://github.com/CelebV-HQ/CelebV-HQ,2022-03-31T03:48:16+00:00,2025-05-30T05:55:14+00:00,2023-01-04T00:29:28+00:00,Python,435,35,435,14,False,"['datasets', 'gans', 'generative-model']",[ECCV 2022] CelebV-HQ: A Large-Scale Video Facial Attributes Dataset
161,"""responsible"" AND ""AI""",microsoft/GRAM,https://github.com/microsoft/GRAM,2022-03-31T09:48:53+00:00,2025-02-27T07:01:14+00:00,2022-08-25T04:36:06+00:00,Python,188,22,188,6,False,[],GRAM: Generative Radiance Manifolds for 3D-Aware Image Generation (CVPR 2022 Oral)
162,"""responsible"" AND ""AI""",minimaxir/imgbeddings,https://github.com/minimaxir/imgbeddings,2022-03-17T03:15:50+00:00,2025-05-31T09:39:36+00:00,2022-03-28T00:59:31+00:00,Python,151,13,151,6,False,"['ai', 'transformers', 'onnx', 'images', 'image-processing', 'embeddings', 'clip']",Python package to generate image embeddings with CLIP without PyTorch/TensorFlow
163,"""responsible"" AND ""AI""",causalgraph/causalgraph,https://github.com/causalgraph/causalgraph,2022-03-14T09:10:59+00:00,2025-04-30T18:29:13+00:00,2023-12-15T10:55:40+00:00,Python,56,4,56,0,False,"['causality', 'data-science', 'graphs', 'machine-learning', 'python3']","A python package for modeling, persisting and visualizing causal graphs embedded in knowledge graphs."
164,"""responsible"" AND ""AI""",NasimAbdollahi/NodeCoder,https://github.com/NasimAbdollahi/NodeCoder,2022-03-01T18:02:37+00:00,2025-03-26T21:53:46+00:00,2024-05-02T14:58:48+00:00,Python,33,6,33,1,False,[],NodeCoder is a general framework based on graph convolutional neural network for protein function prediction.
165,"""responsible"" AND ""AI""",nialloriordan/airbyte-airflow-scraper,https://github.com/nialloriordan/airbyte-airflow-scraper,2022-04-22T18:13:03+00:00,2025-05-24T09:40:15+00:00,2022-06-23T19:03:50+00:00,Python,28,3,28,0,False,"['airbyte', 'airflow', 'beautifulsoup', 'scraper']",Pipeline to scrape data from Linkedin using Airbyte and Airflow
166,"""responsible"" AND ""AI""",freedy82/Comic-Toolbox,https://github.com/freedy82/Comic-Toolbox,2022-04-08T04:24:28+00:00,2025-05-22T20:00:32+00:00,2022-09-10T08:17:50+00:00,Python,25,5,25,2,False,"['comic-downloader', 'comics', 'crawler', 'download-comic', 'manga', 'manga-downloader', 'comic', 'comics-reader', 'manga-reader', 'reader', 'translation']","Comic toolbox, GUI interface, download, reader, translation, conversion, image processing, cropping, compression, convenient for e-book reader users 漫畫工具箱，GUI介面，下載、閱讀、翻譯、轉檔、處理、裁剪、壓縮，方便電子書閱讀器用戶"
167,"""responsible"" AND ""AI""",horizon3ai/CVE-2022-1388,https://github.com/horizon3ai/CVE-2022-1388,2022-05-09T11:46:45+00:00,2025-04-21T14:20:42+00:00,2022-05-09T20:52:07+00:00,Python,232,39,232,0,False,[],POC for CVE-2022-1388
168,"""responsible"" AND ""AI""",horizon3ai/CVE-2022-22972,https://github.com/horizon3ai/CVE-2022-22972,2022-05-24T20:19:55+00:00,2025-04-17T05:07:12+00:00,2022-05-26T16:07:18+00:00,Python,154,31,154,0,False,[],
169,"""responsible"" AND ""AI""",Sound2Synth/Sound2Synth,https://github.com/Sound2Synth/Sound2Synth,2022-05-02T18:14:39+00:00,2025-05-14T17:14:15+00:00,2022-07-28T09:35:14+00:00,Python,86,11,86,3,False,[],Sound2Synth: Interpreting Sound via FM Synthesizer Parameters Estimation
170,"""responsible"" AND ""AI""",talbenha/cell-tracker-gnn,https://github.com/talbenha/cell-tracker-gnn,2022-05-20T07:14:13+00:00,2025-04-29T23:12:27+00:00,2022-11-30T08:00:56+00:00,Python,68,11,68,5,False,"['deep-learning', 'pytorch']",[ECCV 2022] Official PyTorch implementation of the paper - Graph Neural Network for Cell Tracking in Microscopy Videos
171,"""responsible"" AND ""AI""",dragonpilot-community/dp-devel,https://github.com/dragonpilot-community/dp-devel,2022-05-05T02:51:46+00:00,2025-05-17T22:32:43+00:00,2023-07-04T19:28:44+00:00,Python,33,27,33,12,False,[],Development branch for dragonpilot
172,"""responsible"" AND ""AI""",killinen/BrakeModule,https://github.com/killinen/BrakeModule,2022-05-01T09:02:19+00:00,2025-04-10T16:58:10+00:00,2024-08-24T16:39:33+00:00,Python,28,8,28,2,False,"['diy', 'can-bus', 'openpilot', 'pcb', 'stm32', 'stm32f103', 'bmw', 'automotive', 'bosch']",BrakeModule is system that will control braking in BMW E39 with BOSCH ABS 5.7.
173,"""responsible"" AND ""AI""",sensity-ai/dot,https://github.com/sensity-ai/dot,2022-06-04T10:56:56+00:00,2025-06-02T07:10:59+00:00,2024-06-14T10:03:07+00:00,Python,4337,446,4337,27,False,[],The Deepfake Offensive Toolkit
174,"""responsible"" AND ""AI""",explainablerecsys/recsys2022,https://github.com/explainablerecsys/recsys2022,2022-06-20T13:03:28+00:00,2025-01-31T15:03:50+00:00,2024-03-28T09:21:19+00:00,Python,50,4,50,0,False,[],RecSys 2022 Tutorial Hands on Explainable Recommender Systems with Knowledge Graphs
175,"""responsible"" AND ""AI""",horizon3ai/CVE-2022-28219,https://github.com/horizon3ai/CVE-2022-28219,2022-06-26T15:48:27+00:00,2025-05-12T01:08:43+00:00,2022-06-26T16:46:55+00:00,Python,45,15,45,0,False,[],PoC for ManageEngine ADAudit Plus CVE-2022-28219
176,"""responsible"" AND ""AI""",srikar-kodakandla/algo-trading-using-fyers-broker-api,https://github.com/srikar-kodakandla/algo-trading-using-fyers-broker-api,2022-06-25T15:58:03+00:00,2025-05-24T18:55:14+00:00,2023-07-18T05:08:08+00:00,Python,42,19,42,2,False,"['algo-trading', 'fyers-api']","This program trades in stock market using fyers api . It buys when supertrend gives buy signal and sells if supertrend gives sell signal , if adx is below 30 it won't trade. it selects supertrend values by bruteforcing all the possible combinations with past data of given stock . It selects stock day before the market opens.It selects the stocks to trade by checking list of stocks in chartink script , then it bruteforces best combination of supertrend combinations and trades with that supertrend combinations on the next day , it also messages you live alerts in telegram."
177,"""responsible"" AND ""AI""",Azure/mlops-starter-sklearn,https://github.com/Azure/mlops-starter-sklearn,2022-06-09T05:09:04+00:00,2025-05-14T05:55:53+00:00,2023-06-07T02:04:17+00:00,Python,12,6,12,3,False,"['machine-learning', 'mlops', 'azure-machine-learning', 'scikit-learn', 'azure', 'devops', 'microsoft', 'mypy', 'pytest', 'python', 'responsible-ai']",Azure Machine Learning と GitHub を利用した MLOps のサンプルコード
178,"""responsible"" AND ""AI""",daveshap/HeuristicImperatives,https://github.com/daveshap/HeuristicImperatives,2022-07-09T09:01:56+00:00,2025-05-19T00:40:39+00:00,2023-05-22T22:42:09+00:00,Python,138,23,138,0,False,[],"Reduce suffering, increase prosperity, increase understanding. A proposed framework to address the Control Problem."
179,"""responsible"" AND ""AI""",bethusaisampath/YOLOs_OpenVINO,https://github.com/bethusaisampath/YOLOs_OpenVINO,2022-07-19T19:54:34+00:00,2024-07-31T08:36:53+00:00,2022-07-26T08:12:29+00:00,Python,15,2,15,2,False,"['inference', 'intel', 'model-optimizer', 'object-detection', 'openvino', 'yolo', 'yolov5', 'yolov7']",Latest YOLO models inferencing using Intel Openvino toolkit
180,"""responsible"" AND ""AI""",torrinworx/Cozy-Auto-Texture,https://github.com/torrinworx/Cozy-Auto-Texture,2022-08-30T01:45:41+00:00,2025-05-17T16:25:37+00:00,2022-09-20T15:06:51+00:00,Python,110,6,110,3,False,"['ai', 'blender', 'blender-addon', 'blender-python', 'dall-e', 'diffusion-models', 'machine-learning', 'stable-diffusion', '3d-art', '3d-models', 'blender-plugin', 'diffusers', 'huggingface', 'images', 'python', 'torch', 'open-source']",A Blender add-on for generating free textures using the Stable Diffusion AI text to image model.
181,"""responsible"" AND ""AI""",storagebcrs/devops-exercises,https://github.com/storagebcrs/devops-exercises,2022-08-23T14:34:32+00:00,2025-05-23T15:40:07+00:00,2022-08-23T14:34:47+00:00,Python,32,18,32,1,False,[],Clone & Test from bregman-arie/devops-exercises 
182,"""responsible"" AND ""AI""",bigcode-project/transformers,https://github.com/bigcode-project/transformers,2022-08-03T15:40:01+00:00,2024-11-04T16:28:53+00:00,2024-03-06T23:48:47+00:00,Python,26,8,26,13,False,[],
183,"""responsible"" AND ""AI""",christopherohit/CarInspectionDamage,https://github.com/christopherohit/CarInspectionDamage,2022-08-22T10:00:37+00:00,2025-03-04T11:48:04+00:00,2024-05-08T10:10:31+00:00,Python,19,1,19,1,False,[],
184,"""responsible"" AND ""AI""",CarperAI/OpenELM,https://github.com/CarperAI/OpenELM,2022-09-03T12:53:16+00:00,2025-06-01T23:38:11+00:00,2023-11-15T11:36:05+00:00,Python,721,89,721,7,False,[],Evolution Through Large Models
185,"""responsible"" AND ""AI""",squaredev-io/whitebox,https://github.com/squaredev-io/whitebox,2022-09-09T12:02:53+00:00,2024-11-13T18:09:59+00:00,2023-07-11T22:37:38+00:00,Python,183,5,183,29,False,"['machine-learning', 'monitoring', 'observability', 'python', 'explainability', 'explainable-ai', 'ml-monitoring', 'mlflow', 'mlops', 'modelops', 'accuracy', 'accuracy-metrics', 'accuracy-score', 'confusion-matrix', 'f1-score', 'recall', 'model-monitoring', 'k8s', 'kubernetes', 'xai']",[Not Actively Maintained] Whitebox is an open source E2E ML monitoring platform with edge capabilities that plays nicely with kubernetes
186,"""responsible"" AND ""AI""",cisco-open/ResponsibleAI,https://github.com/cisco-open/ResponsibleAI,2022-09-30T17:47:52+00:00,2025-05-26T09:04:57+00:00,2024-06-26T23:12:20+00:00,Python,58,13,58,3,False,[],RAI is a python library that is written to help AI developers in various aspects of responsible AI development.
187,"""responsible"" AND ""AI""",aidotse/PASEOS,https://github.com/aidotse/PASEOS,2022-09-23T08:36:20+00:00,2025-05-24T11:14:35+00:00,2024-03-25T17:20:08+00:00,Python,45,11,45,42,False,[],PASEOS - PAseos Simulates the Environment for Operating multiple Spacecraft
188,"""responsible"" AND ""AI""",saif-ellafi/play-by-the-writing,https://github.com/saif-ellafi/play-by-the-writing,2022-09-15T17:19:20+00:00,2025-05-31T18:52:41+00:00,2024-09-16T16:34:00+00:00,Python,30,7,30,7,False,[],"Play by the Writing is a bundle of scripts for Espanso, written in python to expand SOLO RPG rulesets as you write"
189,"""responsible"" AND ""AI""",hendrikjoosten/Coursera-DevOps-Professional-Certificate,https://github.com/hendrikjoosten/Coursera-DevOps-Professional-Certificate,2022-09-22T15:03:33+00:00,2025-05-11T18:51:43+00:00,2022-11-23T11:07:45+00:00,Python,16,15,16,0,False,[],"IBM DevOps and Software Engineering Professional Certificate Launch your DevOps and Software Engineering Career. Master DevOps, Agile, Scrum, CI/CD and Cloud Native with hands-on job-ready skills."
190,"""responsible"" AND ""AI""",jyp-studio/Invoice_detection,https://github.com/jyp-studio/Invoice_detection,2022-09-15T02:28:07+00:00,2025-02-04T10:56:11+00:00,2022-12-16T17:19:11+00:00,Python,11,3,11,0,False,"['detection', 'object-detection', 'ocr', 'yolov5', 'pytesseract', 'recognition', 'yolo']",This is an AI model for detecting and recognizing invoice information by yolov5 and OCR.
191,"""responsible"" AND ""AI""",aws-samples/ai-powered-text-insights,https://github.com/aws-samples/ai-powered-text-insights,2022-09-15T05:05:40+00:00,2024-08-10T03:40:19+00:00,2024-08-02T16:54:35+00:00,Python,10,3,10,1,False,"['athena', 'ecr', 'fargate', 'kms', 'lambda', 'location-service', 'lookout-for-metrics', 'quicksight', 's3', 'sns', 'sqs', 'step-functions', 'comprehend', 'sagemaker']",
192,"""responsible"" AND ""AI""",microsoft/robustlearn,https://github.com/microsoft/robustlearn,2022-10-20T09:46:22+00:00,2025-05-29T19:28:00+00:00,2024-07-12T10:53:01+00:00,Python,490,60,490,7,False,[],Robust machine learning for responsible AI
193,"""responsible"" AND ""AI""",horizon3ai/CVE-2022-40684,https://github.com/horizon3ai/CVE-2022-40684,2022-10-13T14:24:12+00:00,2025-05-17T15:15:42+00:00,2022-10-13T15:25:00+00:00,Python,350,91,350,0,False,[],"A proof of concept exploit for CVE-2022-40684 affecting Fortinet FortiOS, FortiProxy, and FortiSwitchManager"
194,"""responsible"" AND ""AI""",yum-food/TaSTT,https://github.com/yum-food/TaSTT,2022-10-02T23:45:23+00:00,2025-05-31T03:52:30+00:00,2024-11-19T01:34:34+00:00,Python,89,5,89,5,False,"['vrchat', 'vrchat-avatars', 'vrchat-osc', 'vrchat-sdk3', 'whisper', 'speech-to-text', 'vrchat-tool']",A free self-hosted STT for VRChat
195,"""responsible"" AND ""AI""",manulthanura/Repo-Library,https://github.com/manulthanura/Repo-Library,2022-10-29T03:51:46+00:00,2025-05-08T11:00:58+00:00,2024-01-08T00:14:44+00:00,Python,17,1,17,0,False,"['library', 'learn', 'github', 'repository']",Here is a list of the best GitHub repositories that are useful for your dev journey. Feel free to add your favorite resources as well and help others in their journey of learning.
196,"""responsible"" AND ""AI""",jose-jaen/Airbnb,https://github.com/jose-jaen/Airbnb,2022-10-13T14:55:56+00:00,2025-05-13T06:36:43+00:00,2023-05-28T14:59:45+00:00,Python,14,4,14,1,False,"['algorithms', 'bayesian-optimization', 'bayesian-statistics', 'deep-learning', 'econometrics', 'machine-learning', 'python', 'ai', 'bayes', 'data-science', 'deployment', 'streamlit', 'xai']",Airbnb price prediction using Machine Learning and Deep Learning
197,"""responsible"" AND ""AI""",TareHimself/osu-ai,https://github.com/TareHimself/osu-ai,2022-10-31T01:22:08+00:00,2025-05-04T12:35:16+00:00,2024-01-03T03:48:05+00:00,Python,14,3,14,2,False,[],Aiming and clicking with pytorch networks in the game osu!
198,"""responsible"" AND ""AI""",aws-samples/aws-mwaa-openlineage,https://github.com/aws-samples/aws-mwaa-openlineage,2022-10-25T07:01:30+00:00,2025-04-10T15:13:32+00:00,2024-07-25T00:58:44+00:00,Python,12,1,12,0,False,[],"In this repository, we show how to get started with data lineage on AWS using OpenLineage. This is an AWS Cloud Development Kit project (CDK) which deploys a pre-configured demo environment for evaluating and experiencing OpenLineage firsthand."
