total_index,keyword_source,full_name,html_url,create_date,update_date,pushed_date,language,stars,forks,watchers,open_issues,is_fork,topics,description
269,"""responsible"" AND ""AI""",horizon3ai/CVE-2023-27350,https://github.com/horizon3ai/CVE-2023-27350,2023-04-22T21:34:06+00:00,2025-02-22T18:04:20+00:00,2023-05-01T19:31:20+00:00,Python,51,20,51,2,False,[],Proof of Concept Exploit for PaperCut CVE-2023-27350
270,"""responsible"" AND ""AI""",yjw1029/Self-Reminder,https://github.com/yjw1029/Self-Reminder,2023-04-11T03:11:26+00:00,2025-05-06T01:54:18+00:00,2023-11-13T07:41:43+00:00,Python,48,3,48,0,False,[],"Code for our paper ""Defending ChatGPT against Jailbreak Attack via Self-Reminder"" in NMI."
271,"""responsible"" AND ""AI""",derekcheungsa/autogpt-openbb-sdk,https://github.com/derekcheungsa/autogpt-openbb-sdk,2023-04-27T03:27:27+00:00,2024-10-03T23:13:54+00:00,2023-05-17T02:54:02+00:00,Python,45,9,45,2,False,[],
272,"""responsible"" AND ""AI""",eFiniLan/legacypilot,https://github.com/eFiniLan/legacypilot,2023-04-24T08:12:52+00:00,2025-05-30T05:11:30+00:00,2024-02-28T02:02:44+00:00,Python,39,31,39,1,False,"['adas', 'dragonpilot', 'openpilot', 'ford', 'genesis', 'hyundai', 'kia', 'lexus', 'mazda', 'nissan', 'toyota', 'volkswagen', 'acura', 'canbus', 'jeep', 'stellantis', 'self-driving-car']",ANOTHER openpilot fork running on legacy devices (EON / LEON / comma two)
273,"""responsible"" AND ""AI""",drakyanerlanggarizkiwardhana/GPT4-Free,https://github.com/drakyanerlanggarizkiwardhana/GPT4-Free,2023-04-25T15:15:45+00:00,2025-04-26T19:53:05+00:00,2023-04-25T16:11:58+00:00,Python,38,8,38,0,False,"['chatbot', 'chatbots', 'chatgpt', 'chatgpt-4', 'chatgpt-api', 'chatgpt-free', 'chatgpt4', 'free-gpt', 'gpt', 'gpt-3', 'gpt-4', 'gpt3', 'gpt4', 'gpt4-api', 'language-model', 'openai', 'openai-api', 'openai-chatgpt', 'python', 'reverse-engineering']","decentralising the Ai Industry, free gpt-4/3.5 scripts through several reverse engineered api's ( poe.com, phind.com, chat.openai.com, phind.com, writesonic.com, sqlchat.ai, t3nsor.com, you.com etc...)"
274,"""responsible"" AND ""AI""",MysticXtheUnknown/voicechatai-rpi-x64-russ,https://github.com/MysticXtheUnknown/voicechatai-rpi-x64-russ,2023-04-22T15:10:10+00:00,2024-07-19T22:04:53+00:00,2024-07-19T22:04:50+00:00,Python,28,4,28,2,False,[],Voice chat with open ai's chatgpt using a raspberry pi (x64) (tested on bullseye).
275,"""responsible"" AND ""AI""",Nick2Bis/AutoGTP,https://github.com/Nick2Bis/AutoGTP,2023-04-17T14:26:24+00:00,2025-01-10T17:10:20+00:00,2023-04-17T14:27:54+00:00,Python,19,11,19,0,False,[],
276,"""responsible"" AND ""AI""",CLOVI-IO/CryptoTraderAI,https://github.com/CLOVI-IO/CryptoTraderAI,2023-04-28T00:24:11+00:00,2025-05-23T23:14:21+00:00,2024-06-24T11:06:13+00:00,Python,16,7,16,1,False,[],"CryptoTraderAI is an automated trading solution that connects TradingView alerts with the Crypto.com and Binance Exchange API, allowing users to execute trades based on their preferred strategies. "
277,"""responsible"" AND ""AI""",fsndzomga/babyAGI-numpy,https://github.com/fsndzomga/babyAGI-numpy,2023-04-17T01:18:23+00:00,2024-09-04T11:13:46+00:00,2023-04-18T03:57:57+00:00,Python,15,10,15,0,False,[],A version of BabyAGI with numpy instead of pinecone and an evaluation agent to check success criteria
278,"""responsible"" AND ""AI""",chenjd/azure-openai-gpt4-voice-chatbot,https://github.com/chenjd/azure-openai-gpt4-voice-chatbot,2023-04-12T21:40:54+00:00,2024-06-16T16:51:29+00:00,2023-04-18T21:13:22+00:00,Python,14,8,14,1,False,[],
279,"""responsible"" AND ""AI""",intel/document-automation,https://github.com/intel/document-automation,2023-04-17T20:39:50+00:00,2024-12-19T06:02:26+00:00,2024-06-27T18:49:15+00:00,Python,14,8,14,0,False,"['nlp', 'ocr', 'retrieval', 'odqa', 'semantic-search', 'dpr']",Document Automation Reference Kit
280,"""responsible"" AND ""AI""",vasconceloscezar/auto-gpt-tests,https://github.com/vasconceloscezar/auto-gpt-tests,2023-04-12T17:22:51+00:00,2025-05-27T00:29:35+00:00,2023-04-16T03:01:00+00:00,Python,13,2,13,0,False,[],Tests of how we can gather the most out of AutoGPT. Huge thanks to @Torantulino for this
281,"""responsible"" AND ""AI""",haotian-liu/transformers_llava,https://github.com/haotian-liu/transformers_llava,2023-04-17T19:41:36+00:00,2024-07-18T08:51:42+00:00,2023-04-28T21:37:02+00:00,Python,13,5,13,0,False,[],
282,"""responsible"" AND ""AI""",pberrone/autogpt,https://github.com/pberrone/autogpt,2023-04-07T07:17:22+00:00,2023-04-25T15:16:48+00:00,2023-04-07T07:18:10+00:00,Python,10,2,10,0,False,[],
283,"""responsible"" AND ""AI""",chenxingqiang/awsome-openai-paper,https://github.com/chenxingqiang/awsome-openai-paper,2023-04-20T06:09:04+00:00,2025-05-24T11:15:45+00:00,2023-05-09T21:05:21+00:00,Python,10,4,10,0,False,"['awsome', 'html', 'openai', 'paper', 'python', 'ai', 'cli', 'deep-learning', 'detection', 'framework', 'machine-learning', 'neural-network', 'papers', 'physics', 'point-cloud', 'research', 'tool', 'web']","openai paper searching focusing on Author relate to OpenAI, openai paper searching, awsome-openai-paper."
284,"""responsible"" AND ""AI""",dsdanielpark/Bard-API,https://github.com/dsdanielpark/Bard-API,2023-05-11T17:54:48+00:00,2025-05-30T17:50:34+00:00,2024-04-24T10:38:31+00:00,Python,5263,520,5263,3,False,"['google-bard', 'google-bard-python', 'chatbot', 'nlp', 'google', 'llm', 'api', 'bard', 'ai-api', 'googlebard', 'bard-api', 'google-maps-api', 'google-bard-api']",The unofficial python package that returns response of Google Bard through cookie value.
285,"""responsible"" AND ""AI""",microsoft/azure-genai-design-patterns,https://github.com/microsoft/azure-genai-design-patterns,2023-05-08T16:53:34+00:00,2025-05-31T06:15:51+00:00,2024-10-14T16:53:03+00:00,Python,661,114,661,23,False,[],
286,"""responsible"" AND ""AI""",microsoft/deep-language-networks,https://github.com/microsoft/deep-language-networks,2023-05-26T15:58:04+00:00,2025-04-04T02:01:21+00:00,2024-07-25T11:25:46+00:00,Python,94,14,94,7,False,[],"We view Large Language Models as stochastic language layers in a network, where the learnable parameters are the natural language prompts at each layer. We stack two such layers, feeding the output of one layer to the next. We call the stacked architecture a Deep Language Network - DLN"
287,"""responsible"" AND ""AI""",aspekts/PoeAPI,https://github.com/aspekts/PoeAPI,2023-05-19T18:30:21+00:00,2025-04-18T02:25:38+00:00,2023-05-19T23:37:30+00:00,Python,66,7,66,1,False,"['claude-ai', 'claude-api', 'freechatgpt', 'freegpt', 'gpt-api', 'gpt3', 'gpt4-api', 'poe', 'chatgpt-api']","A self-hostable reverse engineering of Quora's Poe.com API, allowing free access to ChatGPT and Anthropic's Claude AI"
288,"""responsible"" AND ""AI""",plon/MusicLM,https://github.com/plon/MusicLM,2023-05-22T21:21:31+00:00,2025-04-27T02:30:39+00:00,2023-09-22T02:33:28+00:00,Python,48,4,48,1,False,[],Unofficial MusicLM API 
289,"""responsible"" AND ""AI""",icebaker/sublime-nano-bots,https://github.com/icebaker/sublime-nano-bots,2023-05-17T11:16:26+00:00,2025-05-15T10:32:35+00:00,2024-01-08T00:48:28+00:00,Python,36,1,36,4,False,"['alpaca', 'chatgpt', 'gpt', 'gpt-4', 'llama', 'llm', 'nano-bots', 'openai', 'openai-api', 'sublime-text', 'sublime-text-3', 'sublime-text-4', 'vicuna', 'gemini-ai', 'google-gemini', 'mistral', 'ollama', 'gemini-pro', 'maritaca-ai', 'cohere-ai']","Boost productivity and power your workflow with Nano Bots for Sublime Text: small, AI-powered bots that can be easily shared as a single file, designed to support multiple providers such as Cohere Command, Google Gemini, Maritaca AI MariTalk, Mistral AI, Ollama, OpenAI ChatGPT, and others, with support for calling tools (functions)."
290,"""responsible"" AND ""AI""",dSupertramp/AItrika,https://github.com/dSupertramp/AItrika,2023-05-08T12:29:14+00:00,2025-04-16T06:36:48+00:00,2024-10-24T14:53:34+00:00,Python,35,4,35,0,False,"['medicine', 'pubmed', 'python', 'llm', 'llms', 'nlp', 'chatgpt', 'entity-extractor', 'huggingface', 'medical-application', 'langchain', 'llama-index', 'rag', 'pandas', 'prompt', 'prompt-engineering', 'retrieval-augmented-generation', 'ai', 'machine-learning', 'neural-network']",Enhance your knowledge in medical research with the help of LLM and RAG.
291,"""responsible"" AND ""AI""",avocardio/Zicklein,https://github.com/avocardio/Zicklein,2023-05-20T14:29:38+00:00,2024-11-24T15:10:55+00:00,2023-08-31T12:21:22+00:00,Python,34,5,34,1,False,"['alpaca', 'finetuning', 'llama', 'llm', 'lora', 'language-model', 'german', 'ggml', 'llama2', 'meta']",Finetuning instruct-LLaMA on german datasets.
292,"""responsible"" AND ""AI""",Ayan-Nalawade/Chat,https://github.com/Ayan-Nalawade/Chat,2023-05-23T20:34:57+00:00,2025-04-23T00:38:22+00:00,2023-08-09T19:31:42+00:00,Python,34,1,34,0,False,[],"Access multiple models such as gpt-3/3.5, gpt-4, claude+, claude-instant, bard for free!"
293,"""responsible"" AND ""AI""",brokenmass/AIOLCDUnchained,https://github.com/brokenmass/AIOLCDUnchained,2023-05-20T10:05:06+00:00,2025-04-15T10:03:38+00:00,2024-11-07T08:58:53+00:00,Python,29,1,29,13,False,[],
294,"""responsible"" AND ""AI""",google-parfait/dataset_grouper,https://github.com/google-parfait/dataset_grouper,2023-05-26T18:20:41+00:00,2025-05-17T00:49:31+00:00,2024-12-11T21:42:35+00:00,Python,26,4,26,0,False,"['apache-beam', 'datasets', 'federated-learning', 'jax', 'pytorch', 'tensorflow', 'tensorflow-datasets']",Libraries for efficient and scalable group-structured dataset pipelines.
295,"""responsible"" AND ""AI""",Be-Secure/BeSPenTestGPT,https://github.com/Be-Secure/BeSPenTestGPT,2023-05-15T03:54:25+00:00,2024-11-27T18:11:49+00:00,2024-09-20T15:52:29+00:00,Python,25,2,25,0,False,[],"A Generative AI Project for Open Source Security Specialists ,Be-Secure GPT models to assist red teaming & blue teaming BeS Enviornments & BeS Playbooks."
296,"""responsible"" AND ""AI""",batmanlab/MICCAI-2023-Route-interpret-repeat-CXRs,https://github.com/batmanlab/MICCAI-2023-Route-interpret-repeat-CXRs,2023-05-26T19:45:20+00:00,2025-05-29T16:54:29+00:00,2024-03-20T18:04:59+00:00,Python,17,3,17,0,False,"['chestxray', 'chexpert', 'explainable-ai', 'interpretability', 'medical-imaging', 'miccai2023', 'mimic-cxr']","[MICCAI 2023, top 14%] Official repository of paper: Distilling BlackBox to Interpretable models for Efficient Transfer Learning"
297,"""responsible"" AND ""AI""",iantbutler01/ditty,https://github.com/iantbutler01/ditty,2023-05-20T22:12:43+00:00,2024-12-31T06:37:15+00:00,2024-10-27T00:00:48+00:00,Python,16,5,16,0,False,[],A library for simplifying fine tuning with multi gpu setups in the Huggingface ecosystem.
298,"""responsible"" AND ""AI""",MiniBossGPT/Mini-Boss,https://github.com/MiniBossGPT/Mini-Boss,2023-05-02T21:02:20+00:00,2023-08-13T05:38:24+00:00,2023-05-24T13:56:41+00:00,Python,14,1,14,0,False,[],MiniBossGPT
299,"""responsible"" AND ""AI""",cjpark-sapcsa/chatgpt-sap-aoai,https://github.com/cjpark-sapcsa/chatgpt-sap-aoai,2023-05-08T04:50:42+00:00,2024-05-01T12:58:46+00:00,2023-08-03T13:30:43+00:00,Python,11,3,11,0,False,[],
300,"""responsible"" AND ""AI""",oxai/debias-gensynth,https://github.com/oxai/debias-gensynth,2023-05-17T17:13:32+00:00,2024-12-13T08:02:02+00:00,2023-05-25T09:19:20+00:00,Python,11,1,11,0,False,"['bias', 'computer-vision', 'fairness', 'vision-language']",Balancing the Picture: Debiasing Vision-Language Datasets with Synthetic Contrast Sets
301,"""responsible"" AND ""AI""",h-aboutalebi/DeepfakeArt,https://github.com/h-aboutalebi/DeepfakeArt,2023-05-08T06:07:19+00:00,2025-01-07T13:21:11+00:00,2023-07-05T00:50:54+00:00,Python,10,2,10,0,False,[],
302,"""responsible"" AND ""AI""",s0md3v/sd-webui-roop,https://github.com/s0md3v/sd-webui-roop,2023-06-17T22:53:22+00:00,2025-05-31T00:03:25+00:00,2024-04-01T05:16:31+00:00,Python,3493,607,3493,133,False,"['face-swap', 'sd-webui', 'stable-diffusion', 'roop']",roop extension for StableDiffusion web-ui
303,"""responsible"" AND ""AI""",AkshitIreddy/Interactive-LLM-Powered-NPCs,https://github.com/AkshitIreddy/Interactive-LLM-Powered-NPCs,2023-06-27T02:28:34+00:00,2025-05-29T06:06:49+00:00,2024-03-22T07:00:47+00:00,Python,634,58,634,10,False,"['ai', 'artificial-intelligence', 'autonomous-agents', 'computer-vision', 'langchain', 'language-model', 'llm-agent', 'python', 'video-game']","Interactive LLM Powered NPCs, is an open-source project that completely transforms your interaction with non-player characters (NPCs) in any game! 🎮🤖🚀 "
304,"""responsible"" AND ""AI""",pentilm/AirCtrl,https://github.com/pentilm/AirCtrl,2023-06-19T17:48:29+00:00,2025-05-23T15:26:12+00:00,2023-06-19T18:01:55+00:00,Python,245,44,245,0,False,[],🤙 Control Your Mouse with Hand Gestures in the Air 🤙
305,"""responsible"" AND ""AI""",horizon3ai/CVE-2023-34362,https://github.com/horizon3ai/CVE-2023-34362,2023-06-09T19:07:32+00:00,2025-04-17T11:39:26+00:00,2023-06-26T20:24:32+00:00,Python,140,34,140,0,False,[],MOVEit CVE-2023-34362
306,"""responsible"" AND ""AI""",Abbey4799/CuteGPT,https://github.com/Abbey4799/CuteGPT,2023-06-21T07:04:21+00:00,2025-05-21T00:48:54+00:00,2023-10-12T12:31:33+00:00,Python,65,3,65,3,False,"['chatgpt', 'chinese-nlp', 'deep-learning', 'dialogue-systems', 'instruction-tuning', 'large-language-models', 'llama', 'llm', 'lora', 'natual-language-processing', 'nlp', 'text-generation']",An open-source conversational language model developed by the Knowledge Works Research Laboratory at Fudan University.
307,"""responsible"" AND ""AI""",meetkool/FREE-GPT-4,https://github.com/meetkool/FREE-GPT-4,2023-06-10T17:37:54+00:00,2025-03-04T03:31:03+00:00,2023-06-11T19:40:14+00:00,Python,61,11,61,2,False,"['chat-gpt', 'chat-gpt-desktop', 'chatbot', 'chatgpt', 'chatgpt-4', 'chatgpt-api', 'chatgpt-bot', 'chatgpt-free', 'gpt', 'gpt-4', 'gpt-4-api', 'gpt4', 'gpt4free', 'gpt4free-cop-', 'openai-gpt3', 'openai-gpt4', 'python']","FREEGPT4 is a python server that allows you to have a self-hosted GPT-4 Unlimited and Free WEB API, via the latest Bing's AI."
308,"""responsible"" AND ""AI""",ericzhang-cn/ailingbot,https://github.com/ericzhang-cn/ailingbot,2023-06-13T06:39:39+00:00,2025-05-06T00:43:46+00:00,2023-07-28T03:12:27+00:00,Python,60,6,60,1,False,"['ai', 'bot', 'chatgpt', 'langchain']",One-stop solution to empower your IM bot with AI.
309,"""responsible"" AND ""AI""",jidiai/GRF_MARL,https://github.com/jidiai/GRF_MARL,2023-06-07T06:50:22+00:00,2025-05-15T11:04:11+00:00,2024-05-19T19:51:01+00:00,Python,44,5,44,2,False,[],Google Research Football MARL Benchmark and Research Toolkit
310,"""responsible"" AND ""AI""",siayi/awesome-capstone-project,https://github.com/siayi/awesome-capstone-project,2023-06-18T06:09:47+00:00,2025-04-09T12:18:52+00:00,2023-07-20T14:50:53+00:00,Python,40,1,40,0,False,"['awesome', 'awesome-lists', 'bangkit', 'bangkit-academy', 'bangkit2023', 'capstone', 'capstone-project', 'bangkit-capstone-project', 'bangkit-capstone-project-2023', 'cloud-computing', 'machine-learning', 'mobile-development']",Awesome Capstone Project | Bangkit Academy 2023 
311,"""responsible"" AND ""AI""",AkshitIreddy/AI-Plays-God-of-War,https://github.com/AkshitIreddy/AI-Plays-God-of-War,2023-06-12T09:39:35+00:00,2025-05-17T16:31:08+00:00,2024-03-29T15:20:12+00:00,Python,39,9,39,1,False,"['artificial-intelligence', 'computer-vision', 'game', 'generative-ai', 'langchain', 'langchain-python', 'language-model', 'llm-agent', 'natural-language-processing']",LLM Agent paired with Image Captioning and Yolov8 models plays God of War
312,"""responsible"" AND ""AI""",nichochen/my-k8s-admin,https://github.com/nichochen/my-k8s-admin,2023-06-23T13:29:46+00:00,2024-05-28T14:18:44+00:00,2023-06-25T04:52:19+00:00,Python,27,1,27,0,False,[],My K8S Admin is a Large Language Models (LLMs)-powered Kubernetes admin assistant. 
313,"""responsible"" AND ""AI""",HowieHwong/TrustGPT,https://github.com/HowieHwong/TrustGPT,2023-06-09T03:42:54+00:00,2025-05-06T15:10:21+00:00,2023-10-12T09:17:43+00:00,Python,24,5,24,1,False,[],"Can We Trust Large Language Models?: A Benchmark for Responsible Large Language Models via Toxicity, Bias, and Value-alignment Evaluation"
314,"""responsible"" AND ""AI""",mytechnotalent/kgpt,https://github.com/mytechnotalent/kgpt,2023-06-04T14:26:31+00:00,2025-03-31T03:46:31+00:00,2023-06-19T01:51:59+00:00,Python,22,3,22,0,False,"['ai', 'artificial-intelligence', 'cyber', 'cybersecurity', 'generative-pre-trained-transformer', 'gpt', 'gpt-2', 'hack', 'hacking', 'machine-learning', 'reverse-engineering', 'tiktoken', 'transformer-architecture', 'transformer-models', 'transformers', 'chatgpt', 'chatgpt-api', 'chatbot', 'chatgpt-app']",A custom GPT based on [Zero To Hero](https://karpathy.ai/zero-to-hero.html) utilizing tiktoken with the intent to augment AI Transformer-model education and reverse engineer GPT models from scratch.
315,"""responsible"" AND ""AI""",Najmul190/Avarice-Selfbot,https://github.com/Najmul190/Avarice-Selfbot,2023-06-03T22:36:47+00:00,2025-05-27T21:32:27+00:00,2023-07-19T21:12:50+00:00,Python,21,12,21,0,False,"['ai', 'ai-image-generation', 'avarice', 'chatgpt', 'discord', 'discord-bot', 'discord-exploit', 'discord-py', 'discord-tool', 'discordselfbot', 'exploit', 'free', 'selfbot', 'selfbot-discord', 'selfbot-for-discord', 'avarice-selfbot']","A free, completely open-source and powerful selfbot allowing you to fully reach the potential of Discord. Includes numerous commands designed for fun, trolling, raiding but mostly to improve your Discord experience. Even includes an AI chatbot along with image generation."
316,"""responsible"" AND ""AI""",TamerinTECH/VoiceBotChatGPT-RaspberryPI,https://github.com/TamerinTECH/VoiceBotChatGPT-RaspberryPI,2023-06-11T17:42:56+00:00,2025-02-22T15:33:21+00:00,2023-07-12T18:28:46+00:00,Python,21,3,21,1,False,[],"Using OpenAI ChatGPT and Whisper, together with AWS Polly to build a voice assistant on Raspberry PI 4"
317,"""responsible"" AND ""AI""",soos3d/chat-with-repo-langchain-openai,https://github.com/soos3d/chat-with-repo-langchain-openai,2023-06-03T20:47:41+00:00,2025-01-07T08:49:10+00:00,2023-06-04T20:52:17+00:00,Python,19,3,19,1,False,[],"This project allows you to plug in a GitHub repository URL, generate vectors for a LLM and use ChatGPT models to interact. The main framework used is Langchain."
318,"""responsible"" AND ""AI""",daveshap/EU_AI_Act,https://github.com/daveshap/EU_AI_Act,2023-06-15T10:50:53+00:00,2025-02-21T15:56:58+00:00,2023-06-15T11:46:18+00:00,Python,16,7,16,0,False,[],Let's decompose the EU AI Act with GPT
319,"""responsible"" AND ""AI""",YINYIPENG-EN/AI_face_swap,https://github.com/YINYIPENG-EN/AI_face_swap,2023-06-06T06:34:37+00:00,2025-04-10T11:47:32+00:00,2023-06-06T06:41:41+00:00,Python,15,2,15,0,False,[],"可直接选择一张人脸去替换另一张图片或者视频中的人脸。本项目仅提供人脸替换部分，不需要数据集，不用训练！(You can directly select a face to replace the face in another image or video. This project only provides facial replacement parts, no dataset required, no training required!)"
320,"""responsible"" AND ""AI""",vinura/cover_generator_app,https://github.com/vinura/cover_generator_app,2023-06-27T07:52:52+00:00,2025-02-13T11:07:29+00:00,2023-06-27T12:55:38+00:00,Python,14,7,14,0,False,"['documentation-generator', 'llm']",Cover Letter Generator using CV and LinkedIn Job Posting
321,"""responsible"" AND ""AI""",tleers/serverless-llm-app-factory,https://github.com/tleers/serverless-llm-app-factory,2023-06-13T15:30:45+00:00,2025-02-10T16:09:30+00:00,2023-09-03T13:48:00+00:00,Python,13,2,13,0,False,"['deployment', 'examples', 'flyio', 'llm', 'llmops', 'llms', 'replicate', 'serverless']",Beginner-friendly serverless LLM deployment with Replicate & fly.io
322,"""responsible"" AND ""AI""",saluberis/Wizard-Vicuna-30B-Uncensored,https://github.com/saluberis/Wizard-Vicuna-30B-Uncensored,2023-06-02T13:34:19+00:00,2025-01-11T01:08:10+00:00,2023-06-02T13:35:02+00:00,Python,12,8,12,2,False,[],
323,"""responsible"" AND ""AI""",MaxineXiong/ImageAI-Flask-Apps,https://github.com/MaxineXiong/ImageAI-Flask-Apps,2023-06-12T09:40:47+00:00,2025-04-16T08:04:38+00:00,2024-06-26T12:08:12+00:00,Python,12,6,12,0,False,"['computer-vision', 'flask', 'image-recognition', 'imageai', 'python', 'video-object-detection', 'ai-project', 'pandas-dataframe', 'css3', 'html5', 'pandas', 'data-visualization', 'flask-application', 'matplotlib-pyplot', 'moviepy']","This project offers two Flask applications that utilize ImageAI's image prediction algorithms and object detection models. These apps enable users to upload images and videos for object recognition, detection and analysis, providing accurate prediction results, confidence scores, raw data of detected objects at frame-level, and object insights."
324,"""responsible"" AND ""AI""",maxbot-ai/taxi_bot,https://github.com/maxbot-ai/taxi_bot,2023-06-28T14:27:14+00:00,2024-11-05T10:56:32+00:00,2023-06-28T19:36:59+00:00,Python,12,0,12,0,False,"['chatbot', 'maxbot', 'taxi']",Maxbot taxi bot example
325,"""responsible"" AND ""AI""",IBM/mlmonitor,https://github.com/IBM/mlmonitor,2023-06-19T15:44:02+00:00,2025-01-17T20:23:10+00:00,2025-05-08T00:41:25+00:00,Python,11,6,11,1,False,[],"orchestrate ML model deployments, monitoring and governance for Cloud Pak for Data and other Data & AI platforms faster."
326,"""responsible"" AND ""AI""",ExecutableMarley/roop-auto,https://github.com/ExecutableMarley/roop-auto,2023-06-02T13:53:20+00:00,2024-08-12T20:31:34+00:00,2023-07-01T19:20:10+00:00,Python,10,1,10,0,False,[],one-click deepfake (face swap)
327,"""responsible"" AND ""AI""",microsoft/Llama-2-Onnx,https://github.com/microsoft/Llama-2-Onnx,2023-07-17T21:01:49+00:00,2025-05-17T16:31:52+00:00,2024-01-04T00:46:46+00:00,Python,1025,95,1025,25,False,[],
328,"""responsible"" AND ""AI""",soulteary/docker-llama2-chat,https://github.com/soulteary/docker-llama2-chat,2023-07-19T15:10:44+00:00,2025-04-29T06:57:42+00:00,2023-08-14T09:21:22+00:00,Python,542,84,542,11,False,"['llama', 'llama2', 'llm', 'llama2-docker', 'llama2-playground']",Play LLaMA2 (official / 中文版 / INT4 / llama2.cpp) Together! ONLY 3 STEPS! ( non GPU / 5GB vRAM / 8~14GB vRAM)
329,"""responsible"" AND ""AI""",Audio-AGI/WavJourney,https://github.com/Audio-AGI/WavJourney,2023-07-26T16:57:25+00:00,2025-05-20T17:55:53+00:00,2023-09-28T21:21:18+00:00,Python,536,43,536,0,False,[],WavJourney: Compositional Audio Creation with LLMs
330,"""responsible"" AND ""AI""",kyegomez/Med-PaLM,https://github.com/kyegomez/Med-PaLM,2023-07-31T00:11:49+00:00,2025-05-31T16:10:30+00:00,2024-02-17T09:07:00+00:00,Python,389,54,389,9,False,"['biomedical', 'deep-learning', 'gpt4', 'multimodal', 'multimodal-deep-learning', 'multimodality', 'opensource']",Towards Generalist Biomedical AI
331,"""responsible"" AND ""AI""",vicjor/aws-saa-c03,https://github.com/vicjor/aws-saa-c03,2023-07-11T13:53:39+00:00,2025-06-02T09:40:18+00:00,2024-07-08T08:48:01+00:00,Python,258,124,258,0,False,"['aws', 'cloud', 'solutions-architect', 'study-guide', 'aws-saa-c03']",Comprehensive collection of my personal study notes and resources for the AWS Certified Solutions Architect - Associate (SAA-C03) Exam. Aimed to aid anyone on their journey to becoming an AWS Certified Solutions Architect.
332,"""responsible"" AND ""AI""",RCGAI/SimplyRetrieve,https://github.com/RCGAI/SimplyRetrieve,2023-07-24T09:31:40+00:00,2025-05-23T03:06:02+00:00,2024-02-14T04:29:36+00:00,Python,209,13,209,4,False,"['generative-ai', 'large-language-models', 'retrieval-centric-generation', 'artificial-intelligence', 'machine-learning', 'natural-language-processing', 'nlp', 'retrieval-augmented-generation', 'chat-ai', 'huggingface', 'prompt-engineering']","Lightweight chat AI platform featuring custom knowledge, open-source LLMs, prompt-engineering, retrieval analysis. Highly customizable. For Retrieval-Centric & Retrieval-Augmented Generation."
333,"""responsible"" AND ""AI""",harishsg993010/DamnVulnerableLLMProject,https://github.com/harishsg993010/DamnVulnerableLLMProject,2023-07-06T14:11:29+00:00,2025-05-13T14:33:10+00:00,2023-08-02T16:53:50+00:00,Python,149,23,149,1,False,[],A LLM explicitly designed for getting hacked
334,"""responsible"" AND ""AI""",edmar/whenx,https://github.com/edmar/whenx,2023-07-03T18:49:38+00:00,2025-04-13T12:04:55+00:00,2023-07-03T18:49:51+00:00,Python,52,7,52,0,False,"['ai', 'autogpt', 'autonomous-agents', 'babyagi', 'gpt-3', 'gpt-4', 'llm']","Event-Driven Autonomous Agents. create alerts in the form of ""When X happens, then do Y"". In this initial version, we are only supporting email alerts in the form of ""When X happens, send me an email report""."
335,"""responsible"" AND ""AI""",birdup000/poe-server,https://github.com/birdup000/poe-server,2023-07-11T16:40:19+00:00,2024-05-25T12:52:09+00:00,2023-07-26T06:24:52+00:00,Python,45,5,45,5,False,[],Poe-Server-Reverse-API-Python
336,"""responsible"" AND ""AI""",samshapley/OrchestrAI,https://github.com/samshapley/OrchestrAI,2023-07-31T12:26:40+00:00,2025-02-21T15:57:13+00:00,2024-02-14T16:40:16+00:00,Python,35,5,35,1,False,[],A framework for building and testing custom autonomous agents.
337,"""responsible"" AND ""AI""",andyweaves/system-tables-audit-logs,https://github.com/andyweaves/system-tables-audit-logs,2023-07-17T11:17:12+00:00,2025-05-06T16:54:16+00:00,2024-10-11T14:07:01+00:00,Python,28,13,28,3,False,[],SQL Queries & Alerts for Databricks System Tables access.audit Logs
338,"""responsible"" AND ""AI""",jbdamask/wkid-smaaht,https://github.com/jbdamask/wkid-smaaht,2023-07-15T18:06:29+00:00,2024-01-31T11:32:03+00:00,2024-01-31T14:08:07+00:00,Python,22,0,22,18,False,[],Because every team needs a townie! Enjoy ChatGPT in your Slack workspace
339,"""responsible"" AND ""AI""",fragmen646/sd-webui-roop-nsfw,https://github.com/fragmen646/sd-webui-roop-nsfw,2023-07-05T16:07:30+00:00,2025-03-18T18:29:57+00:00,2023-08-24T12:03:36+00:00,Python,18,3,18,0,False,[],
