total_index,keyword_source,full_name,html_url,create_date,update_date,pushed_date,language,stars,forks,watchers,open_issues,is_fork,topics,description
417,"""responsible"" AND ""AI""",mikepsinn/positron,https://github.com/mikepsinn/positron,2023-12-01T19:03:49+00:00,2025-05-21T19:45:59+00:00,2024-05-20T21:33:04+00:00,Python,13,1,13,2,False,"['ai', 'automation', 'autonomous-agents', 'non-profit', 'public-goods']",AI Agents for Semi-Autonomous Public Goods Production
418,"""responsible"" AND ""AI""",VK-Ant/PDF_CSV_VISION_DRAGGING_BASED_CHATBOT_WITH_TRANSLATOR_AUDIO_USING_GEMINIAI,https://github.com/VK-Ant/PDF_CSV_VISION_DRAGGING_BASED_CHATBOT_WITH_TRANSLATOR_AUDIO_USING_GEMINIAI,2023-12-14T05:57:07+00:00,2025-03-13T18:27:29+00:00,2024-05-17T16:48:41+00:00,Python,11,7,11,0,False,[],"GeminiAPI_PALM_Chatbot (Audio, Vision, Prompt, Multiple-PDF and addon translator)"
419,"""responsible"" AND ""AI""",thammuio/doc-genius-ai,https://github.com/thammuio/doc-genius-ai,2023-12-19T19:59:19+00:00,2025-01-08T13:56:02+00:00,2025-03-22T23:50:13+00:00,Python,11,6,11,0,False,"['genai', 'genai-chatbot', 'llm', 'cloudera', 'machine-learning', 'cloudera-machine-learning', 'cml', 'ai-agents', 'data-analytics', 'document-processing', 'retrieval-augmented-generation', 'enterprise-ai-solutions']",DocGenius AI - Generative AI Chatbot for your Documents
420,"""responsible"" AND ""AI""",atiilla/geospy,https://github.com/atiilla/geospy,2024-01-22T16:58:28+00:00,2025-06-01T06:00:28+00:00,2024-06-01T15:35:22+00:00,Python,368,42,368,1,False,"['geolocation', 'image', 'osint']",Python tool using Graylark's AI-powered geo-location service to uncover the location where photos were taken.
421,"""responsible"" AND ""AI""",srikar-kodakandla/linkedin-easyapply-using-AI,https://github.com/srikar-kodakandla/linkedin-easyapply-using-AI,2024-01-07T13:48:49+00:00,2025-05-20T23:55:13+00:00,2024-04-13T15:04:46+00:00,Python,93,17,93,2,False,"['job-apply-using-ai', 'linkedin-ai', 'openai-linkedin', 'automation', 'bot', 'challenge', 'chrome', 'python', 'resume', 'scraper', 'automate', 'job', 'jobseeker', 'scraping', 'selenium', 'chatgpt', 'gpt', 'jobsearch', 'linkedin', 'gemini']","Automate your LinkedIn job applications with AI! This bot utilizes GPT models such as GPT-4, GPT-3.5, and Google's Gemini Pro for Easy Apply form filling, customizable to your preferences and job search criteria."
422,"""responsible"" AND ""AI""",microsoft/BIPIA,https://github.com/microsoft/BIPIA,2024-01-04T11:47:59+00:00,2025-05-27T10:27:48+00:00,2024-04-15T02:08:17+00:00,Python,68,7,68,2,False,['llm-security'],A benchmark for evaluating the robustness of LLMs and defenses to indirect prompt injection attacks.
423,"""responsible"" AND ""AI""",horizon3ai/CVE-2024-0204,https://github.com/horizon3ai/CVE-2024-0204,2024-01-23T20:16:14+00:00,2025-02-14T17:11:57+00:00,2024-01-23T20:33:30+00:00,Python,61,9,61,0,False,[],Authentication Bypass in GoAnywhere MFT
424,"""responsible"" AND ""AI""",aws-samples/deploy-streamlit-app,https://github.com/aws-samples/deploy-streamlit-app,2024-01-20T11:17:05+00:00,2025-05-31T21:00:05+00:00,2024-10-11T14:10:03+00:00,Python,59,24,59,3,False,[],
425,"""responsible"" AND ""AI""",RMNCLDYO/perplexity-ai-toolkit,https://github.com/RMNCLDYO/perplexity-ai-toolkit,2024-01-10T18:08:48+00:00,2025-06-01T02:53:04+00:00,2024-08-16T01:20:39+00:00,Python,57,8,57,0,False,"['perplexity', 'perplexity-ai', 'perplexityai', 'pplx', 'perplexity-api', 'chatbot', 'perplexity-labs', 'pplx-ai', 'llama', 'llama-3', 'llama3-1', 'llama-3-1', 'llama-3-1-70b-instruct', 'llama-3-1-8b-instruct', 'llama-3-1-sonar-large-128k-chat', 'llama-3-1-sonar-large-128k-online', 'llama-3-1-sonar-small-128k-chat', 'llama-3-1-sonar-small-128k-online', 'llama-3-1-sonar-huge-128k-online', 'perplexity-sonar']","A versatile CLI and Python wrapper for Perplexity's suite of large language models including their flagship 'Sonar' models (built on top of Meta's latest and most advanced open-source model 'Llama-3.1'). Streamline the creation of chatbots, and search the web with AI (in real-time) with ease."
426,"""responsible"" AND ""AI""",PacktPublishing/Generative-AI-Foundations-in-Python,https://github.com/PacktPublishing/Generative-AI-Foundations-in-Python,2024-01-11T06:52:10+00:00,2025-02-22T18:10:42+00:00,2024-08-13T06:33:03+00:00,Python,32,33,32,4,False,[],"Generative AI Foundations in Python, published by Packt"
427,"""responsible"" AND ""AI""",bdytx5/finetune_LLaVA,https://github.com/bdytx5/finetune_LLaVA,2024-01-29T15:49:30+00:00,2025-01-02T03:10:59+00:00,2024-01-29T15:50:04+00:00,Python,29,7,29,3,False,[],
428,"""responsible"" AND ""AI""",Wizardcoast/Linear_Alignment,https://github.com/Wizardcoast/Linear_Alignment,2024-01-21T07:31:35+00:00,2024-12-11T06:03:07+00:00,2024-05-19T12:43:05+00:00,Python,17,2,17,1,False,[],"This repo is reproduction resources for linear alignment paper, still working"
429,"""responsible"" AND ""AI""",teddy-f-47/self-learning-llm-public,https://github.com/teddy-f-47/self-learning-llm-public,2024-01-30T11:36:32+00:00,2025-03-10T12:57:57+00:00,2024-08-07T11:23:44+00:00,Python,16,2,16,0,False,[],
430,"""responsible"" AND ""AI""",zsxkib/cog-parakeet-rnnt-1.1b,https://github.com/zsxkib/cog-parakeet-rnnt-1.1b,2024-01-04T11:08:56+00:00,2025-05-17T16:21:44+00:00,2024-01-05T14:26:50+00:00,Python,15,2,15,0,False,[],nvidia/parakeet-rnnt-1.1b running in Replicate Cog container ⚙️
431,"""responsible"" AND ""AI""",Eyr3/PrivacyAsst,https://github.com/Eyr3/PrivacyAsst,2024-01-08T04:38:02+00:00,2025-03-27T09:34:43+00:00,2024-03-29T11:51:56+00:00,Python,13,2,13,0,False,[],PrivacyAsst: Safeguarding User Privacy in Tool-Using Large Language Model Agents (TDSC 2024)
432,"""responsible"" AND ""AI""",haonan3/ICML-2024-Oral-SilentBadDiffusion,https://github.com/haonan3/ICML-2024-Oral-SilentBadDiffusion,2024-01-07T07:59:20+00:00,2025-03-31T09:14:27+00:00,2024-11-22T03:17:16+00:00,Python,11,1,11,0,False,[],
433,"""responsible"" AND ""AI""",OxMarco/AI-dating-helper,https://github.com/OxMarco/AI-dating-helper,2024-01-17T23:40:37+00:00,2025-04-07T05:37:06+00:00,2024-01-18T00:00:15+00:00,Python,11,3,11,0,False,"['ai', 'chatgpt-api', 'dating']",Automate dating apps with AI
434,"""responsible"" AND ""AI""",KxPlaug/TAA-Bench,https://github.com/KxPlaug/TAA-Bench,2024-01-08T13:10:58+00:00,2024-10-08T17:08:36+00:00,2024-02-01T06:46:58+00:00,Python,10,1,10,0,False,[],
435,"""responsible"" AND ""AI""",X-PLUG/Multi-LLM-Agent,https://github.com/X-PLUG/Multi-LLM-Agent,2024-02-01T03:53:15+00:00,2025-05-31T19:02:29+00:00,2024-04-23T07:43:32+00:00,Python,222,25,222,5,False,[],
436,"""responsible"" AND ""AI""",jxnl/n-levels-of-rag,https://github.com/jxnl/n-levels-of-rag,2024-02-26T17:24:29+00:00,2025-05-23T14:06:40+00:00,2024-05-05T16:18:49+00:00,Python,194,11,194,5,False,[],
437,"""responsible"" AND ""AI""",build-on-aws/bedrock-agent-txt2sql,https://github.com/build-on-aws/bedrock-agent-txt2sql,2024-02-11T01:52:59+00:00,2025-05-19T20:29:58+00:00,2024-11-06T12:49:59+00:00,Python,77,19,77,1,False,"['bedrock', 'bedrock-agent', 'txt2sql']",Use natural language to Generate Amazon Athena SQL queries to fetch data.
438,"""responsible"" AND ""AI""",yaojin17/Unlearning_LLM,https://github.com/yaojin17/Unlearning_LLM,2024-02-26T02:46:44+00:00,2025-05-31T06:51:34+00:00,2024-09-30T01:22:07+00:00,Python,57,4,57,3,False,"['data-privacy', 'llm', 'machine-unlearning', 'unlearning', 'llm-unlearning', 'copyright-protection']","[ACL 2024] Code and data for ""Machine Unlearning of Pre-trained Large Language Models"""
439,"""responsible"" AND ""AI""",haizelabs/redteaming-resistance-benchmark,https://github.com/haizelabs/redteaming-resistance-benchmark,2024-02-11T23:35:02+00:00,2025-05-28T06:33:49+00:00,2024-08-03T06:12:48+00:00,Python,44,5,44,0,False,[],
440,"""responsible"" AND ""AI""",k0yt/Awesome-InfoSec-TG-channels,https://github.com/k0yt/Awesome-InfoSec-TG-channels,2024-02-09T02:16:43+00:00,2025-03-14T21:20:39+00:00,2024-10-30T13:16:45+00:00,Python,31,2,31,0,False,[],"For the most part, these are RUS tg channels and assembled manually in channels.txt. The list of subscribers is updated every 12 hours. "
441,"""responsible"" AND ""AI""",noxhirsch/Pyscript-Philips-Airfryer,https://github.com/noxhirsch/Pyscript-Philips-Airfryer,2024-02-04T14:53:52+00:00,2025-05-10T17:17:58+00:00,2024-02-10T09:33:59+00:00,Python,30,1,30,3,False,[],A pyscript for Home Assistant to control Philips Airfryers
442,"""responsible"" AND ""AI""",mburaksayici/FinancialAdvisorGPT,https://github.com/mburaksayici/FinancialAdvisorGPT,2024-02-20T17:45:48+00:00,2025-05-23T13:09:54+00:00,2024-06-04T14:16:12+00:00,Python,29,5,29,0,False,[],"Boilerplate RAG and LLM in financial analysis.  MongoDB, MongoDB VectorDB, Chroma, FastAPI, Langchain, and React submodule for UI."
443,"""responsible"" AND ""AI""",lfbraz/semantic-kernel-nltosql,https://github.com/lfbraz/semantic-kernel-nltosql,2024-02-19T14:28:54+00:00,2025-04-18T21:43:43+00:00,2024-05-23T13:14:20+00:00,Python,19,12,19,2,False,[],
444,"""responsible"" AND ""AI""",latekvo/ResearchChain,https://github.com/latekvo/ResearchChain,2024-02-06T22:20:03+00:00,2025-03-04T15:58:43+00:00,2024-07-27T19:57:34+00:00,Python,19,3,19,3,False,"['ai', 'langchain', 'llm', 'rag', 'react', 'research', 'automation']","An AI toolkit for performing complex internet lookups, crawls and summaries. It utilizes and constantly expands it's knowledge stores with each lookup. Comes boundled with a WebUI, and a set of independant workers. "
445,"""responsible"" AND ""AI""",ksharlandjiev/bedrock-summarize-audio-video-text,https://github.com/ksharlandjiev/bedrock-summarize-audio-video-text,2024-02-21T12:43:06+00:00,2025-04-22T15:40:33+00:00,2024-09-27T08:55:26+00:00,Python,19,5,19,0,False,[],"This project automates the text extraction, transcription and summarization of audio, video, and documents using Amazon Bedrock, Amazon Transcribe, Amazon Textract and other AWS services. You can have a summarization or interactive chat with Amazon Bedrock on a given content. Or why not both together :)"
446,"""responsible"" AND ""AI""",horizon3ai/SecureConnect-Auth-Bypass,https://github.com/horizon3ai/SecureConnect-Auth-Bypass,2024-02-20T21:58:04+00:00,2025-05-23T21:54:00+00:00,2024-02-20T22:15:15+00:00,Python,13,2,13,0,False,[],An exploit proof of concept for ConnectWise SecureConnect authentication bypass vulnerability.
447,"""responsible"" AND ""AI""",SDGClassification/benchmark,https://github.com/SDGClassification/benchmark,2024-02-18T09:14:44+00:00,2025-04-28T21:58:53+00:00,2024-07-13T06:41:47+00:00,Python,12,2,12,0,False,[],SDG Classification Benchmarking Dataset
448,"""responsible"" AND ""AI""",trusthlt/eacl24-german-legal-questions,https://github.com/trusthlt/eacl24-german-legal-questions,2024-02-02T08:53:19+00:00,2025-05-21T09:32:41+00:00,2024-03-02T11:34:47+00:00,Python,11,2,11,0,False,[],"Data and code: ""Answering legal questions from laymen in German civil law system"", Büttner & Habernal, EACL'24"
449,"""responsible"" AND ""AI""",nuaazs/AskLLM,https://github.com/nuaazs/AskLLM,2024-02-05T07:03:45+00:00,2025-02-11T17:47:47+00:00,2024-03-28T23:58:50+00:00,Python,10,4,10,0,False,[],"AI-driven, adaptive customer service agent."
450,"""responsible"" AND ""AI""",olive-robotics/bots_bento_icra24,https://github.com/olive-robotics/bots_bento_icra24,2024-02-14T11:07:35+00:00,2025-02-17T12:03:17+00:00,2024-08-13T09:53:08+00:00,Python,10,1,10,1,False,[],
451,"""responsible"" AND ""AI""",DoMusic/Hybrid-Net,https://github.com/DoMusic/Hybrid-Net,2024-03-26T07:21:35+00:00,2025-05-29T00:25:25+00:00,2024-08-15T11:54:19+00:00,Python,692,32,692,3,False,[],"Real-time audio to chords, lyrics, beat, and melody."
452,"""responsible"" AND ""AI""",HyperGAI/HPT,https://github.com/HyperGAI/HPT,2024-03-19T01:31:08+00:00,2025-05-30T06:27:20+00:00,2024-06-06T01:57:52+00:00,Python,316,22,316,9,False,"['generative-ai', 'multimodal', 'vision-and-language']",HPT - Open Multimodal LLMs from HyperGAI
453,"""responsible"" AND ""AI""",harpreetsahota204/awesome-cvpr-2024,https://github.com/harpreetsahota204/awesome-cvpr-2024,2024-03-28T19:59:04+00:00,2025-03-25T13:30:03+00:00,2024-06-13T18:16:13+00:00,Python,142,9,142,0,False,"['awesome', 'awesome-list', 'awesome-lists', 'awesome-readme', 'computervision', 'cvpr', 'cvpr2024', 'diffusion', 'multimodal']","🤩 An AWESOME Curated List of Papers, Workshops, Datasets, and Challenges from CVPR 2024"
454,"""responsible"" AND ""AI""",MaybeChiku/Worm-GPT,https://github.com/MaybeChiku/Worm-GPT,2024-03-28T14:01:40+00:00,2025-06-02T00:03:26+00:00,2024-12-15T13:10:32+00:00,Python,78,13,78,2,False,[],WormGPT is a malicious AI tool promoted on the dark web as the adversary of ChatGPT. Used by Black Hat Hacker in Hacking 
455,"""responsible"" AND ""AI""",sirji-ai/sirji,https://github.com/sirji-ai/sirji,2024-03-18T05:51:46+00:00,2025-05-12T10:26:24+00:00,2024-09-17T05:48:18+00:00,Python,73,20,73,10,False,"['ai', 'ai-agents', 'vscode-extension']",Sirji is a framework to build & run custom AI agents for your everyday dev tasks.
456,"""responsible"" AND ""AI""",hankerspace/YASGU,https://github.com/hankerspace/YASGU,2024-03-15T16:10:40+00:00,2025-05-27T15:51:10+00:00,2024-03-20T17:20:45+00:00,Python,60,11,60,3,False,"['auto', 'generation', 'llm', 'python', 'shorts', 'upload', 'video', 'youtube']",YASGU : Youtube Automatised Shorts Generator And Uploader. YASGU is a tool to generate and upload Youtube Shorts videos automatically.
457,"""responsible"" AND ""AI""",RMNCLDYO/claude-ai-toolkit,https://github.com/RMNCLDYO/claude-ai-toolkit,2024-03-04T22:15:51+00:00,2025-05-29T06:19:39+00:00,2024-10-22T16:22:28+00:00,Python,50,11,50,2,False,"['anthropic', 'anthropic-claude', 'anthropicclaude', 'chatbot', 'claude', 'claude-2', 'claude-ai', 'claude-api', 'claude-3', 'claude-3-haiku', 'claude-3-opus', 'claude-3-sonnet', 'claude3', 'anthropic-ai', 'anthropicai', 'claude-haiku', 'claude-opus', 'claude-sonnet', 'claude-3-5', 'claude-3-5-sonnet']","A versatile CLI and Python wrapper for Anthropic's latest Claude 3.5 'Sonnet' model, along with the Claude 3 'Opus', 'Sonnet' and 'Haiku' language models. Streamline the creation of chatbots, generate dynamic text, and analyze images with ease."
458,"""responsible"" AND ""AI""",DEVILENMO/DeadEye-Auto-Aiming-System,https://github.com/DEVILENMO/DeadEye-Auto-Aiming-System,2024-03-07T04:14:52+00:00,2025-05-28T09:48:35+00:00,2024-06-17T09:06:36+00:00,Python,50,11,50,2,False,"['aimbot', 'autoaim', 'python', 'yolo', 'yolov8', 'chinese', 'english', 'apex', 'overwatch', 'target-tracking']","基于Yolo的辅助瞄准系统，高度模块化编写，也可以用于光学控制、监控物体追踪等领域，持续更新中，仅供交流学习使用。An auto-aiming system, or aim bot, which is mainly based on Yolo. Can be easily used in different areas such as optical control, monitoring object tracking. I will keep fixing bugs and adding new features."
459,"""responsible"" AND ""AI""",horizon3ai/CVE-2023-48788,https://github.com/horizon3ai/CVE-2023-48788,2024-03-18T20:50:48+00:00,2025-04-30T00:01:12+00:00,2024-03-20T20:42:41+00:00,Python,48,11,48,0,False,[],Fortinet FortiClient EMS SQL Injection
460,"""responsible"" AND ""AI""",salah9003/Automated-Vulnerability-Scanning-with-Agentic-AI,https://github.com/salah9003/Automated-Vulnerability-Scanning-with-Agentic-AI,2024-03-26T03:03:03+00:00,2025-04-28T11:26:48+00:00,2024-04-06T22:01:20+00:00,Python,43,12,43,4,False,"['agent', 'ai', 'ai-agents', 'security']","The system consists of multiple AI agents that collaborate to strategize, generate commands, and execute scans based on the client's description, without the need for human intervention."
461,"""responsible"" AND ""AI""",zillow/fair-housing-guardrail,https://github.com/zillow/fair-housing-guardrail,2024-03-07T18:24:35+00:00,2025-05-10T19:33:05+00:00,2024-11-25T01:34:36+00:00,Python,31,5,31,8,False,[],Fair Housing Guardrail
462,"""responsible"" AND ""AI""",RMNCLDYO/groq-ai-toolkit,https://github.com/RMNCLDYO/groq-ai-toolkit,2024-03-05T17:55:52+00:00,2025-01-06T05:59:50+00:00,2024-09-12T20:10:59+00:00,Python,22,4,22,1,False,"['artificial-intelligence', 'groq', 'groqapi', 'language-processing', 'large-language-models', 'lpu', 'mixtral-8x7b', 'groq-ai', 'groq-ai-api', 'groq-api', 'groqai', 'groqaiapi', 'language-processing-unit', 'languageprocessingunit', 'large-laguage-model', 'lpu-inference-engine', 'llama-3', 'llama3', 'llama3-70b-8192']",A versatile CLI and Python wrapper for Groq AI's breakthrough LPU Inference Engine. Streamline the creation of chatbots and generate dynamic text with speeds of up to 800 tokens/sec.
463,"""responsible"" AND ""AI""",KOSASIH/ExoGenesis,https://github.com/KOSASIH/ExoGenesis,2024-03-17T03:57:52+00:00,2025-05-26T09:08:15+00:00,2024-11-11T09:28:45+00:00,Python,20,0,20,0,False,"['mining', 'mining-massive-datasets', 'mining-software', 'mining-software-repositories']","Spearheading the integration of extraterrestrial resources with Pi Network, ExoGenesis provides a platform for developing space-based mining algorithms, satellite-based infrastructure, and interplanetary communication protocols, opening new frontiers for decentralized networks."
464,"""responsible"" AND ""AI""",SteveKGYang/MetaAligner,https://github.com/SteveKGYang/MetaAligner,2024-03-22T20:31:43+00:00,2025-05-31T07:41:43+00:00,2024-09-26T08:39:12+00:00,Python,19,2,19,1,False,"['alignment', 'gpt', 'human-preferences', 'large-language-models', 'llama2', 'natural-language-processing']","Models, data, and codes for the paper: MetaAligner: Towards Generalizable Multi-Objective Alignment of Language Models"
465,"""responsible"" AND ""AI""",NightTrek/mistral-backlinker,https://github.com/NightTrek/mistral-backlinker,2024-03-23T23:48:39+00:00,2025-03-31T10:52:46+00:00,2024-03-26T23:20:13+00:00,Python,18,4,18,0,False,"['ai', 'crewai', 'llm', 'mistralai', 'open-source']",Using AI agents to research customers and write them personalized sales emails
466,"""responsible"" AND ""AI""",connor-john/ai-docs,https://github.com/connor-john/ai-docs,2024-03-27T00:49:47+00:00,2025-05-18T07:25:53+00:00,2024-08-22T23:51:37+00:00,Python,14,1,14,0,False,"['ai', 'claude', 'documentation', 'llm']",Generate documentation with AI
467,"""responsible"" AND ""AI""",ronniebasak/ComfyUI-Tara-LLM-Integration,https://github.com/ronniebasak/ComfyUI-Tara-LLM-Integration,2024-04-06T18:45:07+00:00,2025-05-19T00:46:13+00:00,2024-11-18T05:08:11+00:00,Python,107,10,107,2,False,[],
468,"""responsible"" AND ""AI""",stefanom/fably,https://github.com/stefanom/fably,2024-04-14T23:37:23+00:00,2025-05-23T09:29:46+00:00,2024-07-18T07:50:16+00:00,Python,95,19,95,2,False,[],A device that tells bedtime stories to kids
469,"""responsible"" AND ""AI""",microsoft/assistant-pf-demo,https://github.com/microsoft/assistant-pf-demo,2024-04-30T12:32:46+00:00,2025-05-20T09:17:53+00:00,2024-07-09T12:03:42+00:00,Python,89,40,89,5,False,[],Demo for a Prompt Flow using OpenAI Assistants 
470,"""responsible"" AND ""AI""",fmiguelmmartins/crewaiyoutube,https://github.com/fmiguelmmartins/crewaiyoutube,2024-04-16T17:57:37+00:00,2025-05-08T05:49:26+00:00,2024-04-22T16:13:19+00:00,Python,29,9,29,1,False,[],
471,"""responsible"" AND ""AI""",samrand96/Undetectable-AI,https://github.com/samrand96/Undetectable-AI,2024-04-11T02:30:59+00:00,2025-04-25T03:12:33+00:00,2024-04-12T00:24:23+00:00,Python,28,12,28,2,False,"['no-ai-used', 'undetectable', 'anti-ai-detection', 'bypass-ai', 'bypassgpt', 'undetectable-ai']",Undetectable-AI: Easy yet powerful tool to rewrite docx so that won't be detected as AI-Written Text
472,"""responsible"" AND ""AI""",tac01337/ReaperAI,https://github.com/tac01337/ReaperAI,2024-04-19T20:24:09+00:00,2025-05-20T09:17:15+00:00,2024-06-04T18:20:52+00:00,Python,26,6,26,1,False,[],
473,"""responsible"" AND ""AI""",allenai/wildteaming,https://github.com/allenai/wildteaming,2024-04-02T19:38:22+00:00,2025-05-27T06:03:51+00:00,2024-08-10T07:40:12+00:00,Python,26,5,26,2,False,[],
474,"""responsible"" AND ""AI""",TylorShine/MNP-SVC,https://github.com/TylorShine/MNP-SVC,2024-04-06T03:20:36+00:00,2025-05-15T07:11:11+00:00,2024-11-03T06:53:55+00:00,Python,22,5,22,2,False,"['pytorch', 'singing-voice-conversion', 'voice-conversion']",Real-time end-to-end singing voice convertion
475,"""responsible"" AND ""AI""",mage-ai/machine_learning,https://github.com/mage-ai/machine_learning,2024-04-13T13:38:12+00:00,2025-05-12T10:05:21+00:00,2024-11-14T07:20:14+00:00,Python,19,5,19,0,False,"['artificial-intelligence', 'data-engineering', 'machine-learning']",The definitive end-to-end machine learning (ML lifecycle) guide and tutorial for data engineers.
476,"""responsible"" AND ""AI""",mawwalker/moss,https://github.com/mawwalker/moss,2024-04-05T06:58:37+00:00,2025-01-19T17:37:11+00:00,2024-04-06T14:01:48+00:00,Python,17,2,17,0,False,[],Moss: A voice assistant using LLM and Langchain which can control your home assistant and chat more.
477,"""responsible"" AND ""AI""",rohittp0/WatchPost,https://github.com/rohittp0/WatchPost,2024-04-10T20:00:10+00:00,2025-03-09T03:37:21+00:00,2024-05-28T00:42:37+00:00,Python,17,0,17,0,False,"['automation', 'gpt-3', 'linkedin', 'post-generator', 'content-cre']",WatchPost is an automated LinkedIn post creation tool that creates LinkedIn posts for you based on your activity on GitHub. It goes through your repos checks what happened in the last 24 hours and based on that writes you a LinkedIn post talking about what you have been up to since the last post.
478,"""responsible"" AND ""AI""",aws-solutions-library-samples/guidance-for-high-speed-rag-chatbots-on-aws,https://github.com/aws-solutions-library-samples/guidance-for-high-speed-rag-chatbots-on-aws,2024-04-09T16:18:03+00:00,2025-05-22T02:14:01+00:00,2024-10-19T07:27:33+00:00,Python,12,6,12,1,False,[],This Guidance demonstrates how to develop a high-performance Retrieval-Augmented Generation (RAG) chatbot by combining Amazon Aurora PostgreSQL-Compatible Edition with the open-source pgvector extension.
479,"""responsible"" AND ""AI""",FaceAdapter/Face-Adapter,https://github.com/FaceAdapter/Face-Adapter,2024-05-09T08:46:46+00:00,2025-05-18T01:37:19+00:00,2024-05-27T04:53:54+00:00,Python,374,29,374,21,False,[],
480,"""responsible"" AND ""AI""",Jing-yilin/E2M,https://github.com/Jing-yilin/E2M,2024-05-16T12:14:57+00:00,2025-05-08T08:33:04+00:00,2024-12-12T07:26:00+00:00,Python,136,17,136,2,False,"['api', 'llm', 'markdown', 'ocr', 'pdf']","E2M API, converting everything to markdown (LLM-friendly Format)."
481,"""responsible"" AND ""AI""",AnswerDotAI/cold-compress,https://github.com/AnswerDotAI/cold-compress,2024-05-20T18:39:19+00:00,2025-06-01T20:24:52+00:00,2024-08-09T18:05:25+00:00,Python,133,13,133,12,False,"['inference', 'llm', 'llm-inference', 'nlp', 'open-source']","Cold Compress is a hackable, lightweight, and open-source toolkit for creating and benchmarking cache compression methods built on top of GPT-Fast, a simple, PyTorch-native generation codebase."
482,"""responsible"" AND ""AI""",johndpope/MegaPortrait-hack,https://github.com/johndpope/MegaPortrait-hack,2024-05-11T12:26:30+00:00,2025-06-01T14:11:45+00:00,2024-11-04T03:40:29+00:00,Python,92,11,92,10,False,[],Using Claude Opus to reverse engineer code from MegaPortraits: One-shot Megapixel Neural Head Avatars 
483,"""responsible"" AND ""AI""",kaistAI/Janus,https://github.com/kaistAI/Janus,2024-05-28T01:06:48+00:00,2025-05-19T00:29:37+00:00,2024-12-04T07:59:08+00:00,Python,47,5,47,0,False,"['alignment', 'diversity', 'llm', 'mistral', 'preference']",[NeurIPS 2024] Train LLMs with diverse system messages reflecting individualized preferences to generalize to unseen system messages
484,"""responsible"" AND ""AI""",BXZZcj/TinyRobotBench,https://github.com/BXZZcj/TinyRobotBench,2024-05-23T06:19:59+00:00,2025-05-06T16:23:07+00:00,2024-06-01T08:01:01+00:00,Python,38,4,38,0,False,"['robot-operation', 'sapien', 'llm-configuration']",LLM guides robot operations 🦾💡
485,"""responsible"" AND ""AI""",horizon3ai/CVE-2024-23108,https://github.com/horizon3ai/CVE-2024-23108,2024-05-20T14:34:09+00:00,2025-03-18T17:59:18+00:00,2024-05-21T11:56:19+00:00,Python,32,6,32,0,False,[],CVE-2024-23108: Fortinet FortiSIEM Unauthenticated 2nd Order Command Injection
486,"""responsible"" AND ""AI""",horizon3ai/CVE-2023-34992,https://github.com/horizon3ai/CVE-2023-34992,2024-05-17T12:07:14+00:00,2025-04-19T03:34:56+00:00,2024-05-21T11:54:57+00:00,Python,26,6,26,0,False,[],CVE-2023-34992: Fortinet FortiSIEM Command Injection Proof of Concept Exploit
487,"""responsible"" AND ""AI""",astronomer/academy-genai,https://github.com/astronomer/academy-genai,2024-05-10T14:11:56+00:00,2025-05-31T12:45:37+00:00,2024-07-16T16:40:12+00:00,Python,19,9,19,1,False,[],
488,"""responsible"" AND ""AI""",nasa-jpl/cortex,https://github.com/nasa-jpl/cortex,2024-05-02T23:46:47+00:00,2025-04-30T04:05:04+00:00,2024-06-18T20:13:19+00:00,Python,19,1,19,0,False,"['database', 'robotics', 'ros', 'visualization']",Modern data infrastructure for robotics projects.
489,"""responsible"" AND ""AI""",web3bothub/nodepay-bot,https://github.com/web3bothub/nodepay-bot,2024-05-31T02:07:24+00:00,2025-03-20T12:59:44+00:00,2024-12-03T01:04:59+00:00,Python,18,11,18,1,False,"['nodepay-autofarm', 'nodepay-bot', 'nodepay-extension-bot', 'nodepay-farmer']","Auto ping bot for NodePay, with multi accounts and multi proxies support. https://app.nodepay.ai/register?ref=ffWdlWvILxU2eSW"
490,"""responsible"" AND ""AI""",GoogleCloudPlatform/data-sage-genai,https://github.com/GoogleCloudPlatform/data-sage-genai,2024-05-11T10:46:34+00:00,2025-04-10T02:58:33+00:00,2024-10-25T23:04:51+00:00,Python,14,7,14,2,False,[],
491,"""responsible"" AND ""AI""",AIOpsArena/aiopsarena,https://github.com/AIOpsArena/aiopsarena,2024-05-08T03:17:12+00:00,2025-04-25T08:40:11+00:00,2024-11-10T09:38:44+00:00,Python,14,2,14,0,False,[],
