total_index,keyword_source,full_name,html_url,create_date,update_date,pushed_date,language,stars,forks,watchers,open_issues,is_fork,topics,description
0,"""responsible"" AND ""AI""",aspiers/git-deps,https://github.com/aspiers/git-deps,2015-01-05T16:59:22+00:00,2025-05-04T15:11:06+00:00,2024-07-29T22:35:52+00:00,Python,301,52,301,61,False,"['git', 'dependency-analysis', 'graph', 'dependency-graph', 'commits', 'cli', 'visualization', 'web-app', 'd3', 'porting', 'revision-control']",git commit dependency analysis tool
1,"""responsible"" AND ""AI""",alemar11/ios-watchos-tvos-macos-resources,https://github.com/alemar11/ios-watchos-tvos-macos-resources,2015-08-12T15:51:46+00:00,2024-12-06T09:56:34+00:00,2023-01-23T09:41:26+00:00,Python,70,14,70,0,False,"['ios', 'macos', 'tvos', 'watchos', 'swift', 'swift-library', 'objective-c', 'swift-framework', 'swift-extensions', 'swift-language']","Updated list of Swift frameworks and libraries for iOS, watchOS, tvOS and macOS."
2,"""responsible"" AND ""AI""",noetl/noetl,https://github.com/noetl/noetl,2015-10-13T18:34:28+00:00,2025-04-03T04:26:49+00:00,2025-06-02T09:31:42+00:00,Python,11,2,11,1,False,[],NoETL (Not Only ETL) is a workflow management system designed to enable AI and machine learning functionality.
3,"""responsible"" AND ""AI""",aikaterna/aikaterna-cogs,https://github.com/aikaterna/aikaterna-cogs,2016-12-01T04:05:36+00:00,2025-06-01T18:54:32+00:00,2024-10-07T16:33:20+00:00,Python,110,98,110,27,False,"['red-discordbot', 'red-cogs']",Cogs for Red-DiscordBot by Twentysix26.
4,"""responsible"" AND ""AI""",tonybeltramelli/pix2code,https://github.com/tonybeltramelli/pix2code,2017-05-24T05:51:41+00:00,2025-05-28T05:06:22+00:00,2024-05-29T04:48:27+00:00,Python,12023,1446,12023,9,False,"['deep-learning', 'datasets', 'deep-neural-networks', 'front-end-development', 'graphical-user-interface']",pix2code: Generating Code from a Graphical User Interface Screenshot
5,"""responsible"" AND ""AI""",SISDevelop/SwarmPackagePy,https://github.com/SISDevelop/SwarmPackagePy,2017-05-30T07:39:09+00:00,2025-04-28T01:17:36+00:00,2020-07-03T07:36:00+00:00,Python,138,78,138,9,False,[],Library of swarm optimization algorithms.
6,"""responsible"" AND ""AI""",shaileshahuja/django-bot,https://github.com/shaileshahuja/django-bot,2017-05-15T16:32:15+00:00,2023-10-08T19:09:21+00:00,2022-12-07T23:57:08+00:00,Python,31,8,31,9,False,[],A lightweight django framework for bots
7,"""responsible"" AND ""AI""",cogitare-ai/cogitare,https://github.com/cogitare-ai/cogitare,2017-06-19T04:41:48+00:00,2024-10-10T19:58:00+00:00,2024-04-28T01:40:22+00:00,Python,77,11,77,22,False,"['pytorch', 'machine-learning', 'modular-deep-learning', 'deep-learning', 'framework', 'toolchain', 'toolbox']","🔥 Cogitare - A Modern, Fast, and Modular Deep Learning and Machine Learning framework for Python "
8,"""responsible"" AND ""AI""",roscisz/TensorHive,https://github.com/roscisz/TensorHive,2017-07-27T08:37:35+00:00,2025-04-17T06:03:32+00:00,2024-04-12T10:39:56+00:00,Python,162,28,162,86,False,"['hardware-management', 'hardware-monitoring', 'reservation', 'schedule', 'machine-learning', 'distributed', 'tensorflow', 'pytorch', 'deep-learning']",Tool for managing exclusive GPU access for distributed machine learning workloads
9,"""responsible"" AND ""AI""",sagar448/Self-Driving-Car-3D-Simulator-With-CNN,https://github.com/sagar448/Self-Driving-Car-3D-Simulator-With-CNN,2017-09-14T21:57:30+00:00,2025-05-14T17:12:18+00:00,2020-10-19T01:34:25+00:00,Python,167,55,167,2,False,"['self-driving-car', 'autonomous', 'cnn', 'python', 'keras', 'opencv']",Implementing a self driving car using a 3D Driving Simulator. CNN will be used for training
10,"""responsible"" AND ""AI""",pe2a/miniIOEx3G,https://github.com/pe2a/miniIOEx3G,2017-10-30T13:22:35+00:00,2024-09-20T09:35:52+00:00,2022-07-21T11:14:20+00:00,Python,17,7,17,0,False,"['raspberry-pi', 'shield', 'electronics-engineering', '3g']",Raspberry 3G Shield 
11,"""responsible"" AND ""AI""",amymcgovern/pyparrot,https://github.com/amymcgovern/pyparrot,2017-11-04T14:22:00+00:00,2025-05-27T08:59:57+00:00,2024-04-28T16:18:01+00:00,Python,281,131,281,75,False,[],Python interface for Parrot Drones
12,"""responsible"" AND ""AI""",HCIILAB/SCUT-FBP5500-Database-Release,https://github.com/HCIILAB/SCUT-FBP5500-Database-Release,2017-12-31T12:23:45+00:00,2025-05-30T01:20:13+00:00,2020-06-25T09:53:39+00:00,Python,770,144,770,11,False,[],A diverse benchmark database for multi-paradigm facial beauty prediction
13,"""responsible"" AND ""AI""",geoinsights/ChinaAQIData,https://github.com/geoinsights/ChinaAQIData,2018-01-30T14:50:01+00:00,2024-01-02T06:42:53+00:00,2021-08-28T14:18:50+00:00,Python,52,28,52,0,False,"['aqi', 'data-science', 'air-quality']",中国城市AQI数据(AQI Data of Cities in China)
14,"""responsible"" AND ""AI""",automagica/automagica,https://github.com/automagica/automagica,2018-02-08T14:03:17+00:00,2025-05-27T04:20:32+00:00,2020-10-13T16:14:04+00:00,Python,3055,483,3055,29,False,"['rpa', 'robot', 'python', 'ai', 'desktop-automation', 'office-automation', 'macros', 'web-automation', 'automation', 'automagica', 'automagica-portal', 'uipath', 'autoit']",AI-powered Smart Robotic Process Automation 🤖
15,"""responsible"" AND ""AI""",thoth-station/thoth,https://github.com/thoth-station/thoth,2018-02-08T07:47:50+00:00,2023-10-24T21:04:53+00:00,2020-06-29T19:19:51+00:00,Python,15,4,15,0,False,"['thoth', 'artificial-intelligence', 'hacktoberfest']",Platform for analyzing and recommending Python packages and Python software stacks not only for AI/ML applications
16,"""responsible"" AND ""AI""",weni-ai/bothub-engine,https://github.com/weni-ai/bothub-engine,2018-02-20T22:01:00+00:00,2024-11-16T01:51:35+00:00,2024-08-29T17:35:46+00:00,Python,13,9,13,12,False,"['bothub', 'rasa', 'rasa-nlu', 'rasa-core', 'rasa-chatbot', 'spacy', 'spacy-nlp', 'spacy-pipeline', 'spacy-models', 'ilhasoft', 'django', 'django-rest-framework', 'python', 'python3', 'docker', 'docker-compose', 'hacktoberfest-accepted', 'hacktoberfest']",
17,"""responsible"" AND ""AI""",Hyperclaw79/PokeBall-SelfBot-Poketwo-Autocatcher,https://github.com/Hyperclaw79/PokeBall-SelfBot-Poketwo-Autocatcher,2018-03-05T20:37:47+00:00,2025-05-24T19:26:44+00:00,2023-08-18T03:04:43+00:00,Python,339,393,339,3,False,"['discord-bot', 'discord', 'selfbot', 'pokeball-selfbot', 'pokecord', 'python', 'pokemon', 'catch-pokemon', 'pokecord-hack', 'pokecord-bot', 'autocatcher', 'auto-trade', 'pokecord-selfbot', 'poketwo', 'poketwo-bot', 'poketwo-selfbot', 'poketwo-hack']","This specific selfbot was designed to automatically catch pokemon spawned on Discord by Poketwo bot. It also offers other utility functions to automate features like trading, releasing, id search, etc. Currently the autocatcher is powered by AI making it possible to autocatch pokemons on multiple bots like PokeTwo, PokeRealm, etc."
18,"""responsible"" AND ""AI""",elasticdeeplearning/edl,https://github.com/elasticdeeplearning/edl,2018-03-02T21:45:19+00:00,2025-04-05T03:54:22+00:00,2023-07-05T21:02:26+00:00,Python,173,51,173,23,False,[],Elastic Deep Learning for deep learning framework on Kubernetes
19,"""responsible"" AND ""AI""",chris1869/freeciv-bot,https://github.com/chris1869/freeciv-bot,2018-03-02T04:36:08+00:00,2025-03-12T13:58:11+00:00,2023-08-14T23:35:54+00:00,Python,16,5,16,3,False,"['ai', 'bot-api', 'freeciv', 'board-game', 'python', 'machine-learning']",Bot for controlling freeciv via python (incl. initial experiments with neural networks)
20,"""responsible"" AND ""AI""",millennium-salander/ai_python_bot,https://github.com/millennium-salander/ai_python_bot,2018-03-01T11:20:45+00:00,2023-12-28T03:18:09+00:00,2020-03-25T22:52:40+00:00,Python,11,14,11,2,False,[],
21,"""responsible"" AND ""AI""",JonStratton/skill-aircrack,https://github.com/JonStratton/skill-aircrack,2018-05-10T01:57:37+00:00,2023-01-11T01:48:00+00:00,2022-06-01T13:51:16+00:00,Python,17,6,17,1,False,[],A mycroft skill wrapper around a subset of aircrack-ng
22,"""responsible"" AND ""AI""",uber/petastorm,https://github.com/uber/petastorm,2018-06-15T23:15:29+00:00,2025-05-29T04:21:40+00:00,2023-12-02T05:11:31+00:00,Python,1839,280,1839,177,False,"['tensorflow', 'pytorch', 'deep-learning', 'machine-learning', 'sysml', 'pyspark', 'pyarrow', 'parquet', 'parquet-files']","Petastorm library enables single machine or distributed training and evaluation of deep learning models from datasets in Apache Parquet format. It supports ML frameworks such as Tensorflow, Pytorch, and PySpark and can be used from pure Python code."
23,"""responsible"" AND ""AI""",Sjamilla/awesome-recruitment,https://github.com/Sjamilla/awesome-recruitment,2018-06-19T15:09:59+00:00,2025-05-30T21:49:00+00:00,2024-01-01T12:33:57+00:00,Python,500,209,500,2,False,"['recruiting', 'recruitment', 'sourcing', 'awesome-list', 'recruiter', 'talent-acquisition', 'hiring', 'tools', 'resources']",List of my favourite recruitment things 💫
24,"""responsible"" AND ""AI""",CT83/Facial-Recognition-Attendance-System,https://github.com/CT83/Facial-Recognition-Attendance-System,2018-07-31T14:05:01+00:00,2025-03-03T12:17:13+00:00,2020-05-23T02:10:27+00:00,Python,67,17,67,9,False,"['facial-recognition', 'attendance', 'paper', 'python', 'angular', 'opencv', 'face-api', 'microsoft', 'aws-s3', 'javascipt', 'django', 'django-rest-framework', 'algorithm', 'rest-api', 'machine-learning', 'deep-learning', 'face-recognition', 'face-detection', 'face-detection-using-opencv', 'microsoft-cognitive-services']",An attendance system which uses facial recognition to detect which people are present in any image.
25,"""responsible"" AND ""AI""",20chix/Autonomus_Indoor_Drone,https://github.com/20chix/Autonomus_Indoor_Drone,2018-07-22T21:31:02+00:00,2025-05-01T15:30:42+00:00,2023-01-03T16:31:23+00:00,Python,45,9,45,25,False,"['ros', 'autonomous-quadcoptor', 'gazebo', 'python', 'autonomous-navigation', 'raspberry-pi', 'dwm1001', 'navio2', 'ardupilot', 'ardupilot-gazebo', 'ros-melodic', 'autonomus-flight', 'mavros', 'rqt-reconfigure']","Final year project, autonomus indoor drone developed in ROS using DWM1001 dev-board"
26,"""responsible"" AND ""AI""",BogGyver/openpilot,https://github.com/BogGyver/openpilot,2018-08-01T16:19:40+00:00,2025-04-20T19:58:57+00:00,2024-01-23T12:46:17+00:00,Python,64,43,64,5,False,"['openpilot', 'tesla', 'self-driving-car', 'selfdrivingcar', 'selfdriving']",FOR PRE-AP/AP1/AP2 TESLA CARS ONLY: open source driving agent. You can help development by donating @ https://github.com/sponsors/BogGyver
27,"""responsible"" AND ""AI""",mukeshmithrakumar/RetinaNet,https://github.com/mukeshmithrakumar/RetinaNet,2018-09-03T00:45:41+00:00,2023-12-29T23:41:13+00:00,2021-07-17T23:39:22+00:00,Python,30,11,30,0,False,"['keras', 'retinanet', 'objectdetection', 'visualrelationshipdetection', 'google-ai-challange', 'resnet']",Keras implementation of RetinaNet for object detection and visual relationship identification
28,"""responsible"" AND ""AI""",google/uis-rnn,https://github.com/google/uis-rnn,2018-10-23T08:13:24+00:00,2025-05-27T17:49:53+00:00,2024-09-25T14:33:18+00:00,Python,1574,321,1574,12,False,"['speaker-diarization', 'uis-rnn', 'speaker-recognition', 'supervised-learning', 'clustering', 'supervised-clustering', 'machine-learning']","This is the library for the Unbounded Interleaved-State Recurrent Neural Network (UIS-RNN) algorithm, corresponding to the paper Fully Supervised Speaker Diarization."
29,"""responsible"" AND ""AI""",tzimasak/gym-airsim,https://github.com/tzimasak/gym-airsim,2018-10-28T08:03:47+00:00,2025-05-20T02:09:29+00:00,2020-06-22T11:37:38+00:00,Python,18,2,18,0,False,[],OpenAI Gym-compatible environments of AirSim for multirotor control in RL problems
30,"""responsible"" AND ""AI""",Flowminder/pytest-airflow,https://github.com/Flowminder/pytest-airflow,2018-10-23T01:43:33+00:00,2023-01-28T09:21:24+00:00,2021-04-20T18:22:04+00:00,Python,12,1,12,4,False,[],pytest support for airflow
31,"""responsible"" AND ""AI""",EthicalML/xai,https://github.com/EthicalML/xai,2019-01-11T20:00:09+00:00,2025-06-01T13:48:11+00:00,2021-10-30T06:35:19+00:00,Python,1175,179,1175,4,False,"['explainability', 'xai', 'ml', 'ai', 'bias', 'artificial-intelligence', 'bias-evaluation', 'explainable-ai', 'explainable-ml', 'machine-learning', 'machine-learning-explainability', 'interpretability', 'xai-library', 'evaluation', 'imbalance', 'upsampling', 'downsampling', 'feature-importance']",XAI - An eXplainability toolbox for machine learning
32,"""responsible"" AND ""AI""",fraunhoferportugal/tsfel,https://github.com/fraunhoferportugal/tsfel,2019-01-09T16:41:30+00:00,2025-05-30T08:22:10+00:00,2024-10-17T08:47:41+00:00,Python,1014,156,1014,13,False,"['feature-extraction', 'classification', 'time-series', 'colab-notebook', 'data-science', 'feature-engineering']",An intuitive library to extract features from time series.
33,"""responsible"" AND ""AI""",yuezunli/WIFS2018_In_Ictu_Oculi,https://github.com/yuezunli/WIFS2018_In_Ictu_Oculi,2019-01-04T02:25:48+00:00,2025-02-15T10:14:07+00:00,2023-10-23T00:45:55+00:00,Python,55,25,55,6,False,[],In Ictu Oculi: Exposing AI Created Fake Videos by Detecting Eye Blinking
34,"""responsible"" AND ""AI""",pawroman/links,https://github.com/pawroman/links,2019-01-13T22:06:32+00:00,2024-12-20T05:03:58+00:00,2023-10-20T13:21:03+00:00,Python,27,1,27,4,False,"['awesome', 'awesome-list', 'links', 'favorites']","Links to programming and software engineering related resources I found useful or interesting. A personal ""awesome list""."
35,"""responsible"" AND ""AI""",ICLRandD/Blackstone,https://github.com/ICLRandD/Blackstone,2019-03-25T11:18:33+00:00,2025-05-23T03:05:47+00:00,2024-07-16T15:12:39+00:00,Python,651,103,651,14,False,"['law', 'caselaw', 'nlp', 'spacy-models', 'legaltech']",:black_circle: A spaCy pipeline and model for NLP on unstructured legal text.
36,"""responsible"" AND ""AI""",scaleway/frontalization,https://github.com/scaleway/frontalization,2019-03-11T14:15:39+00:00,2025-05-27T08:14:15+00:00,2023-07-15T09:37:33+00:00,Python,223,50,223,11,False,"['pytorch', 'pytorch-tutorial', 'pytorch-implementation', 'nvidia', 'dali', 'nvidia-dali', 'face-frontalization', 'deep-learning', 'gan', 'generative-adversarial-network', 'computer-vision', 'machine-learning', 'scaleway', 'scaleway-ai']",Pytorch deep learning face frontalization model
37,"""responsible"" AND ""AI""",Hephyrius/Binance-Ai-Bot-Starter,https://github.com/Hephyrius/Binance-Ai-Bot-Starter,2019-03-04T17:47:44+00:00,2025-05-11T02:22:35+00:00,2022-04-17T10:37:31+00:00,Python,112,37,112,3,False,[],"Boilerplate/Starter code for trading on binance using Machine Learning. Provides a basic pipeline for data gathering, feature creation, training, testing and deployment of ML augmented bots."
38,"""responsible"" AND ""AI""",msg-systems/holmes-extractor,https://github.com/msg-systems/holmes-extractor,2019-04-29T19:00:58+00:00,2025-03-24T23:01:50+00:00,2022-07-08T16:04:34+00:00,Python,390,38,390,2,False,"['nlp', 'information-extraction', 'spacy', 'spacy-extension', 'python', 'machine-learning', 'ontology', 'semantics']",Information extraction from English and German texts based on predicate logic
39,"""responsible"" AND ""AI""",adobe/frontend-regression-validator,https://github.com/adobe/frontend-regression-validator,2019-04-23T19:12:56+00:00,2023-12-27T14:54:31+00:00,2024-04-08T12:49:48+00:00,Python,67,11,67,2,False,"['regression', 'visual-regression', 'visual-regression-testing', 'machine-learning', 'segmentation', 'pipeline', 'rest-api', 'fred', 'validator', 'website', 'deployment-automation', 'deep-learning', 'neural-network', 'encoder-decoder', 'convolutional-neural-networks']",Visual regression tool used to compare baseline and updated instances of a website in a deployment pipeline.
40,"""responsible"" AND ""AI""",uber-archive/plato-research-dialogue-system,https://github.com/uber-archive/plato-research-dialogue-system,2019-06-18T22:31:15+00:00,2025-05-01T16:47:02+00:00,2020-09-15T21:04:16+00:00,Python,982,188,982,3,False,"['nlp', 'conversational-ai', 'dialogue-systems', 'conversational-ui', 'conversational-agent', 'machine-learning', 'deep-learning']","This is the Plato Research Dialogue System, a flexible platform for developing conversational AI agents."
41,"""responsible"" AND ""AI""",leondz/hatespeechdata,https://github.com/leondz/hatespeechdata,2019-06-25T09:40:51+00:00,2025-05-31T22:40:51+00:00,2024-06-14T12:54:25+00:00,Python,311,77,311,12,False,[],Catalog of abusive language data (PLoS 2020)
42,"""responsible"" AND ""AI""",kamwoh/Car-Model-Classification,https://github.com/kamwoh/Car-Model-Classification,2019-06-13T02:58:05+00:00,2025-05-28T13:46:09+00:00,2022-05-27T10:24:26+00:00,Python,59,18,59,0,False,"['deeplearning', 'pytorch', 'cars', 'computervision', 'computer-vision', 'convolutional-neural-networks', 'deep-learning', 'image-classification']",Car Model classification using Stanford Cars Dataset for Grab AI For Sea challenge on computer vision (https://www.aiforsea.com/computer-vision)
43,"""responsible"" AND ""AI""",epic-kitchens/epic-kitchens-55-action-models,https://github.com/epic-kitchens/epic-kitchens-55-action-models,2019-07-18T14:05:51+00:00,2024-07-29T07:49:45+00:00,2020-07-14T08:03:56+00:00,Python,75,12,75,2,False,"['epic-kitchens', 'epic', 'kitchens', 'action', 'recognition', 'action-recognition', 'pytorch', 'pytorch-hub', 'tsn', 'trn', 'tsm', 'mrtn', 'resnet50', 'bninception', 'inception']",EPIC-KITCHENS-55 baselines for Action Recognition
44,"""responsible"" AND ""AI""",CiscoSE/cisco-sd-wan-export-import,https://github.com/CiscoSE/cisco-sd-wan-export-import,2019-07-18T11:48:11+00:00,2025-02-16T05:23:02+00:00,2023-05-22T22:16:24+00:00,Python,28,14,28,2,False,[],Cisco SD-WAN EXIM (Export and Import) - Command line tool for Cisco SD-WAN vManage configuration management.
45,"""responsible"" AND ""AI""",mhxion/awesome-discord-communities,https://github.com/mhxion/awesome-discord-communities,2019-08-21T23:17:40+00:00,2025-06-02T06:02:07+00:00,2024-08-08T17:05:23+00:00,Python,3065,196,3065,23,False,"['awesome', 'discord', 'discord-server', 'beginner', 'community', 'web', 'game-development', 'awesome-list']",A curated list of awesome Discord communities for programmers
46,"""responsible"" AND ""AI""",Snehal-Reddy/MedAI,https://github.com/Snehal-Reddy/MedAI,2019-08-23T15:32:30+00:00,2025-03-27T23:47:29+00:00,2024-03-01T08:33:36+00:00,Python,33,13,33,14,False,"['medical-ai', 'ai', 'symptom-based-clustering', 'ocr']",AI based Medical Assistance App
47,"""responsible"" AND ""AI""",rediscovery-io/remo-python,https://github.com/rediscovery-io/remo-python,2019-09-24T13:18:54+00:00,2025-01-10T02:47:12+00:00,2021-01-04T12:10:37+00:00,Python,187,25,187,5,False,"['computer-vision', 'neural-networks', 'deep-learning', 'annotation-tool', 'datasets', 'labeling-tool', 'python-library', 'image-classification', 'object-detection', 'instance-segmentation', 'image-management', 'dataset-interface', 'image-viewer']",:rabbit: Python lib for remo - the app for annotations and images management in Computer Vision
48,"""responsible"" AND ""AI""",MohammedSamirMahmoud/Attendance-Tracking-System-Using-Computer-Vision,https://github.com/MohammedSamirMahmoud/Attendance-Tracking-System-Using-Computer-Vision,2019-09-16T17:40:56+00:00,2025-05-16T18:30:49+00:00,2020-04-07T16:11:36+00:00,Python,46,17,46,1,False,[],A Full Project For Attendance Tracking Using Computer Vision
49,"""responsible"" AND ""AI""",IBM/span-selection-pretraining,https://github.com/IBM/span-selection-pretraining,2019-09-05T01:30:32+00:00,2024-07-22T22:02:05+00:00,2022-05-20T21:07:41+00:00,Python,30,5,30,2,False,[],Code to create pre-training data for a span selection pre-training task inspired by reading comprehension and an effort to avoid encoding general knowledge in the transformer network itself.
50,"""responsible"" AND ""AI""",Telefonica/Airdrop-Crazy,https://github.com/Telefonica/Airdrop-Crazy,2019-10-29T11:24:45+00:00,2025-02-09T20:25:22+00:00,2020-05-15T09:10:41+00:00,Python,57,6,57,2,False,[],Airdrop Crazy
51,"""responsible"" AND ""AI""",EscVM/TensorFlow_Face_Recognition,https://github.com/EscVM/TensorFlow_Face_Recognition,2019-11-17T17:04:23+00:00,2023-10-23T16:20:05+00:00,2022-01-19T08:53:59+00:00,Python,15,4,15,0,False,[],Real-time face recognition system with Google Home Assistant integration and TensorFlow library.
52,"""responsible"" AND ""AI""",amacaluso/Quantum-Single-Layer-Perceptron,https://github.com/amacaluso/Quantum-Single-Layer-Perceptron,2019-11-28T10:00:13+00:00,2025-04-02T07:48:32+00:00,2022-06-09T13:38:01+00:00,Python,14,3,14,0,False,"['quantum-neural-networks', 'single-layer-perceptron', 'neural-networks', 'universal-approximation', 'quantum-artificial-intelligence']","This repository contains the code to reproduce the results in the paper A Variational algorithm for Quantum Neural Networks, accepted in the International Conference on Computational Science 2020, Quantum Computing track."
53,"""responsible"" AND ""AI""",psyfb2/Chatbot,https://github.com/psyfb2/Chatbot,2019-11-22T16:41:36+00:00,2025-05-24T19:16:29+00:00,2023-05-01T21:40:12+00:00,Python,13,1,13,5,False,[],"Conversational AI chatbot with consistent persona. Implementation of Seq2Seq, Transformer and Multiple Encoders in Python. Backend using Flask."
54,"""responsible"" AND ""AI""",gyunggyung/AGI-Papers,https://github.com/gyunggyung/AGI-Papers,2019-12-10T07:25:25+00:00,2025-04-23T19:36:36+00:00,2024-09-21T00:00:14+00:00,Python,283,45,283,3,False,"['nlg', 'llm', 'nlp', 'dialogue', 'sentence-similarity', 'efficient', 'distillation', 'multimodal', 'sentence-embeddings', 'multiple-tasks', 'stable-diffusion', 'text-to-video', 'tts', 'all-to-all']",Papers and Book to look at when starting AGI 📚 
55,"""responsible"" AND ""AI""",harimkang/openCV-with-Zoom,https://github.com/harimkang/openCV-with-Zoom,2019-12-28T13:21:35+00:00,2025-05-24T14:13:56+00:00,2020-07-27T06:08:23+00:00,Python,34,11,34,0,False,"['opencv', 'touch-zoom', 'touch-event', 'zoom-functions', 'opencv-python', 'ui', 'zoom', 'streaming', 'korean']"," This code adds camera streaming, zooming, image capturing, and video recording using openCV."
56,"""responsible"" AND ""AI""",Cisc0-gif/Bad-Arduino,https://github.com/Cisc0-gif/Bad-Arduino,2019-12-28T21:25:41+00:00,2025-01-05T18:07:48+00:00,2020-06-12T03:14:57+00:00,Python,17,5,17,0,False,"['arduino', 'rpi', 'p4wnp1-aloa', 'rfid-badge-cloners', 'rubberducky']",Hardware PenTesting ToolKit for RPi and Arduino
57,"""responsible"" AND ""AI""",udacity/nd320-c3-3d-imaging-starter,https://github.com/udacity/nd320-c3-3d-imaging-starter,2020-01-08T05:41:04+00:00,2024-12-01T04:03:05+00:00,2023-08-25T15:16:05+00:00,Python,21,54,21,0,False,[],
58,"""responsible"" AND ""AI""",aildnont/HIFIS-model,https://github.com/aildnont/HIFIS-model,2020-01-07T13:29:00+00:00,2024-07-10T18:37:22+00:00,2024-07-10T18:37:22+00:00,Python,16,9,16,1,False,"['machine-learning', 'machine-learning-algorithms', 'homelessness', 'artificial-intelligence', 'rnn']",Machine learning models for prediction of chronic homelessness using the HIFIS Application.
59,"""responsible"" AND ""AI""",natethegreate/hent-AI,https://github.com/natethegreate/hent-AI,2020-02-20T20:51:15+00:00,2025-05-31T17:16:33+00:00,2023-03-25T00:22:58+00:00,Python,1649,158,1649,21,False,[],Automation of censor bar detection
60,"""responsible"" AND ""AI""",guyfe/LongSumm,https://github.com/guyfe/LongSumm,2020-02-16T06:29:25+00:00,2024-04-16T09:12:26+00:00,2022-06-30T17:30:19+00:00,Python,74,11,74,0,False,[],LongSumm - Scientific Document Summarization Task
61,"""responsible"" AND ""AI""",edab/OpenVINO_SmartCam,https://github.com/edab/OpenVINO_SmartCam,2020-02-12T10:03:15+00:00,2024-09-26T02:45:36+00:00,2020-03-08T22:46:59+00:00,Python,20,7,20,0,False,[],The aim of the project is to create an AI-powered Smart Cameras that can mitigate the spread of Wuhan Novel Coronavirus.
62,"""responsible"" AND ""AI""",jina-ai/jina-hub,https://github.com/jina-ai/jina-hub,2020-03-15T22:31:28+00:00,2025-04-30T10:08:23+00:00,2021-08-31T14:33:36+00:00,Python,108,48,108,86,False,"['jina', 'neural-search', 'jina-hub', 'containerization', 'marketplace', 'neural-network', 'deep-learning', 'machine-learning', 'cloud-native', 'microservice']",An open-registry for hosting Jina executors via container images
63,"""responsible"" AND ""AI""",chaoyanghe/FedNAS,https://github.com/chaoyanghe/FedNAS,2020-03-23T05:26:45+00:00,2025-03-12T07:49:46+00:00,2021-07-26T02:39:44+00:00,Python,54,17,54,1,False,[],FedNAS: Federated Deep Learning via Neural Architecture Search
64,"""responsible"" AND ""AI""",damavis/airflow-pentaho-plugin,https://github.com/damavis/airflow-pentaho-plugin,2020-03-25T15:52:02+00:00,2025-03-04T06:05:45+00:00,2024-07-02T11:46:27+00:00,Python,39,17,39,3,False,"['airflow-plugin', 'airflow', 'data-engineering', 'pentaho-data-integration']",Pentaho plugin for Apache Airflow - Orquestate pentaho transformations and jobs from Airflow
65,"""responsible"" AND ""AI""",Lleyton-Ariton/molecule-generation,https://github.com/Lleyton-Ariton/molecule-generation,2020-03-24T20:25:11+00:00,2024-10-29T08:18:20+00:00,2024-07-26T19:38:12+00:00,Python,19,6,19,0,False,"['machine-learning', 'pytorch', 'molecule-generation', 'computational-chemistry', 'coronavirus']",Molecular SMILE generation with recurrent neural networks
66,"""responsible"" AND ""AI""",zzhiyuann/PaddlePaddle-Based-Spatiotemporal-Models-of-COVID-19-Spread,https://github.com/zzhiyuann/PaddlePaddle-Based-Spatiotemporal-Models-of-COVID-19-Spread,2020-03-13T07:10:47+00:00,2023-05-09T13:02:24+00:00,2021-07-28T03:18:47+00:00,Python,15,2,15,1,False,[],
