total_index,keyword_source,full_name,html_url,create_date,update_date,pushed_date,language,stars,forks,watchers,open_issues,is_fork,topics,description
292,"""generative AI""",aws-solutions-library-samples/guidance-for-digital-thread-using-graph-and-generative-ai-on-aws,https://github.com/aws-solutions-library-samples/guidance-for-digital-thread-using-graph-and-generative-ai-on-aws,2024-02-22T23:30:54+00:00,2025-03-22T10:32:31+00:00,2024-11-27T15:09:33+00:00,Python,21,6,21,3,False,"['aws', 'aws-bedrock', 'bedrock', 'claude2', 'genai', 'genai-usecase', 'generative-ai', 'manufacturing', 'neptune', 'graph', 'data-fabric', 'industrial']","This Guidance demonstrates how to create an intelligent manufacturing digital thread through a combination of knowledge graph and generative artificial intelligence (AI) technologies. A digital thread offers an integrated approach to combine disparate data sources across enterprise systems, increasing traceability, accessibility, collaboration."
293,"""generative AI""",janbanot/personal_assistant,https://github.com/janbanot/personal_assistant,2024-02-08T19:14:27+00:00,2024-11-27T16:07:41+00:00,2024-11-20T22:40:43+00:00,Python,20,0,20,0,False,"['assistant', 'genai', 'langchain', 'python', 'qdrant']",Virtual personal assistant designed to simplify your daily tasks
294,"""generative AI""",aniketpotabatti/Gemini-PDF-Question-Answering-System,https://github.com/aniketpotabatti/Gemini-PDF-Question-Answering-System,2024-02-01T05:55:19+00:00,2025-05-06T16:08:55+00:00,2024-05-16T09:08:04+00:00,Python,18,4,18,2,False,"['python', 'streamlit-application', 'chatwithpdf']","Streamlit application that allows users to upload multiple PDF files, ask questions about the content of the PDFs, and receive answers based on the provided context."
295,"""generative AI""",risabhmishra/algotrading-sentimentanalysis-genai,https://github.com/risabhmishra/algotrading-sentimentanalysis-genai,2024-02-04T09:59:28+00:00,2025-03-24T20:03:35+00:00,2024-02-05T16:40:58+00:00,Python,17,13,17,1,False,"['algotrading', 'alpaca', 'backtrader', 'cerebro', 'genai', 'llama2', 'openai', 'sentiment-analysis']",Algorithmic Trading with Sentiment Analysis using GenAI
296,"""generative AI""",stefankirchfeld/gptextual,https://github.com/stefankirchfeld/gptextual,2024-02-19T19:47:21+00:00,2025-02-08T22:09:54+00:00,2024-08-04T02:17:03+00:00,Python,17,0,17,2,False,[],
297,"""generative AI""",jstmn/cppflow,https://github.com/jstmn/cppflow,2024-02-28T00:00:37+00:00,2025-02-16T18:56:50+00:00,2024-12-20T16:02:03+00:00,Python,16,2,16,2,False,"['constrained-motion-planning', 'inverse-kinematics', 'motion-planning', 'robotics', 'trajectory-optimization']","Open source implementation of ""CppFlow: Generative Inverse Kinematics for Efficient and Robust Cartesian Path Planning"" (ICRA 2024)"
298,"""generative AI""",aws-samples/automate-image-processing-with-amazon-bedrock,https://github.com/aws-samples/automate-image-processing-with-amazon-bedrock,2024-02-12T11:16:52+00:00,2025-04-29T19:02:05+00:00,2024-08-12T19:17:13+00:00,Python,15,6,15,2,False,"['ai', 'amazon-titan', 'aws-step-functions', 'generative-ai', 'amazon-bedrock']",Automate process to change image background using Amazon Bedrock and AWS Step Functions
299,"""generative AI""",DavidAI2024/Gemini-KD,https://github.com/DavidAI2024/Gemini-KD,2024-02-09T16:20:35+00:00,2024-10-04T10:53:37+00:00,2024-02-10T22:18:22+00:00,Python,12,0,12,0,False,"['ai', 'chatbot', 'gemini', 'gemini-api', 'gemini-pro', 'google', 'python', 'google-gemini', 'gui', 'linux-app', 'windows-desktop']","KD Gemini-Pro, a desktop application on PyQt5, simplifies interaction with Google's Gemini-Pro AI model. Users effortlessly submit questions, receiving instant, generated responses. With an intuitive interface and advanced features, it efficiently explores the capabilities of AI-assisted conversation."
300,"""generative AI""",NafisRayan/AI-Voice-Assistant-ST,https://github.com/NafisRayan/AI-Voice-Assistant-ST,2024-02-11T07:38:23+00:00,2025-02-12T15:50:22+00:00,2024-08-26T20:05:17+00:00,Python,12,0,12,1,False,"['gemini', 'mistral', 'nlp', 'voice-assistant', 'voice-recognition', 'huggingface', 'python', 'phi', 'speech-recognition', 'speech-to-text', 'text-to-speech', 'voice', 'voice-control', 'ai', 'llm']","AI voice assistant made with Streamlit python and powered by Gemini, Mistral and PHI-3"
301,"""generative AI""",FuseFairy/DiscordBot-GeminiAI,https://github.com/FuseFairy/DiscordBot-GeminiAI,2024-02-05T09:56:38+00:00,2025-05-07T09:29:20+00:00,2024-08-06T07:38:41+00:00,Python,11,7,11,0,False,"['discord', 'discord-bot', 'discord-py', 'gemini', 'gemini-api', 'python', 'gemini-pro', 'chatbot', 'bard']","Use Gemini on Discord, with highly customizable features. Using Thread to Create Personal Conversations with AI."
302,"""generative AI""",aws-samples/aws-genai-audio-text-chat-moderation,https://github.com/aws-samples/aws-genai-audio-text-chat-moderation,2024-02-22T18:14:49+00:00,2024-07-11T08:38:43+00:00,2024-05-07T13:22:58+00:00,Python,11,5,11,0,False,[],
303,"""generative AI""",aws-samples/serverless-exam-generator-from-your-lecture-amazon-bedrock,https://github.com/aws-samples/serverless-exam-generator-from-your-lecture-amazon-bedrock,2024-02-22T16:42:19+00:00,2024-12-14T11:49:05+00:00,2024-06-04T03:09:22+00:00,Python,11,2,11,4,False,[],
304,"""generative AI""",mlsquare/fedem,https://github.com/mlsquare/fedem,2024-02-03T08:57:37+00:00,2024-11-08T04:51:10+00:00,2024-04-08T17:33:47+00:00,Python,11,1,11,0,False,"['federated-learning', 'foundation-models', 'huggingface', 'federated-emergence', 'mamba-state-space-models']",Library for Federated Emergence & Foundation Models
305,"""generative AI""",qaillc/Phi2Hackathon,https://github.com/qaillc/Phi2Hackathon,2024-02-02T11:42:36+00:00,2025-04-11T20:40:56+00:00,2024-04-21T17:14:27+00:00,Python,10,4,10,0,False,[],"Leveraging revolutionary Agent and Phi-2 technology, Graph Detective uncovers concealed linkages and discerns patterns, enabling pinpoint fraud detection and prevention across insurance, banking, and eCommerce with unparalleled efficiency. "
306,"""generative AI""",gimnathperera/github-linkedln,https://github.com/gimnathperera/github-linkedln,2024-02-11T05:38:03+00:00,2025-03-05T06:46:43+00:00,2024-02-11T09:46:54+00:00,Python,10,0,10,0,False,[],
307,"""generative AI""",Picsart-AI-Research/Social-Reward,https://github.com/Picsart-AI-Research/Social-Reward,2024-02-09T01:12:40+00:00,2025-05-01T19:04:39+00:00,2024-03-29T12:57:42+00:00,Python,10,0,10,1,False,[],
308,"""generative AI""",fudan-generative-vision/champ,https://github.com/fudan-generative-vision/champ,2024-03-17T04:49:43+00:00,2025-05-20T08:32:07+00:00,2024-07-10T07:53:06+00:00,Python,4203,484,4203,48,False,"['human-animation', 'video-generation', 'image-animatioln']",[ECCV 2024] Champ: Controllable and Consistent Human Image Animation with 3D Parametric Guidance
309,"""generative AI""",FareedKhan-dev/basiclingua-LLM-Based-NLP,https://github.com/FareedKhan-dev/basiclingua-LLM-Based-NLP,2024-03-03T14:33:46+00:00,2025-05-10T03:57:26+00:00,2024-07-28T05:38:04+00:00,Python,87,11,87,0,False,"['api', 'deep-learning', 'gemini-api', 'large-language-models', 'llm', 'machine-learning', 'natural-language-processing', 'nlp', 'text-analytics', 'anyscale', 'llms', 'nlp-library', 'openai', 'python']",LLM Based NLP Library.
310,"""generative AI""",XingYu-Zhong/ChineseStockGPT,https://github.com/XingYu-Zhong/ChineseStockGPT,2024-03-10T07:03:59+00:00,2025-04-15T03:34:08+00:00,2024-03-23T15:01:22+00:00,Python,60,12,60,0,False,[],A generative AI dialog system that can ask questions about the Chinese stock market.一个可以针对中国股市提问的生成式人工智能对话系统
311,"""generative AI""",ngshya/easyRAG,https://github.com/ngshya/easyRAG,2024-03-05T22:50:44+00:00,2025-05-19T05:17:40+00:00,2024-03-14T00:02:26+00:00,Python,57,10,57,1,False,"['chatbot', 'colbert-ai', 'dspy', 'genai', 'rag', 'streamlit']",Build your own RAG and run it locally on your laptop: ColBERT + DSPy + Streamlit
312,"""generative AI""",sedthh/BeatLearning,https://github.com/sedthh/BeatLearning,2024-03-19T19:16:26+00:00,2025-05-14T08:08:51+00:00,2024-04-08T17:04:34+00:00,Python,46,2,46,0,False,"['encoders', 'generative-ai', 'open-source', 'rhythm-game', 'tokenizer', 'transformers', 'bert-model', 'you-gotta-do-what', 'you-gotta-believe']",Open Source Generative AI Models for Automatic Rhythm Game Beatmap Generation (for acoustic people)
313,"""generative AI""",247arjun/ai-secure-code-review,https://github.com/247arjun/ai-secure-code-review,2024-03-23T18:34:37+00:00,2025-04-17T23:30:55+00:00,2024-11-09T04:40:19+00:00,Python,30,4,30,0,False,[],"Welcome to `ai-secure-code-review`, a repository that integrates static analysis tools with Generative AI, specifically Semgrep and Azure OpenAI's GPT models, to automate and enhance code reviews for improved efficiency, scalability, and effectiveness in identifying potential software vulnerabilities."
314,"""generative AI""",ManifoldRG/P.A.L.,https://github.com/ManifoldRG/P.A.L.,2024-03-02T04:30:36+00:00,2025-01-17T06:48:54+00:00,2024-03-03T23:38:33+00:00,Python,26,0,26,10,False,[],A toolkit to build AI Agents that proactively interact w/ the world 
315,"""generative AI""",joz-it/imartinez-privateGPT,https://github.com/joz-it/imartinez-privateGPT,2024-03-11T16:55:50+00:00,2025-05-15T16:10:17+00:00,2024-03-11T17:03:49+00:00,Python,22,11,22,0,False,[],
316,"""generative AI""",ResponsibleAILab/S3LLM,https://github.com/ResponsibleAILab/S3LLM,2024-03-01T08:56:32+00:00,2025-04-16T18:38:14+00:00,2024-04-13T13:36:43+00:00,Python,21,1,21,0,False,[],
317,"""generative AI""",TheShadoru/AI-Cyber-Watchdog,https://github.com/TheShadoru/AI-Cyber-Watchdog,2024-03-08T15:53:01+00:00,2025-04-28T20:56:11+00:00,2024-09-07T13:36:03+00:00,Python,20,4,20,5,False,[],Private AI and Open source driven projects that can be used to help solve a plethora of security problems
318,"""generative AI""",ryanadoty/Amazon-Bedrock-Claude3-Multi-Modal-Sample,https://github.com/ryanadoty/Amazon-Bedrock-Claude3-Multi-Modal-Sample,2024-03-05T17:58:57+00:00,2024-08-20T06:36:24+00:00,2024-03-08T13:37:00+00:00,Python,20,4,20,0,False,[],"This is sample code demonstrating the use of Amazon Bedrock and Anthropic Claude 3 to satisfy multi-modal use cases. The application is constructed with a simple streamlit frontend where users can input zero shot requests to satisfy a broad range of use cases, including image to text multi-modal style use cases."
319,"""generative AI""",StromFLIX/factuality,https://github.com/StromFLIX/factuality,2024-03-29T09:58:46+00:00,2024-12-13T12:56:18+00:00,2024-04-01T15:31:55+00:00,Python,20,2,20,7,False,[],"Based on ""long-form-factuality"" a python based processor to easily fact check anything."
320,"""generative AI""",aws-samples/unlocking-the-potential-of-generative-ai-in-industrial-operations,https://github.com/aws-samples/unlocking-the-potential-of-generative-ai-in-industrial-operations,2024-03-08T03:35:51+00:00,2025-03-29T17:31:20+00:00,2024-04-03T16:01:25+00:00,Python,16,7,16,4,False,[],
321,"""generative AI""",IBM/NL2PDDL,https://github.com/IBM/NL2PDDL,2024-03-11T22:05:26+00:00,2025-04-08T09:09:06+00:00,2025-05-08T03:07:18+00:00,Python,16,2,16,1,False,[],"this is for fun, ain't it grand!"
322,"""generative AI""",Mozilla-Ocho/formulaic-python,https://github.com/Mozilla-Ocho/formulaic-python,2024-03-09T15:08:50+00:00,2025-03-18T21:49:02+00:00,2024-04-25T18:47:08+00:00,Python,16,0,16,2,False,[],The official Python library for Formulaic
323,"""generative AI""",mickymultani/nvidia-NIM-RAG,https://github.com/mickymultani/nvidia-NIM-RAG,2024-03-21T05:11:55+00:00,2025-04-20T00:56:11+00:00,2024-03-21T05:13:58+00:00,Python,13,5,13,0,False,"['enterpriseservices', 'genai', 'langchain', 'large-language-models', 'llm-inference', 'llmops', 'nim', 'nvidia', 'nvidia-docker', 'nvidia-gpu', 'rag', 'retrieval-augmented-generation']","Project demonstrates the power and simplicity of NVIDIA NIM (NVIDIA Inference Model), a suite of optimized cloud-native microservices, by setting up and running a Retrieval-Augmented Generation (RAG) pipeline. "
324,"""generative AI""",GURPREETKAURJETHRA/Youtube-Video-Transcribe-Summarizer-LLM-App,https://github.com/GURPREETKAURJETHRA/Youtube-Video-Transcribe-Summarizer-LLM-App,2024-03-22T16:51:05+00:00,2025-05-21T16:26:14+00:00,2024-05-07T10:37:50+00:00,Python,12,9,12,1,False,"['generative-ai', 'haystack', 'haystack-ai', 'large-language-models', 'llama2', 'llamacpp', 'llm', 'streamlit', 'whisper-api']","YouTube Video Summarization App built using open source LLM and Framework like Llama 2, Haystack, Whisper, and Streamlit. This app smoothly runs on CPU as Llama 2 model is in GGUF format loaded through Llama.cpp."
325,"""generative AI""",viktoriasemaan/ai-agents,https://github.com/viktoriasemaan/ai-agents,2024-04-02T22:02:51+00:00,2025-05-05T21:49:40+00:00,2024-07-30T17:43:16+00:00,Python,196,78,196,1,False,[],AI Agents with Bedrock
326,"""generative AI""",manuelescobar-dev/LLM-Tools,https://github.com/manuelescobar-dev/LLM-Tools,2024-04-24T20:24:33+00:00,2025-05-22T10:53:12+00:00,2024-12-18T13:31:05+00:00,Python,153,25,153,3,False,"['deep-learning', 'large-language-models', 'llm', 'memory-management', 'open-source', 'streamlit', 'system-requirements', 'artificial-intelligence', 'machine-learning']",Open-source calculator for LLM system requirements.
327,"""generative AI""",s-du/ScribbleArchitect,https://github.com/s-du/ScribbleArchitect,2024-04-19T20:32:37+00:00,2025-05-08T10:49:14+00:00,2024-08-01T07:34:40+00:00,Python,107,9,107,0,False,"['controlnet', 'generative-ai', 'ip-adapter', 'stable-diffusion', 'style-transfer']","Transform your simple scribbles into architectural designs using style transfer with Stable Diffusion, LCM, IP Adapters and ControlNet. Scribble Architect combines creativity with generative AI technology, improving the inspiration process."
328,"""generative AI""",Furyton/awesome-language-model-analysis,https://github.com/Furyton/awesome-language-model-analysis,2024-04-25T14:55:57+00:00,2025-05-20T03:16:32+00:00,2024-12-02T13:59:10+00:00,Python,84,1,84,0,False,"['analytics', 'awesome', 'llm', 'transformers', 'ai', 'analysis', 'chatgpt', 'deep-learning', 'generative-ai', 'large-language-models', 'nlp', 'theory']","This paper list focuses on the theoretical and empirical analysis of language models, especially large language models (LLMs). The papers in this list investigate the learning behavior, generalization ability, and other properties of language models through theoretical analysis, empirical analysis, or a combination of both."
329,"""generative AI""",nickbild/c64_gen_ai,https://github.com/nickbild/c64_gen_ai,2024-04-25T21:43:57+00:00,2025-05-05T09:50:27+00:00,2024-04-29T13:01:56+00:00,Python,54,2,54,0,False,[],Make creative retro game sprites on the Commodore 64 with generative AI.
330,"""generative AI""",narenaryan/promptml,https://github.com/narenaryan/promptml,2024-04-27T01:29:48+00:00,2025-05-05T02:48:34+00:00,2024-06-16T00:50:15+00:00,Python,42,7,42,1,False,"['ai', 'generative-ai', 'machine-learning', 'prompt-engineering']",Prompt markup language (A.K.A PromptML) library is specially built for AI systems - from Vidura AI
331,"""generative AI""",gabrielchua/repo-explainer,https://github.com/gabrielchua/repo-explainer,2024-04-12T15:21:58+00:00,2025-05-14T00:49:09+00:00,2024-07-16T03:47:37+00:00,Python,32,12,32,1,False,"['gemini', 'gemini-api', 'llm', 'streamlit']",Chat with a repo by adding the entire repo to gemini 1.5 pro's 1M context window 🔥
332,"""generative AI""",GAIR-Lab/IISAN,https://github.com/GAIR-Lab/IISAN,2024-04-02T12:10:49+00:00,2025-05-17T16:33:33+00:00,2024-11-30T01:28:31+00:00,Python,32,0,32,0,False,"['multimodal-recommendation', 'sequential-recommendation', 'efficiency-analysis', 'memory-efficient', 'multimodal-learning', 'multimodal-representation', 'representation-learning', 'peft', 'iisan']",IISAN: Efficiently Adapting Multimodal Representation for Sequential Recommendation with Decoupled PEFT
333,"""generative AI""",mycloudtutorials/generative-ai-demos,https://github.com/mycloudtutorials/generative-ai-demos,2024-04-26T03:31:02+00:00,2025-05-03T17:05:22+00:00,2024-05-22T05:31:30+00:00,Python,30,37,30,1,False,[],
334,"""generative AI""",data-prompt-query/dpq,https://github.com/data-prompt-query/dpq,2024-04-12T16:23:52+00:00,2025-03-21T08:46:32+00:00,2024-04-28T08:17:42+00:00,Python,24,1,24,0,False,"['data', 'data-analytics', 'data-engineering', 'data-science', 'feature-engineering', 'llm', 'machine-learning', 'prompt', 'python']",dpq is an open-source python library that makes prompt-based data transformations and feature engineering easy
335,"""generative AI""",busecoban/IBM_CyberStart,https://github.com/busecoban/IBM_CyberStart,2024-04-19T21:35:38+00:00,2025-05-08T19:42:22+00:00,2024-05-24T21:52:06+00:00,Python,22,1,22,0,False,[],
336,"""generative AI""",abhirockzz/langchain-opensearch-rag,https://github.com/abhirockzz/langchain-opensearch-rag,2024-04-21T10:33:11+00:00,2025-01-24T05:38:29+00:00,2024-04-23T11:17:09+00:00,Python,21,7,21,0,False,"['amazon-bedrock', 'generative-ai', 'langchain', 'opensearch', 'python']",Vector databases for generative AI
337,"""generative AI""",aws-samples/genai-asl-avatar-generator,https://github.com/aws-samples/genai-asl-avatar-generator,2024-04-17T01:24:47+00:00,2025-04-29T20:19:00+00:00,2024-09-22T16:08:18+00:00,Python,19,8,19,10,False,[],
338,"""generative AI""",aws-samples/generative-ai-for-semiconductor-design,https://github.com/aws-samples/generative-ai-for-semiconductor-design,2024-04-03T21:28:16+00:00,2025-04-22T15:03:58+00:00,2024-06-14T23:28:12+00:00,Python,18,6,18,2,False,"['eda', 'generativeai', 'semiconductor']","Generative AI for Semiconductor Design: Engineering Assistant built with Bedrock, Knowledge Bases and Langchain"
339,"""generative AI""",iut62elec/Soccer-Highlight-Generator-with-GenAI,https://github.com/iut62elec/Soccer-Highlight-Generator-with-GenAI,2024-04-16T14:17:03+00:00,2025-04-26T01:37:43+00:00,2024-04-25T18:53:23+00:00,Python,18,2,18,1,False,"['anthropic-claude', 'aws', 'aws-bedrock', 'generative-ai', 'multimodal', 'amazon-bedrock', 'genai']"," Automate the creation of soccer match highlights with the power of Generative AI and AWS. This solution leverages AWS Bedrock (Anthropic’s Claude 3 Sonnet model), AWS MediaConvert, Lambda, Step Functions and other AWS services to identify and compile exciting game moments without manual editing."
340,"""generative AI""",IBM/API-BLEND,https://github.com/IBM/API-BLEND,2024-04-26T14:16:21+00:00,2025-04-24T02:57:45+00:00,2025-05-08T02:26:54+00:00,Python,18,0,18,6,False,[],Companion code to https://arxiv.org/abs/2402.15491
341,"""generative AI""",garystafford/creative-analysis-claude-bedrock,https://github.com/garystafford/creative-analysis-claude-bedrock,2024-04-07T22:38:48+00:00,2025-03-29T14:26:03+00:00,2024-12-05T13:37:27+00:00,Python,16,4,16,0,False,"['amazon-bedrock', 'anthropic-claude', 'anthropicclaude', 'aws', 'genai', 'generative-ai', 'multimodal']",Simple Streamlit application used for demonstrating Anthropic Claude 3 family of model's multimodal prompting on Amazon Bedrock
342,"""generative AI""",eneagizzarelli/SYNAPSE,https://github.com/eneagizzarelli/SYNAPSE,2024-04-11T15:19:14+00:00,2025-04-10T10:46:02+00:00,2024-09-23T15:12:26+00:00,Python,14,0,14,0,False,"['cybersecurity', 'generative-ai', 'honeypot', 'llm', 'mitre-attack']","SYNAPSE (SYNthetic AI Pot for Security Enhancement) and SYNAPSE-to-MITRE code repository. This project has been realized for my MSc degree thesis in Cybersecurity at Politecnico di Torino, in partnership with SECURITY REPLY S.R.L."
343,"""generative AI""",ugiugi0823/DISN,https://github.com/ugiugi0823/DISN,2024-04-17T22:22:23+00:00,2024-12-16T01:45:15+00:00,2024-11-18T01:48:39+00:00,Python,14,1,14,0,False,[],
344,"""generative AI""",rmartinshort/receiptchat,https://github.com/rmartinshort/receiptchat,2024-04-07T06:06:31+00:00,2024-10-28T23:24:32+00:00,2024-05-28T21:42:34+00:00,Python,13,10,13,0,False,[],Use generative AI to extract information from receipts
345,"""generative AI""",IBM/watsonx-chat-complex-pdf-LlamaParser,https://github.com/IBM/watsonx-chat-complex-pdf-LlamaParser,2024-04-21T03:33:36+00:00,2025-04-07T01:16:43+00:00,2025-05-07T23:34:26+00:00,Python,13,6,13,1,False,[],"Chat Complex PDF with Tables Using IBM WatsonX, Langchain and LlamaParser."
346,"""generative AI""",KevKibe/docindex,https://github.com/KevKibe/docindex,2024-04-05T23:55:28+00:00,2025-03-09T09:43:04+00:00,2024-12-23T01:46:14+00:00,Python,13,3,13,9,False,"['embedding-models', 'retrieval-augmented-generation', 'googlegemini', 'langchain', 'openai', 'pinecone-db']","⚡️Framework for fast persistent storage of multiple document embeddings and metadata into Pinecone for source-traceable, production-level RAG."
347,"""generative AI""",aws-solutions-library-samples/guidance-for-high-speed-rag-chatbots-on-aws,https://github.com/aws-solutions-library-samples/guidance-for-high-speed-rag-chatbots-on-aws,2024-04-09T16:18:03+00:00,2025-05-22T02:14:01+00:00,2024-10-19T07:27:33+00:00,Python,12,6,12,1,False,[],This Guidance demonstrates how to develop a high-performance Retrieval-Augmented Generation (RAG) chatbot by combining Amazon Aurora PostgreSQL-Compatible Edition with the open-source pgvector extension.
348,"""generative AI""",JGalego/deploy-langserve-aws,https://github.com/JGalego/deploy-langserve-aws,2024-04-02T14:34:28+00:00,2025-03-27T10:55:25+00:00,2024-06-26T14:34:58+00:00,Python,10,2,10,1,False,[],Learn how to deploy 🦜🔗 LangChain applications with 🦜️🏓 LangServe in minutes on Amazon ECS and AWS Fargate using AWS Copilot.
349,"""generative AI""",build-on-aws/bedrock-agents-infer-models,https://github.com/build-on-aws/bedrock-agents-infer-models,2024-04-11T02:23:43+00:00,2025-03-02T18:11:52+00:00,2024-10-15T17:23:04+00:00,Python,10,3,10,1,False,"['bedrock', 'generative-ai', 'llm-inference']",Use natural language to run inference on various LLMs via Bedrock agents
350,"""generative AI""",AgentEra/Agently-Daily-News-Collector,https://github.com/AgentEra/Agently-Daily-News-Collector,2024-05-01T08:21:24+00:00,2025-05-21T05:08:00+00:00,2024-10-22T03:17:44+00:00,Python,523,85,523,7,False,"['llm-agent', 'llm-agents', 'llm-application', 'llm-apps', 'news', 'news-agent', 'search-agent']",An open-source LLM based automatically daily news collecting workflow showcase powered by Agently AI application development framework.
351,"""generative AI""",Doriandarko/DIY-Astra,https://github.com/Doriandarko/DIY-Astra,2024-05-16T15:33:26+00:00,2025-05-21T05:44:56+00:00,2024-05-17T19:38:50+00:00,Python,162,27,162,1,False,[],
352,"""generative AI""",AnswerDotAI/cold-compress,https://github.com/AnswerDotAI/cold-compress,2024-05-20T18:39:19+00:00,2025-05-04T15:29:39+00:00,2024-08-09T18:05:25+00:00,Python,131,13,131,12,False,"['inference', 'llm', 'llm-inference', 'nlp', 'open-source']","Cold Compress is a hackable, lightweight, and open-source toolkit for creating and benchmarking cache compression methods built on top of GPT-Fast, a simple, PyTorch-native generation codebase."
353,"""generative AI""",nikolamilosevic86/local-genAI-search,https://github.com/nikolamilosevic86/local-genAI-search,2024-05-26T06:27:21+00:00,2025-04-09T03:49:12+00:00,2024-08-19T10:10:17+00:00,Python,93,34,93,2,False,"['generative-ai', 'langchain', 'large-language-models', 'llama3', 'local', 'python3', 'qdrant-client', 'search-engine', 'msmarco', 'sentence-embeddings', 'sentence-transformers']","Local-GenAI-Search is a generative search engine based on Llama 3, langchain and qdrant that answers questions based on your local files"
354,"""generative AI""",Malith-Rukshan/Suno-API,https://github.com/Malith-Rukshan/Suno-API,2024-05-08T13:52:05+00:00,2025-05-07T22:12:33+00:00,2024-07-28T16:34:01+00:00,Python,86,27,86,8,False,"['ai-music', 'fastapi', 'generative-music', 'python-library', 'rest-api', 'suno-ai', 'suno-ai-api']",SunoAI Unofficial Python API Library and REST API for Suno.ai — Create Music with Generative AI ! ✨
355,"""generative AI""",aws-samples/bedrock-claude-chatbot,https://github.com/aws-samples/bedrock-claude-chatbot,2024-05-08T02:30:49+00:00,2025-05-15T14:35:28+00:00,2024-12-17T19:35:33+00:00,Python,75,18,75,0,False,[],
356,"""generative AI""",alessitomas/EmpregoConnect,https://github.com/alessitomas/EmpregoConnect,2024-05-06T12:00:45+00:00,2025-05-19T21:52:29+00:00,2024-05-16T14:30:37+00:00,Python,55,24,55,0,False,[],"O que é o EmpregoConnect?  O EmpregoConnect é uma plataforma que te ajuda a encontrar o emprego ideal, oferecendo três assistentes virtuais para auxiliar em todas as etapas do processo"
357,"""generative AI""",rollingfruit/Free_Astra,https://github.com/rollingfruit/Free_Astra,2024-05-22T02:48:11+00:00,2025-05-21T12:56:43+00:00,2024-05-23T03:08:47+00:00,Python,37,5,37,0,False,[],gpt-4o前两天发布会有了视频聊天版本，再模仿前两天谷歌发布会的多模态AI项目Project Astra，粗略挫了个视觉聊天模型。现在能跟他自由交谈，它会根据摄像头拍到的画面与使用者的语言进行反映，并实时声音输出。目前英语效果是最好的，中文也算能支持。演示程序未加速未剪辑，视觉反映过程比较快，但是文转声会有延迟。 在Github项目DIY-Astra的基础上进行改进，现在可以做到拿着摄像头自由聊天。 目前感觉Gemini 1.5 Flash效果不错，不敢想象以后手机、甚至个人穿戴设备都被这些低功耗AI模型改造一遍的时代。  DIY-Astra地址：https://github.com/Doriandarko/DIY-Astra
