total_index,keyword_source,full_name,html_url,create_date,update_date,pushed_date,language,stars,forks,watchers,open_issues,is_fork,topics,description
147,"""generative AI""",Jishnnu/DiagnoAI-Medical-Chatbot,https://github.com/Jishnnu/DiagnoAI-Medical-Chatbot,2023-08-11T08:23:54+00:00,2025-04-14T04:14:43+00:00,2023-08-12T10:23:55+00:00,Python,10,2,10,0,False,"['duckduckgo-search', 'generative-ai', 'google-speech-recognition', 'google-text-to-speech', 'huggingface-models', 'langchain', 'natural-language-processing', 'nltk', 'pillow', 'streamlit-webapp', 'text-summarization', 'text-to-image', 'jina-chat']",Simple Generative AI enabled Streamlit web application that converts speech to-image.
148,"""generative AI""",zhanglab-aim/LINGO,https://github.com/zhanglab-aim/LINGO,2023-08-09T19:52:53+00:00,2025-02-24T19:06:02+00:00,2024-06-24T23:36:33+00:00,Python,10,1,10,0,False,[],
149,"""generative AI""",krishnaik06/The-Grand-Complete-Data-Science-Materials,https://github.com/krishnaik06/The-Grand-Complete-Data-Science-Materials,2023-09-19T06:19:22+00:00,2025-05-22T11:57:47+00:00,2024-08-04T07:14:11+00:00,Python,7618,3963,7618,71,False,[],
150,"""generative AI""",lastmile-ai/aiconfig,https://github.com/lastmile-ai/aiconfig,2023-09-01T17:23:49+00:00,2025-05-18T08:09:06+00:00,2024-06-04T09:45:36+00:00,Python,1023,83,1023,164,False,"['ai', 'developer-tools', 'generative-ai', 'llm', 'llm-ops']",AIConfig is a config-based framework to build generative AI applications.
151,"""generative AI""",DmitryRyumin/ICCV-2023-Papers,https://github.com/DmitryRyumin/ICCV-2023-Papers,2023-09-04T09:35:11+00:00,2025-05-17T16:32:53+00:00,2024-09-01T01:53:09+00:00,Python,953,43,953,0,False,"['iccv', 'iccv2023', '3d-graphics', '3d-reconstruction', 'biometrics', 'computer-vision', 'datasets', 'deep-learning', 'explainable-ai', 'face-recognition', 'gesture-recognition', 'image-processing', 'image-synthesis', 'pattern-recognition', 'robotics', 'video-synthesis', 'multimodal-learning', 'photogrammetry', 'pose-estimation', 'transfer-learning']","ICCV 2023 Papers: Discover cutting-edge research from ICCV 2023, the leading computer vision conference. Stay updated on the latest in computer vision and deep learning, with code included. ⭐ support visual intelligence development!"
152,"""generative AI""",NVIDIA-AI-IOT/nanosam,https://github.com/NVIDIA-AI-IOT/nanosam,2023-09-07T00:16:18+00:00,2025-05-19T09:48:22+00:00,2023-11-20T09:10:27+00:00,Python,752,66,752,30,False,"['jetson-orin', 'jetson-orin-nano', 'nvidia', 'real-time', 'segment-anything', 'tensorrt']",A distilled Segment Anything (SAM) model capable of running real-time with NVIDIA TensorRT
153,"""generative AI""",GAIR-NLP/abel,https://github.com/GAIR-NLP/abel,2023-09-20T15:19:38+00:00,2025-05-12T00:42:07+00:00,2023-12-12T14:01:05+00:00,Python,332,20,332,10,False,"['generative-ai', 'llm', 'math']",SOTA Math Opensource LLM
154,"""generative AI""",SayanoAI/RVC-Studio,https://github.com/SayanoAI/RVC-Studio,2023-09-02T19:15:37+00:00,2025-05-17T16:32:52+00:00,2024-04-27T01:09:53+00:00,Python,204,42,204,2,False,"['ai', 'ai-voice-changers', 'rvc', 'rvc-project', 'voice-cloning', 'rvc-studio']",The best looking and most functional webui for RVC related tasks. See website for UI demo:
155,"""generative AI""",Azure/aoai-apim,https://github.com/Azure/aoai-apim,2023-09-15T12:02:32+00:00,2025-05-18T12:58:56+00:00,2024-05-17T16:32:58+00:00,Python,108,26,108,8,False,[],"Scaling AOAI using APIM, PTUs and TPMs"
156,"""generative AI""",slgero/hack_interview,https://github.com/slgero/hack_interview,2023-09-12T17:19:46+00:00,2025-05-13T13:30:54+00:00,2023-10-04T08:33:08+00:00,Python,107,47,107,3,False,[],
157,"""generative AI""",ryanshrott/saas,https://github.com/ryanshrott/saas,2023-09-19T18:22:22+00:00,2025-03-19T12:14:33+00:00,2024-01-30T12:57:10+00:00,Python,91,40,91,1,False,[],
158,"""generative AI""",build-on-aws/amazon-bedrock-quick-start,https://github.com/build-on-aws/amazon-bedrock-quick-start,2023-09-28T16:36:54+00:00,2025-05-16T14:25:59+00:00,2024-04-04T15:13:08+00:00,Python,87,39,87,2,False,"['amazon-bedrock', 'aws', 'generative-ai', 'python', 'streamlit']",Learn how to Quickly build Generative AI applications with Amazon Bedrock
159,"""generative AI""",Aschen/comics_generator,https://github.com/Aschen/comics_generator,2023-09-05T14:45:10+00:00,2025-04-24T16:04:54+00:00,2024-04-07T19:55:05+00:00,Python,70,18,70,0,False,"['comics', 'generative-art', 'large-language-models', 'stable-diffusion', 'gpt-4', 'genai']",A python program using Generative AI to create an entire strip from a short description of the scenario
160,"""generative AI""",kubenstein-gpt/kubenstein,https://github.com/kubenstein-gpt/kubenstein,2023-09-17T18:42:55+00:00,2024-07-24T00:04:03+00:00,2024-01-21T15:02:46+00:00,Python,49,7,49,1,False,[],A prototype of an AI-based system administrator
161,"""generative AI""",philippmoehl/insta-gpt,https://github.com/philippmoehl/insta-gpt,2023-09-13T14:07:33+00:00,2025-04-06T04:59:38+00:00,2023-10-13T11:14:50+00:00,Python,31,7,31,0,False,"['chatpgt', 'generative-art', 'instagram-api', 'natural-language-processing', 'dall-e']",Automated social media manager using chatGPT and generative AI
162,"""generative AI""",vultureprime/deploy-ai-model,https://github.com/vultureprime/deploy-ai-model,2023-09-12T09:26:33+00:00,2025-05-10T07:28:12+00:00,2023-11-27T08:51:14+00:00,Python,24,4,24,1,False,[],
163,"""generative AI""",novitalabs/python-sdk,https://github.com/novitalabs/python-sdk,2023-09-27T03:27:34+00:00,2025-05-22T03:21:30+00:00,2024-11-08T08:50:53+00:00,Python,22,8,22,1,False,"['controlnet', 'img2img', 'img2video', 'lora', 'stable-diffusion', 'swapface', 'txt2img', 'txt2video']","Python SDK for Novita AI API (Txt2Img, Img2Img, Txt2Video, Img2Video, Doodle, Remove Background, Replace Object, Reimagine, Merge Faces, ControlNet, VAE, LoRA)"
164,"""generative AI""",aws-samples/amazon-sagemaker-personalized-generative-ai,https://github.com/aws-samples/amazon-sagemaker-personalized-generative-ai,2023-09-22T10:18:12+00:00,2025-04-05T19:58:13+00:00,2023-12-20T21:08:59+00:00,Python,21,8,21,4,False,"['generative-ai', 'aws', 'cdk', 'poetry', 'python', 'stable-diffusion', 'text2image']","This project simplifies personalized Gen-AI SaaS apps. We fine-tune pre-trained models for users, use single GPUs, and ensure real-time responsiveness. A base txt2img Stable Diffusion model from SageMaker JumpStart is used. Challenges include traffic spikes, low-latency, and cost-efficiency. We aim for efficient, user-centric AI solutions."
165,"""generative AI""",SemanticBrainCorp/SemanticShield,https://github.com/SemanticBrainCorp/SemanticShield,2023-09-20T17:53:45+00:00,2025-03-06T07:02:13+00:00,2024-08-15T14:46:29+00:00,Python,21,3,21,0,False,"['chatgpt', 'jailbreak', 'llm', 'moderation', 'pii', 'adversarial-attacks', 'prompt-engineering', 'prompt-injection', 'security-tools']",The Security Toolkit for managing Generative AI(especially LLMs) and Supervised Learning processes(Learning and Inference).
166,"""generative AI""",SayanoAI/RVC-Chat,https://github.com/SayanoAI/RVC-Chat,2023-09-27T16:22:48+00:00,2025-05-09T16:11:08+00:00,2024-02-15T01:07:46+00:00,Python,21,1,21,5,False,"['characterai', 'chatbot', 'llm', 'open-source', 'roleplay', 'rvc', 'rvc-project', 'tavernai', 'rvc-chat']",Chat with your RVC models. See website for demo:
167,"""generative AI""",cedev935/Machine-Learning,https://github.com/cedev935/Machine-Learning,2023-09-03T16:11:55+00:00,2024-03-11T06:42:36+00:00,2023-09-03T16:25:19+00:00,Python,21,2,21,0,False,[],
168,"""generative AI""",ryanadoty/Amazon-Bedrock-RAG-Kendra-POC,https://github.com/ryanadoty/Amazon-Bedrock-RAG-Kendra-POC,2023-09-20T11:43:12+00:00,2025-03-18T09:52:51+00:00,2024-06-18T01:26:40+00:00,Python,20,0,20,6,False,[],This is sample code demonstrating the use of Amazon Bedrock and Generative AI to implement a RAG based architecture with Amazon Kendra. The application is constructed with a simple streamlit frontend where users can ask questions against documents stored in Amazon Kendra.
169,"""generative AI""",ibizabroker/slack-hr-gpt,https://github.com/ibizabroker/slack-hr-gpt,2023-09-01T20:33:21+00:00,2025-04-10T02:07:13+00:00,2023-09-11T12:24:44+00:00,Python,16,7,16,0,False,"['gpt', 'langchain', 'langchain-python', 'openai', 'pinecone', 'slack', 'slack-bolt', 'slack-bot', 'supabase']",A generative AI HR slack bot.
170,"""generative AI""",ryanadoty/Amazon-Bedrock-Summarization-Long-Document-POC,https://github.com/ryanadoty/Amazon-Bedrock-Summarization-Long-Document-POC,2023-09-21T12:48:25+00:00,2025-04-09T10:26:54+00:00,2024-06-18T01:26:35+00:00,Python,16,10,16,9,False,[],This is sample code demonstrating the use of Amazon Bedrock and Generative AI to implement a long document summarization use case. The application is constructed with a simple streamlit frontend where users can upload large documents and get them summarized.
171,"""generative AI""",rania-hossam/LLAMA_FROM_SCRATCH_PYTORCH,https://github.com/rania-hossam/LLAMA_FROM_SCRATCH_PYTORCH,2023-09-11T11:20:03+00:00,2025-02-20T03:17:00+00:00,2023-10-24T11:54:18+00:00,Python,16,7,16,0,False,[],
172,"""generative AI""",AIAnytime/SaaS-Startup-using-Generative-AI,https://github.com/AIAnytime/SaaS-Startup-using-Generative-AI,2023-09-22T05:24:30+00:00,2024-10-03T14:48:26+00:00,2023-09-22T05:30:56+00:00,Python,15,12,15,1,False,[],"A SaaS Startup using Generative AI. This is a code bug fixer SaaS built using Azure OpenAI, Stripe, SQLite, and web technologies."
173,"""generative AI""",PraveenKS30/GenerativeAI,https://github.com/PraveenKS30/GenerativeAI,2023-09-28T04:02:40+00:00,2025-02-08T08:55:02+00:00,2024-11-27T09:09:50+00:00,Python,14,12,14,0,False,[],
174,"""generative AI""",ryanadoty/Amazon-Bedrock-Snowflake-POC,https://github.com/ryanadoty/Amazon-Bedrock-Snowflake-POC,2023-09-18T17:16:43+00:00,2025-04-16T10:29:03+00:00,2024-06-18T01:26:09+00:00,Python,11,2,11,12,False,[],"This is sample code demonstrating the use of Amazon Bedrock and Generative AI to take natural language questions to query relational data stores, specifically Snowflake."
175,"""generative AI""",UABPeriopAI/IRB_Assistant,https://github.com/UABPeriopAI/IRB_Assistant,2023-09-01T15:43:40+00:00,2025-01-26T15:13:34+00:00,2024-05-02T22:06:13+00:00,Python,10,5,10,0,False,[],Generative AI for Institutional Review Board (IRB) Human Subject Protocol Proposals
176,"""generative AI""",rajiviyer/genai_evaluation,https://github.com/rajiviyer/genai_evaluation,2023-09-11T06:29:29+00:00,2024-10-10T13:30:01+00:00,2023-09-21T12:30:04+00:00,Python,10,4,10,0,False,[],
177,"""generative AI""",ryanadoty/Amazon-Bedrock-RAG-OpenSearchServerless-POC,https://github.com/ryanadoty/Amazon-Bedrock-RAG-OpenSearchServerless-POC,2023-09-19T13:34:06+00:00,2024-08-18T15:00:14+00:00,2024-06-18T01:26:39+00:00,Python,10,1,10,7,False,[],This is sample code demonstrating the use of Amazon Bedrock and Generative AI to create custom embeddings stored in Amazon OpenSearch Serverless. The application is constructed with a RAG based architecture where users can ask questions against the indexed embeddings within OpenSearch Serverless.
178,"""generative AI""",panaverse/learn-generative-ai,https://github.com/panaverse/learn-generative-ai,2023-10-10T05:52:37+00:00,2025-05-22T10:44:00+00:00,2024-07-28T06:18:46+00:00,Python,741,271,741,16,False,"['generative-ai', 'langchain', 'python', 'neondb', 'streamlit', 'docker', 'gemini', 'fastapi', 'openai', 'pydantic', 'sqlalchemy-orm', 'docker-compose', 'terraform', 'pinecone', 'aws', 'azure', 'google-cloud', 'huggingface-transformers', 'postgresql']","Learn Cloud Applied Generative AI Engineering (GenEng) using OpenAI, Gemini, Streamlit, Containers, Serverless, Postgres, LangChain, Pinecone, and Next.js"
179,"""generative AI""",WangRongsheng/Awesome-LLM-with-RAG,https://github.com/WangRongsheng/Awesome-LLM-with-RAG,2023-10-25T11:37:37+00:00,2025-03-01T11:40:30+00:00,2023-11-03T13:17:41+00:00,Python,79,7,79,0,False,[],A curated list of Large Language Model with RAG
180,"""generative AI""",aws-samples/amazon-bedrock-kendra-lex-chatbot,https://github.com/aws-samples/amazon-bedrock-kendra-lex-chatbot,2023-10-18T17:53:27+00:00,2025-05-14T19:18:12+00:00,2024-02-23T17:15:55+00:00,Python,57,17,57,2,False,[],The repository offers a base implementation of incorporating an Amazon Bedrock based chatbot with Amazon Lex.
181,"""generative AI""",amelvim/antibody-diffusion-properties,https://github.com/amelvim/antibody-diffusion-properties,2023-10-04T13:26:39+00:00,2025-05-05T08:36:02+00:00,2024-11-07T13:30:50+00:00,Python,33,5,33,0,False,[],Guiding diffusion models for antibody sequence and structure co-design with developability properties.
182,"""generative AI""",KindOPSTAR/QualiGPT,https://github.com/KindOPSTAR/QualiGPT,2023-10-08T19:36:37+00:00,2025-05-17T03:02:36+00:00,2024-10-08T14:24:50+00:00,Python,30,2,30,2,False,[],QualiGPT: An easy-to-use tool for qualitative research
183,"""generative AI""",AAAAAAsuka/Impress,https://github.com/AAAAAAsuka/Impress,2023-10-20T05:55:21+00:00,2025-05-03T15:57:49+00:00,2024-05-23T17:39:00+00:00,Python,28,6,28,0,False,[],"code of paper ""IMPRESS: Evaluating the Resilience of Imperceptible Perturbations Against Unauthorized Data Usage in Diffusion-Based  Generative AI"""
184,"""generative AI""",thoddnn/open-datagen,https://github.com/thoddnn/open-datagen,2023-10-27T17:38:37+00:00,2024-12-31T02:48:48+00:00,2024-10-10T00:04:50+00:00,Python,26,2,26,0,False,[],
185,"""generative AI""",WangLabTHU/GPro,https://github.com/WangLabTHU/GPro,2023-10-08T03:44:02+00:00,2025-03-09T05:42:25+00:00,2024-03-08T01:12:27+00:00,Python,19,7,19,0,False,[],GPro: a toolbox for Generative approaches in promoter design
186,"""generative AI""",harvard-hbs/rag-example,https://github.com/harvard-hbs/rag-example,2023-10-12T23:57:00+00:00,2025-04-27T07:26:07+00:00,2023-12-02T02:12:52+00:00,Python,17,8,17,0,False,[],A worked example of retrieval-augmented generation (RAG) indexing and interaction
187,"""generative AI""",aws-samples/semantic-search-using-amazon-aurorapg-pgvector-and-amazon-bedrock,https://github.com/aws-samples/semantic-search-using-amazon-aurorapg-pgvector-and-amazon-bedrock,2023-10-20T04:40:04+00:00,2025-04-09T10:27:18+00:00,2024-01-30T09:13:20+00:00,Python,16,3,16,1,False,[],
188,"""generative AI""",emarco177/llamaindex-documentation-helper,https://github.com/emarco177/llamaindex-documentation-helper,2023-10-21T14:04:06+00:00,2025-04-01T14:30:31+00:00,2024-04-16T17:03:57+00:00,Python,15,14,15,1,False,[],
189,"""generative AI""",aws-banjo/intro_bedrock_workshop,https://github.com/aws-banjo/intro_bedrock_workshop,2023-10-04T15:00:47+00:00,2025-01-12T19:30:30+00:00,2023-10-09T22:52:13+00:00,Python,12,4,12,0,False,"['amazon-bedrock', 'generative-ai', 'langchain', 'python', 'streamlit']",Intro workshop to Amazon Bedrock
190,"""generative AI""",aws-samples/aws-glue-data-catalog-text2sql,https://github.com/aws-samples/aws-glue-data-catalog-text2sql,2023-10-20T06:04:40+00:00,2024-07-14T19:20:51+00:00,2024-03-06T16:31:19+00:00,Python,12,2,12,1,False,[],
191,"""generative AI""",ryanadoty/Amazon-Bedrock-Amazon-RDS-POC,https://github.com/ryanadoty/Amazon-Bedrock-Amazon-RDS-POC,2023-10-12T12:05:37+00:00,2024-11-20T03:43:18+00:00,2024-06-18T01:26:27+00:00,Python,12,2,12,11,False,[],"This is sample code demonstrating the use of Amazon Bedrock and Generative AI to use natural language questions to query relational data stores, specifically Amazon RDS."
192,"""generative AI""",gathnexadmin/Linkedin_Automation_with_Generative_AI,https://github.com/gathnexadmin/Linkedin_Automation_with_Generative_AI,2023-10-22T07:25:21+00:00,2025-04-01T06:57:40+00:00,2023-11-14T10:55:28+00:00,Python,11,9,11,0,False,"['ai', 'automation', 'generative-ai', 'linkedin']",Generative AI linkedin automation system
193,"""generative AI""",aws-samples/generative-ai-to-build-a-devsecops-chatbot,https://github.com/aws-samples/generative-ai-to-build-a-devsecops-chatbot,2023-10-30T21:39:24+00:00,2025-01-16T12:13:33+00:00,2024-11-05T17:03:55+00:00,Python,11,6,11,2,False,[],
194,"""generative AI""",ryanadoty/Amazon-Bedrock-Document-Comparison-POC,https://github.com/ryanadoty/Amazon-Bedrock-Document-Comparison-POC,2023-10-18T18:19:27+00:00,2025-04-29T21:37:19+00:00,2024-11-04T15:48:33+00:00,Python,11,4,11,2,False,[],This is sample code demonstrating the use of Amazon Bedrock and Generative AI to implement a document comparison use case. The application is constructed with a simple streamlit frontend where users can upload 2 versions of a document and get all changes between documents listed.
195,"""generative AI""",R1ngZer0/Packt-Conferences-Put-GenAI-to-Work,https://github.com/R1ngZer0/Packt-Conferences-Put-GenAI-to-Work,2023-10-12T01:44:23+00:00,2025-03-11T03:03:58+00:00,2023-10-12T15:33:09+00:00,Python,11,1,11,0,False,[],
196,"""generative AI""",chawins/llm-sp,https://github.com/chawins/llm-sp,2023-11-15T18:52:11+00:00,2025-05-19T08:46:53+00:00,2024-11-27T16:06:26+00:00,Python,502,36,502,0,False,"['adversarial-machine-learning', 'awesome-list', 'llm', 'llm-privacy', 'llm-security', 'privacy', 'security']",Papers and resources related to the security and privacy of LLMs 🤖
197,"""generative AI""",genforce/freecontrol,https://github.com/genforce/freecontrol,2023-11-27T23:42:07+00:00,2025-05-17T16:34:20+00:00,2024-10-21T08:45:56+00:00,Python,466,15,466,3,False,[],"Official implementation of CVPR 2024 paper: ""FreeControl: Training-Free Spatial Control of Any Text-to-Image Diffusion Model with Any Condition"""
198,"""generative AI""",ivnvxd/hack-interview,https://github.com/ivnvxd/hack-interview,2023-11-15T15:40:47+00:00,2025-05-22T06:53:49+00:00,2024-09-07T19:38:59+00:00,Python,248,36,248,9,False,"['chatgpt', 'hack', 'interview', 'openai', 'pysimplegui', 'python', 'sounddevice', 'whisper', 'hacktoberfest']",AI-powered tool for real-time interview question transcription and response generation.
199,"""generative AI""",huggingface/diffusion-fast,https://github.com/huggingface/diffusion-fast,2023-11-29T03:09:59+00:00,2025-05-21T07:09:03+00:00,2024-10-08T20:16:30+00:00,Python,213,15,213,0,False,"['diffusers', 'diffusion-models', 'pytorch', 'sdxl', 'text-to-image-generation']",Faster generation with text-to-image diffusion models.
200,"""generative AI""",LyzrCore/lyzr,https://github.com/LyzrCore/lyzr,2023-11-26T16:43:57+00:00,2025-05-16T16:35:37+00:00,2024-12-11T16:21:09+00:00,Python,178,18,178,12,False,"['aiagent', 'chatbot', 'data-analysis', 'enterprise', 'genai', 'rag', 'voicebot']",Lyzr SDKs help you to build all your favorite GenAI SaaS products as enterprise applications in minutes.
201,"""generative AI""",robocorp/llmstatemachine,https://github.com/robocorp/llmstatemachine,2023-11-17T17:37:08+00:00,2025-04-14T08:30:43+00:00,2024-01-02T16:32:58+00:00,Python,65,5,65,1,False,"['agent', 'genai', 'openai', 'python', 'statemachine', 'ai']",A Python library for building GPT-powered agents with state machine logic and chat history memory.
202,"""generative AI""",michelderu/build-your-own-rag-chatbot,https://github.com/michelderu/build-your-own-rag-chatbot,2023-11-20T19:44:24+00:00,2025-04-29T18:07:48+00:00,2024-02-27T15:03:04+00:00,Python,58,47,58,1,False,"['astradb', 'datastax', 'langchain', 'openai', 'streamlit']",Workshop to build and deploy your own Chat Agent using Retrieval Augmented Generation with Astra DB
203,"""generative AI""",LexiestLeszek/namegen,https://github.com/LexiestLeszek/namegen,2023-11-15T17:01:41+00:00,2025-01-31T18:35:55+00:00,2024-02-27T16:27:22+00:00,Python,50,7,50,0,False,"['language-model', 'machine-learning', 'natural-language-processing', 'nlp', 'name-generation', 'markov-chain']","Self-contained, minimalistic implementation of a language model that generates coherent and normal sounding names. It uses an input dataset of names and probability distribution to generate new names based on the sequences of four characters."
204,"""generative AI""",aws-samples/personalized-travel-itinerary-planner,https://github.com/aws-samples/personalized-travel-itinerary-planner,2023-11-14T19:21:11+00:00,2025-05-12T13:54:22+00:00,2024-11-25T13:33:51+00:00,Python,49,12,49,2,False,"['bedrock', 'claude2', 'redshift', 'redshift-serverless']",A Generative AI Chatbot application to provide personalized travel recommendations using Amazon Redshift and Amazon Bedrock
205,"""generative AI""",dubverse-ai/rvc-data-prep,https://github.com/dubverse-ai/rvc-data-prep,2023-11-13T09:05:17+00:00,2025-04-21T03:45:54+00:00,2023-11-28T15:03:17+00:00,Python,46,2,46,1,False,[],extract and isolate vocals from media files. supports multispeaker media as well.
206,"""generative AI""",ranfysvalle02/Interactive-RAG,https://github.com/ranfysvalle02/Interactive-RAG,2023-11-19T12:10:03+00:00,2025-05-08T05:55:38+00:00,2024-02-26T18:06:45+00:00,Python,34,12,34,5,False,"['mongodb', 'mongodb-atlas-search', 'playwright-python', 'python', 'python-3', 'python3', 'selenium-python', 'vector', 'azure-openai', 'embeddings', 'genai', 'genai-chatbot', 'gpt4all', 'langchain-python', 'openai', 'rag', 'retrieval-augmented-generation']","Using MongoDB Atlas + ActionWeaver, we can build a user proxy agent that efficiently retrieves and ingests relevant information.  This agent presents the data to the user in an interactive and customizable manner, enhancing the overall user experience. "
207,"""generative AI""",allisonmorrell/gptbuilder,https://github.com/allisonmorrell/gptbuilder,2023-11-15T01:41:42+00:00,2024-07-08T02:58:44+00:00,2024-01-29T21:46:23+00:00,Python,33,2,33,15,False,[],"Repository of my thoughts on creating GPTs, and instructions and files for Better GPT Builder"
208,"""generative AI""",microsoft/contoso-support-pf-demo,https://github.com/microsoft/contoso-support-pf-demo,2023-11-09T18:32:19+00:00,2024-11-15T09:18:53+00:00,2023-12-05T14:36:08+00:00,Python,31,18,31,2,False,[],Code for MS Ignite 2023 | Live Breakout Session | BRK203
209,"""generative AI""",LinkedInLearning/learning-amazon-bedrock-3819146,https://github.com/LinkedInLearning/learning-amazon-bedrock-3819146,2023-11-17T22:50:12+00:00,2025-05-21T15:14:38+00:00,2024-03-29T17:29:47+00:00,Python,27,61,27,0,False,[],this repo is for linkedin learning course: Learning Amazon Bedrock
210,"""generative AI""",LinkedInLearning/generative-ai-for-python-developers-4504249,https://github.com/LinkedInLearning/generative-ai-for-python-developers-4504249,2023-11-15T17:43:23+00:00,2025-04-23T18:48:43+00:00,2024-03-11T00:33:51+00:00,Python,23,48,23,2,False,[],this repo is for linkedin learning course: Generative AI for Python Developers
211,"""generative AI""",aws-samples/build-scale-generative-ai-applications-with-amazon-bedrock-workshop,https://github.com/aws-samples/build-scale-generative-ai-applications-with-amazon-bedrock-workshop,2023-11-21T20:58:29+00:00,2025-02-23T21:00:32+00:00,2024-10-09T12:41:55+00:00,Python,23,17,23,8,False,[],
212,"""generative AI""",vmehmeri/generative-ai,https://github.com/vmehmeri/generative-ai,2023-11-14T10:34:00+00:00,2025-04-18T00:09:18+00:00,2024-07-28T12:45:16+00:00,Python,23,9,23,0,False,[],Generative AI resources
213,"""generative AI""",sowole-aims/chat-with-documents-app,https://github.com/sowole-aims/chat-with-documents-app,2023-11-30T14:28:45+00:00,2025-04-09T03:11:08+00:00,2023-12-11T10:06:03+00:00,Python,22,9,22,0,False,[],
214,"""generative AI""",AI-FREE-Team/Generative-AI-Industrial-Case-Study,https://github.com/AI-FREE-Team/Generative-AI-Industrial-Case-Study,2023-11-07T08:29:51+00:00,2025-02-27T10:05:20+00:00,2023-12-30T10:25:16+00:00,Python,21,3,21,0,False,[],生成式 AI 於產業應用案例教案實作練習模組
215,"""generative AI""",LinkedInLearning/vector-databases-in-practice-deep-dive-4513162,https://github.com/LinkedInLearning/vector-databases-in-practice-deep-dive-4513162,2023-11-09T16:28:14+00:00,2025-05-01T23:01:53+00:00,2024-04-20T10:23:55+00:00,Python,16,23,16,0,False,[],This is a repository for the LinkedIn Learning course Vector Databases in Practice: Deep Dive
216,"""generative AI""",DeepMakeStudio/DeepMake,https://github.com/DeepMakeStudio/DeepMake,2023-11-22T17:14:41+00:00,2025-03-02T21:38:52+00:00,2024-10-16T19:11:19+00:00,Python,16,0,16,0,False,"['after-effects', 'generative-ai', 'special-effects', 'vfx', 'visual-effects']",DeepMake
217,"""generative AI""",LinkedInLearning/building-applications-using-amazon-bedrock-3806107,https://github.com/LinkedInLearning/building-applications-using-amazon-bedrock-3806107,2023-11-17T23:22:35+00:00,2025-02-10T07:56:23+00:00,2024-03-20T17:07:14+00:00,Python,14,52,14,0,False,[],this repo is for linkedin learning course: Building Applications Using Amazon Bedrock
218,"""generative AI""",iSiddharth20/Generative-AI-Based-Spatio-Temporal-Fusion,https://github.com/iSiddharth20/Generative-AI-Based-Spatio-Temporal-Fusion,2023-11-09T23:59:48+00:00,2025-03-02T01:33:45+00:00,2024-07-05T01:02:05+00:00,Python,14,4,14,2,False,"['autoencoder', 'lstm-autoencoder', 'lstm-neural-network', 'spatio-temporal-modeling', 'spatio-temporal-fusion', 'generative-ai', 'frame-interpolation', 'maxent-models', 'maximum-entropy-regularization', 'video-super-resolution', 'collaborate']","A Novel Approach leveraging Auto-Encoders, LSTM Networks and Maximum Entropy Principle for Video Super-Resolution (Upscaling and Frame Interpolation)"
219,"""generative AI""",YiQi0318/LLMs_daily_arxiv,https://github.com/YiQi0318/LLMs_daily_arxiv,2023-11-28T11:15:47+00:00,2025-05-20T20:26:04+00:00,2024-07-25T08:14:14+00:00,Python,12,1,12,0,False,[],
220,"""generative AI""",colorzhang/autogen-bedrock-claude-streamlit,https://github.com/colorzhang/autogen-bedrock-claude-streamlit,2023-11-24T10:07:41+00:00,2024-08-06T08:52:34+00:00,2024-03-26T02:56:56+00:00,Python,11,2,11,0,False,[],MyAssistant Playground --powered by Bedrock Claude & AutoGen
