total_index,keyword_source,full_name,html_url,create_date,update_date,pushed_date,language,stars,forks,watchers,open_issues,is_fork,topics,description
221,"""generative AI""",DeepHiveMind/Generative-AI,https://github.com/DeepHiveMind/Generative-AI,2023-11-06T07:08:03+00:00,2024-12-20T12:42:16+00:00,2024-10-25T17:33:50+00:00,Python,10,1,10,0,False,[],This repo contains industry use cases and application code for GenAI
222,"""generative AI""",ZHO-ZHO-ZHO/ComfyUI-Gemini,https://github.com/ZHO-ZHO-ZHO/ComfyUI-Gemini,2023-12-19T16:35:53+00:00,2025-05-22T02:32:25+00:00,2024-05-22T14:15:11+00:00,Python,757,65,757,34,False,"['comfyui', 'stable-diffusion', 'gemini-pro', 'google-gemini']",Using Gemini in ComfyUI
223,"""generative AI""",prompt-security/ps-fuzz,https://github.com/prompt-security/ps-fuzz,2023-12-23T16:09:31+00:00,2025-05-21T06:58:57+00:00,2024-10-16T08:27:26+00:00,Python,480,71,480,14,False,"['ai', 'fuzzer', 'generative-ai', 'llm', 'security', 'security-tools', 'llm-fuzzer', 'system-prompt-hardener', 'ai-fuzzer']",Make your GenAI Apps Safe & Secure :rocket: Test & harden your system prompt
224,"""generative AI""",hfhoffman1144/langchain_neo4j_rag_app,https://github.com/hfhoffman1144/langchain_neo4j_rag_app,2023-12-11T13:33:21+00:00,2025-05-20T06:32:25+00:00,2024-08-08T13:24:11+00:00,Python,215,70,215,2,False,[],A knowledge graph RAG app using LangChain and Neo4j.
225,"""generative AI""",natolambert/blogcaster,https://github.com/natolambert/blogcaster,2023-12-04T00:32:01+00:00,2025-05-17T16:34:31+00:00,2024-09-04T22:43:28+00:00,Python,205,16,205,7,False,"['blogging', 'podcasts', 'substack']",Python tools for easily translating your blog content to podcasts & YouTube
226,"""generative AI""",herval/cliobot,https://github.com/herval/cliobot,2023-12-31T16:37:23+00:00,2025-05-19T15:43:31+00:00,2024-03-20T19:20:14+00:00,Python,111,11,111,2,False,[],"open source bot framework for generative AI on telegram, discord, whatsapp & more"
227,"""generative AI""",aadeshkulkarni/sanchay-ai,https://github.com/aadeshkulkarni/sanchay-ai,2023-12-13T03:42:06+00:00,2025-05-01T13:44:56+00:00,2024-05-16T11:55:17+00:00,Python,94,19,94,8,False,"['generative-ai', 'javascript', 'object-store', 'python', 'rabbitmq', 'whisper']","Takes your video and generates video title, description, hashtags, transcription, subtitles and more."
228,"""generative AI""",build-on-aws/amazon-bedrock-agents-quickstart,https://github.com/build-on-aws/amazon-bedrock-agents-quickstart,2023-12-04T16:05:41+00:00,2025-05-20T23:26:50+00:00,2024-03-29T22:30:00+00:00,Python,89,23,89,4,False,"['ai-agents', 'amazon-bedrock', 'claude2', 'langchain']",Learn how to quickly build Agents with Amazon Bedrock
229,"""generative AI""",TatevKaren/BabyGPT-Build_GPT_From_Scratch,https://github.com/TatevKaren/BabyGPT-Build_GPT_From_Scratch,2023-12-01T12:22:12+00:00,2025-05-20T04:48:35+00:00,2023-12-05T23:39:13+00:00,Python,85,27,85,0,False,"['python', 'gpt', 'gpt-3', 'large-language-models', 'llm-training', 'llms', 'transformers', 'attention-is-all-you-need', 'dropout-layers', 'multi-head-self-attention', 'pytorch', 'residual-connections', 'layer-normalization', 'neural-networks']",BabyGPT: Build Your Own GPT Large Language Model from Scratch Pre-Training Generative Transformer Models: Building GPT from Scratch with a Step-by-Step Guide to Generative AI in PyTorch and Python
230,"""generative AI""",sausheong/persona,https://github.com/sausheong/persona,2023-12-19T15:38:37+00:00,2025-04-21T00:02:08+00:00,2024-01-14T14:18:36+00:00,Python,78,25,78,0,False,[],Talking head video AI generator
231,"""generative AI""",panaverse/university-gpt,https://github.com/panaverse/university-gpt,2023-12-31T14:43:04+00:00,2025-05-08T13:28:35+00:00,2024-05-10T07:52:40+00:00,Python,73,38,73,2,False,[],
232,"""generative AI""",yihong0618/2024,https://github.com/yihong0618/2024,2023-12-29T00:56:24+00:00,2025-04-15T08:05:20+00:00,2024-12-31T01:39:31+00:00,Python,57,4,57,6,False,[],Change
233,"""generative AI""",awslabs/genai-bedrock-chatbot,https://github.com/awslabs/genai-bedrock-chatbot,2023-12-15T15:49:09+00:00,2025-05-21T19:18:44+00:00,2024-11-12T20:03:16+00:00,Python,43,12,43,2,False,"['aws', 'aws-bedrock', 'chatbot', 'genai']",A demo application that uses Amazon SageMaker manuals and pricing data tables as an example to explore the capabilities of a generative AI chatbot.
234,"""generative AI""",alfredodeza/azure-rag,https://github.com/alfredodeza/azure-rag,2023-12-26T16:03:29+00:00,2025-05-06T09:57:41+00:00,2024-01-03T12:16:36+00:00,Python,42,163,42,0,False,[],A Retrieval Augmented Generation example with Azure
235,"""generative AI""",ExtensityAI/benchmark,https://github.com/ExtensityAI/benchmark,2023-12-29T15:00:47+00:00,2025-03-19T08:26:07+00:00,2024-08-03T11:33:09+00:00,Python,35,0,35,0,False,[],Evaluation of neuro-symbolic engines
236,"""generative AI""",MUTED64/GeminiTranslate,https://github.com/MUTED64/GeminiTranslate,2023-12-18T14:43:20+00:00,2025-05-20T13:30:32+00:00,2023-12-21T15:13:21+00:00,Python,31,13,31,1,False,"['gemini', 'gemini-api', 'immersive-translate', 'translation']","Gemini-based translation API that integrates with the ""Immersive Translate"", 基于 Gemini 的翻译 API，可与沉浸式翻译插件集成"
237,"""generative AI""",koushik2299/AI-Resume-Reviewer,https://github.com/koushik2299/AI-Resume-Reviewer,2023-12-30T02:39:33+00:00,2025-04-27T08:56:01+00:00,2024-02-22T00:09:42+00:00,Python,23,18,23,1,False,[],"The Resume Expert Streamlit application stands as a significant tool in bridging the gap between job seekers and their ideal job roles. By harnessing the power of AI, it provides valuable insights and recommendations, making it a pivotal step in enhancing the job application process."
238,"""generative AI""",LazaUK/AOAI-GPT4Vision-Streamlit-SDKv1,https://github.com/LazaUK/AOAI-GPT4Vision-Streamlit-SDKv1,2023-12-28T01:17:48+00:00,2025-05-18T12:59:04+00:00,2024-01-03T14:53:28+00:00,Python,20,7,20,0,False,"['ai', 'azure', 'gpt', 'gpt-4-vision', 'openai', 'out-of-stock', 'streamlit']",Using Azure OpenAI deployment of GPT-4 Turbo with Vision to analyse out-of-stock situation in a fictitious retail shop.
239,"""generative AI""",mjunaidca/travel-ai-service,https://github.com/mjunaidca/travel-ai-service,2023-12-17T05:57:21+00:00,2025-04-20T13:10:40+00:00,2023-12-28T13:51:55+00:00,Python,20,5,20,0,False,"['ai', 'ai-travel-planner', 'docker', 'gpt-4', 'nextjs14', 'openai-api', 'openai-api-chatbot', 'openai-api-python', 'streamlit', 'travel']",A fun AI Powered Traveling Assistant that annotates map and help in planning travel trips
240,"""generative AI""",AryanVBW/Private-Ai,https://github.com/AryanVBW/Private-Ai,2023-12-08T01:48:21+00:00,2025-05-15T04:56:21+00:00,2024-02-26T22:02:25+00:00,Python,19,8,19,16,False,"['chatgpt', 'chatgpt-4', 'chatgpt3', 'chatgpt4', 'gpt4', 'gpt4all', 'privategpt', 'aryanvbw', 'vivek', 'vivek-w']","Private-AI is an innovative AI project designed for asking questions about your documents using powerful Large Language Models (LLMs). The unique feature? It works offline, ensuring 100% privacy with no data leaving your environment"
241,"""generative AI""",MoroccoAI/2023-GenAI-Hackathon,https://github.com/MoroccoAI/2023-GenAI-Hackathon,2023-12-09T23:43:41+00:00,2025-04-14T20:46:35+00:00,2023-12-19T11:13:14+00:00,Python,17,30,17,0,False,"['generative-ai', 'hackathon']","The MoroccoAI GenAI Hackathon aims to foster innovation and collaboration within Morocco's burgeoning AI ecosystem. As a participant, you are asked to join a team to develop a PoC using GenAI in specific industries."
242,"""generative AI""",aws-samples/genai-video-super-resolution,https://github.com/aws-samples/genai-video-super-resolution,2023-12-14T04:52:15+00:00,2025-04-24T14:18:36+00:00,2024-06-09T00:11:48+00:00,Python,16,3,16,3,False,[],
243,"""generative AI""",flushai/flush,https://github.com/flushai/flush,2023-12-13T04:20:10+00:00,2024-12-02T04:13:50+00:00,2023-12-13T04:51:04+00:00,Python,16,0,16,0,False,[],Official open-source repository for Flush AI's SDK. https://www.flushai.cloud/
244,"""generative AI""",abhishekshankr/AIcons,https://github.com/abhishekshankr/AIcons,2023-12-19T02:58:20+00:00,2025-04-15T20:01:37+00:00,2024-01-23T16:32:21+00:00,Python,12,2,12,0,False,[],An icon set for generative AI applications
245,"""generative AI""",thammuio/doc-genius-ai,https://github.com/thammuio/doc-genius-ai,2023-12-19T19:59:19+00:00,2025-01-08T13:56:02+00:00,2025-03-22T23:50:13+00:00,Python,11,6,11,0,False,"['genai', 'genai-chatbot', 'llm', 'cloudera', 'machine-learning', 'cloudera-machine-learning', 'cml', 'ai-agents', 'data-analytics', 'document-processing', 'retrieval-augmented-generation', 'enterprise-ai-solutions']",DocGenius AI - Generative AI Chatbot for your Documents
246,"""generative AI""",VK-Ant/PDF_CSV_VISION_DRAGGING_BASED_CHATBOT_WITH_TRANSLATOR_AUDIO_USING_GEMINIAI,https://github.com/VK-Ant/PDF_CSV_VISION_DRAGGING_BASED_CHATBOT_WITH_TRANSLATOR_AUDIO_USING_GEMINIAI,2023-12-14T05:57:07+00:00,2025-03-13T18:27:29+00:00,2024-05-17T16:48:41+00:00,Python,11,7,11,0,False,[],"GeminiAPI_PALM_Chatbot (Audio, Vision, Prompt, Multiple-PDF and addon translator)"
247,"""generative AI""",compilebunny/androidremoteGPT,https://github.com/compilebunny/androidremoteGPT,2023-12-27T14:49:19+00:00,2025-04-18T18:26:40+00:00,2024-01-03T02:46:30+00:00,Python,11,2,11,0,False,"['android', 'generative-ai', 'gpt4all', 'termux', 'termux-gui']","AndroidRemoteGPT, an Android front-end for inference using a remote server"
248,"""generative AI""",alirezadir/leetcode-summerizer,https://github.com/alirezadir/leetcode-summerizer,2023-12-10T22:35:41+00:00,2025-03-27T18:49:14+00:00,2023-12-11T15:14:50+00:00,Python,11,1,11,0,False,"['ai', 'artificial-intelligence', 'code-summarization', 'leetcode', 'machinelearning', 'openai-gpt', 'python']","Summarize and collect into a DB a collection of LeetCode problems (Description, Solutions, Code, Analysis)"
249,"""generative AI""",isurulkh/RAG-application-Gemini,https://github.com/isurulkh/RAG-application-Gemini,2023-12-25T20:09:38+00:00,2025-04-08T00:38:25+00:00,2023-12-25T20:38:00+00:00,Python,10,2,10,0,False,[],"This repository implements a question answering system that retrieves information from uploaded PDFs using Google Generative AI and LangChain. Ask questions about the document's content and get detailed, context-aware answers."
250,"""generative AI""",speshiou/gemini-telegram-bot,https://github.com/speshiou/gemini-telegram-bot,2023-12-16T08:37:09+00:00,2024-12-18T20:13:54+00:00,2023-12-17T01:41:46+00:00,Python,10,3,10,0,False,[],A Telegram bot powered by Google's Gemini Generative AI model.
251,"""generative AI""",GURPREETKAURJETHRA/Multi-PDFs_ChatApp_AI-Agent,https://github.com/GURPREETKAURJETHRA/Multi-PDFs_ChatApp_AI-Agent,2024-01-11T14:41:28+00:00,2025-05-14T13:03:22+00:00,2024-04-23T08:08:16+00:00,Python,99,58,99,1,False,"['chat-application', 'chatbot-application', 'chatgpt', 'gemini', 'gemini-api', 'gemini-pro', 'generative-ai', 'google', 'instructor-embeddings', 'langchain', 'langchain-python', 'large-language-models', 'llm', 'open-source', 'openai', 'pdf-document-processor', 'python-3', 'streamlit-application']","Meet MultiPDF 📚 Chat AI App! 🚀 Chat seamlessly with Multiple PDFs using Langchain, Google Gemini Pro & FAISS Vector DB with Seamless Streamlit Deployment. Get instant, accurate responses from Awesome Google Gemini OpenSource language Model. 📚💬 Transform your PDF experience now! 🔥✨"
252,"""generative AI""",DmitryRyumin/WACV-2024-Papers,https://github.com/DmitryRyumin/WACV-2024-Papers,2024-01-04T15:44:58+00:00,2025-03-30T16:53:23+00:00,2024-09-01T00:50:37+00:00,Python,96,13,96,0,False,"['3d-computer-vision', '3d-sensor', 'adversarial-attacks', 'autonomous-driving', 'biometrics', 'computer-vision', 'datasets', 'face-recognition', 'generative-models', 'gesture-recognition', 'image-recognition', 'image-understanding', 'low-level', 'machine-learning', 'robotics', 'video-recognition', 'vision-transformer', 'visualization', 'wacv', 'wacv2024']","WACV 2024 Papers: Discover cutting-edge research from WACV 2024, the leading computer vision conference. Stay updated on the latest in computer vision and deep learning, with code included. ⭐ support visual intelligence development!"
253,"""generative AI""",PacktPublishing/Building-Data-Driven-Applications-with-LlamaIndex,https://github.com/PacktPublishing/Building-Data-Driven-Applications-with-LlamaIndex,2024-01-09T08:13:21+00:00,2025-05-21T23:01:04+00:00,2024-06-06T23:50:28+00:00,Python,88,47,88,16,False,[],"Building Data-Driven Applications with LlamaIndex, published by Packt"
254,"""generative AI""",VishnuPJ/MalayaLLM,https://github.com/VishnuPJ/MalayaLLM,2024-01-25T11:27:23+00:00,2025-05-04T17:00:06+00:00,2024-07-16T08:09:19+00:00,Python,60,8,60,1,False,[],A Continually LoRA PreTrained and FineTuned 7B Llama-2 Indic model for Malayalam Language.
255,"""generative AI""",aws-samples/deploy-streamlit-app,https://github.com/aws-samples/deploy-streamlit-app,2024-01-20T11:17:05+00:00,2025-04-14T20:40:27+00:00,2024-10-11T14:10:03+00:00,Python,56,24,56,3,False,[],
256,"""generative AI""",Mamdouh66/Extracty,https://github.com/Mamdouh66/Extracty,2024-01-28T17:57:30+00:00,2025-03-12T07:04:19+00:00,2024-03-30T01:02:27+00:00,Python,40,4,40,1,False,"['extract-data', 'instructor', 'pydantic', 'scraper', 'scraping', 'llm-scraper']",Extract structured data from any unstructured web page
257,"""generative AI""",PacktPublishing/Generative-AI-Foundations-in-Python,https://github.com/PacktPublishing/Generative-AI-Foundations-in-Python,2024-01-11T06:52:10+00:00,2025-02-22T18:10:42+00:00,2024-08-13T06:33:03+00:00,Python,32,32,32,4,False,[],"Generative AI Foundations in Python, published by Packt"
258,"""generative AI""",jtoy/replicantlife,https://github.com/jtoy/replicantlife,2024-01-08T22:49:25+00:00,2025-05-17T16:35:12+00:00,2024-04-25T18:31:48+00:00,Python,31,9,31,9,False,[],replicantlife is a framework for generative agents that can be used in a simulation engine or standalone. Agents are powered with metacognition modules that allow that to learn and adjust their strategy over time.
259,"""generative AI""",NVIDIA-AI-IOT/mmj_genai,https://github.com/NVIDIA-AI-IOT/mmj_genai,2024-01-19T00:48:11+00:00,2025-02-08T14:27:34+00:00,2024-06-14T16:08:05+00:00,Python,30,3,30,2,False,[],A reference example for integrating NanoOwl with Metropolis Microservices for Jetson
260,"""generative AI""",cvlab-columbia/RaidarLLMDetect,https://github.com/cvlab-columbia/RaidarLLMDetect,2024-01-19T15:41:05+00:00,2025-05-13T12:17:01+00:00,2024-07-12T21:20:45+00:00,Python,26,3,26,0,False,[],
261,"""generative AI""",ali-bin-kashif/NED-Admission-LLM-Chatbot-FYP,https://github.com/ali-bin-kashif/NED-Admission-LLM-Chatbot-FYP,2024-01-07T09:59:36+00:00,2025-05-21T06:35:51+00:00,2024-08-02T11:15:28+00:00,Python,21,4,21,0,False,"['chatbot', 'final-year-project', 'generative-ai', 'large-language-models', 'nextjs', 'university-admission-chatbot', 'rag']","This is the final year project of university, in which my group is developing a chatbot for university admissions using LLMS and RAG. The bot is powered by Langchain and FastAPI. The UI and frontend is developed in Next.js. "
262,"""generative AI""",BenderScript/PromptInjectionBench,https://github.com/BenderScript/PromptInjectionBench,2024-01-09T17:29:13+00:00,2025-03-13T02:39:57+00:00,2024-10-08T03:09:25+00:00,Python,21,2,21,0,False,"['attack', 'azure', 'gemini', 'gpt-4', 'injection', 'openai', 'prompt']","Prompt Injection Attacks against GPT-4, Gemini, Azure, Azure with Jailbreak"
263,"""generative AI""",Nagh-DE/GoogleGemini-PDF,https://github.com/Nagh-DE/GoogleGemini-PDF,2024-01-13T07:17:48+00:00,2025-01-03T09:41:41+00:00,2024-01-13T08:41:00+00:00,Python,20,7,20,1,False,[],chat with multiple pdf docs using Google's Gemini generative AI
264,"""generative AI""",TVR28/ATSPro,https://github.com/TVR28/ATSPro,2024-01-28T04:27:40+00:00,2024-06-15T22:08:28+00:00,2024-06-15T22:08:24+00:00,Python,19,0,19,0,False,[],Cross the ATS Hurdle: Unlock Your Career Potential with Precision and Insight
265,"""generative AI""",hardikjp7/ResumeMatcher-ATS,https://github.com/hardikjp7/ResumeMatcher-ATS,2024-01-24T12:58:25+00:00,2025-05-19T03:17:46+00:00,2024-02-15T06:19:11+00:00,Python,18,1,18,0,False,"['gemini-api', 'gemini-pro', 'resume-ats-checker']",Resume matching tool using Gemini AI for job descriptions and resumes 📄
266,"""generative AI""",ecdedios/resume-chatbot-local-llm,https://github.com/ecdedios/resume-chatbot-local-llm,2024-01-17T20:36:10+00:00,2025-05-13T17:30:37+00:00,2024-01-21T00:59:52+00:00,Python,16,7,16,1,False,[],"Playing with RAG using Ollama, Langchain, and Streamlit. This project aims to demonstrate how a recruiter or HR personnel can benefit from a chatbot that answers questions regarding candidates."
267,"""generative AI""",aws-samples/rag-with-amazon-postgresql-using-pgvector-and-sagemaker,https://github.com/aws-samples/rag-with-amazon-postgresql-using-pgvector-and-sagemaker,2024-01-06T04:47:41+00:00,2025-02-25T15:44:01+00:00,2024-12-03T14:57:51+00:00,Python,16,3,16,0,False,"['amazon-aurora', 'llms', 'pgvector', 'postgresql', 'rag', 'vector-database']",Question Answering application with Large Language Models (LLMs) and Amazon Postgresql using pgvector
268,"""generative AI""",elder-plinius/AutoRedTeam,https://github.com/elder-plinius/AutoRedTeam,2024-01-28T19:52:08+00:00,2025-04-22T01:53:03+00:00,2024-01-28T20:48:53+00:00,Python,14,3,14,0,False,[],Automating the testing of prompt defenses.
269,"""generative AI""",jwoongkim11/QA-RAG,https://github.com/jwoongkim11/QA-RAG,2024-01-15T09:19:14+00:00,2025-03-05T18:14:00+00:00,2024-09-09T01:26:10+00:00,Python,14,4,14,0,False,[],"Code for the paper, From RAG to QA-RAG: Integrating Generative AI for Pharmaceutical Regulatory Compliance Process"
270,"""generative AI""",Daethyra/FreeStream,https://github.com/Daethyra/FreeStream,2024-01-30T05:29:23+00:00,2025-03-10T17:33:41+00:00,2024-11-25T11:13:17+00:00,Python,14,5,14,10,False,"['chatbot', 'langchain', 'large-language-models', 'openai', 'python', 'question-answering', 'rag', 'retrieval-augmented-generation', 'streamlit', 'google-ai', 'langgraph', 'vertex-ai', 'corrective-retrieval-augmented-generation', 'agent-based', 'claude', 'claude-api']",Template repository for building Streamlit chatbots
271,"""generative AI""",SsebowaDisan/ssebowa,https://github.com/SsebowaDisan/ssebowa,2024-01-15T13:17:52+00:00,2024-06-13T08:09:29+00:00,2024-01-31T07:01:48+00:00,Python,14,2,14,1,False,"['generative-ai', 'image-to-image', 'text-to-image', 'text-to-text-generation', 'text-to-video']",Ssebowa is free and open source library in Python that provides generative-ai models.
272,"""generative AI""",DivergerThinking/pycodedoc,https://github.com/DivergerThinking/pycodedoc,2024-01-18T18:30:29+00:00,2025-05-15T05:06:16+00:00,2024-02-28T11:00:51+00:00,Python,14,2,14,1,False,[],
273,"""generative AI""",KalyanM45/Application-Tracking-System,https://github.com/KalyanM45/Application-Tracking-System,2024-01-20T14:16:14+00:00,2025-04-03T15:29:28+00:00,2024-04-08T05:58:37+00:00,Python,13,2,13,0,False,"['ats', 'gemini', 'gemini-pro', 'appliation-tracking-system', 'smart-ats', 'smart-ats-system', 'applicant-tracking-system']","The Smart Applicant Tracking System (ATS) is a cutting-edge tool designed to enhance the resume evaluation process. Leveraging advanced Generative AI models from Google, the system empowers users to submit their resumes for a comprehensive analysis based on a provided job description. "
274,"""generative AI""",pulkitrajput147/ATS-Scanner,https://github.com/pulkitrajput147/ATS-Scanner,2024-01-20T06:26:36+00:00,2025-01-01T04:01:48+00:00,2024-01-25T06:20:03+00:00,Python,12,1,12,0,False,[],
275,"""generative AI""",haonan3/ICML-2024-Oral-SilentBadDiffusion,https://github.com/haonan3/ICML-2024-Oral-SilentBadDiffusion,2024-01-07T07:59:20+00:00,2025-03-31T09:14:27+00:00,2024-11-22T03:17:16+00:00,Python,11,1,11,1,False,[],
276,"""generative AI""",aws-samples/amazon-bedrock-synthetic-manufacturing-data-generator,https://github.com/aws-samples/amazon-bedrock-synthetic-manufacturing-data-generator,2024-01-19T11:16:00+00:00,2024-12-18T08:14:50+00:00,2024-05-02T06:38:01+00:00,Python,11,1,11,3,False,[],
277,"""generative AI""",VAST-AI-Research/TripoSR,https://github.com/VAST-AI-Research/TripoSR,2024-02-07T10:31:04+00:00,2025-05-22T04:37:39+00:00,2024-08-16T00:03:43+00:00,Python,5391,634,5391,92,False,[],TripoSR: Fast 3D Object Reconstruction from a Single Image
278,"""generative AI""",StavC/ComPromptMized,https://github.com/StavC/ComPromptMized,2024-02-26T23:21:05+00:00,2025-05-08T15:36:34+00:00,2024-03-06T12:18:10+00:00,Python,202,26,202,1,False,"['ai', 'aisecurity', 'genai', 'llm', 'research', 'research-paper']",ComPromptMized: Unleashing Zero-click Worms that Target GenAI-Powered Applications
279,"""generative AI""",dsdanielpark/Gemini-API,https://github.com/dsdanielpark/Gemini-API,2024-02-13T07:01:52+00:00,2025-05-05T08:12:55+00:00,2024-05-21T03:07:38+00:00,Python,182,16,182,4,False,"['gemini', 'gemini-api', 'api-client', 'generative-ai', 'google-gemini', 'python-wrapper', 'python-package']",The unofficial python package that returns response of Google Gemini through cookie values.
280,"""generative AI""",evalplus/repoqa,https://github.com/evalplus/repoqa,2024-02-18T07:04:19+00:00,2025-05-02T16:12:45+00:00,2024-11-01T17:59:43+00:00,Python,108,5,108,4,False,[],RepoQA: Evaluating Long-Context Code Understanding
281,"""generative AI""",davide97l/ai-video-generator,https://github.com/davide97l/ai-video-generator,2024-02-26T01:59:47+00:00,2025-05-21T08:29:29+00:00,2024-02-26T02:10:03+00:00,Python,92,24,92,1,False,"['ai-agent', 'ai-video-generator', 'video-generation', 'video-translation']",AI agent to automatically generate and post short videos
282,"""generative AI""",build-on-aws/bedrock-agent-txt2sql,https://github.com/build-on-aws/bedrock-agent-txt2sql,2024-02-11T01:52:59+00:00,2025-05-19T20:29:58+00:00,2024-11-06T12:49:59+00:00,Python,77,19,77,1,False,"['bedrock', 'bedrock-agent', 'txt2sql']",Use natural language to Generate Amazon Athena SQL queries to fetch data.
283,"""generative AI""",Muhtasham/pod-helper,https://github.com/Muhtasham/pod-helper,2024-02-06T23:43:27+00:00,2025-05-17T16:35:38+00:00,2024-02-23T23:52:33+00:00,Python,76,6,76,0,False,[],🎧 Pod-Helper: Real-time audio transcription and repair on consumer hardware
284,"""generative AI""",AdamGit69/code-snippets,https://github.com/AdamGit69/code-snippets,2024-02-22T02:41:50+00:00,2025-03-17T05:19:39+00:00,2024-10-21T08:20:28+00:00,Python,56,7,56,3,False,[],
285,"""generative AI""",SriLaxmi1993/Document-Genie-using-RAG-Framwork,https://github.com/SriLaxmi1993/Document-Genie-using-RAG-Framwork,2024-02-13T00:19:29+00:00,2025-04-06T09:49:50+00:00,2024-02-13T02:23:36+00:00,Python,39,30,39,1,False,[],Document Q& A using RAG - GEMINI PRO
286,"""generative AI""",fgblanch/OutlookLLM,https://github.com/fgblanch/OutlookLLM,2024-02-21T01:38:03+00:00,2025-05-22T06:20:52+00:00,2024-12-04T07:44:09+00:00,Python,38,2,38,2,False,"['outlook-addin', 'tensorrt-llm']","Add-in for new Outlook that adds LLM new features (Composition, Summarizing, Q&A). It uses a local LLM via Nvidia TensorRT-LLM"
287,"""generative AI""",aws-samples/conversational-ai-assistant-multi-route-chain,https://github.com/aws-samples/conversational-ai-assistant-multi-route-chain,2024-02-09T17:56:42+00:00,2025-04-02T19:41:16+00:00,2024-05-17T16:10:53+00:00,Python,29,8,29,2,False,"['aiml', 'aws', 'bedrock', 'generative-ai', 'langchain', 'rag']","This GitHub repository guides you through building an advanced Conversational AI assistant using AWS services and Anthropic's Claude V2 model. It features intelligent routing to relevant functions, database querying, semantic searches, Lambda function executions, and specialized interactions."
288,"""generative AI""",aws-samples/video-understanding-solution,https://github.com/aws-samples/video-understanding-solution,2024-02-12T03:14:01+00:00,2025-05-08T02:02:43+00:00,2024-12-19T11:44:34+00:00,Python,27,6,27,0,False,[],
289,"""generative AI""",aws-samples/rag-with-amazon-opensearch-and-sagemaker,https://github.com/aws-samples/rag-with-amazon-opensearch-and-sagemaker,2024-02-21T03:46:32+00:00,2025-04-20T07:46:27+00:00,2024-12-03T12:47:11+00:00,Python,25,3,25,0,False,"['aws-opensearch', 'generative-ai', 'langchain', 'llms', 'opensearch', 'rag', 'vector-database', 'vectorsearch']",Question Answering Generative AI application with Large Language Models (LLMs) and Amazon OpenSearch Service
290,"""generative AI""",didier-durand/qstensils,https://github.com/didier-durand/qstensils,2024-02-22T05:08:02+00:00,2024-10-05T23:30:44+00:00,2024-04-11T04:07:46+00:00,Python,23,1,23,0,False,"['aws', 'amazonq', 'qbusiness', 'amazon', 'generative-ai', 'retrieval-augmented-generation']",Tools and scripts for Amazon Q operations and explorations
291,"""generative AI""",timroelofs123/face_reaging,https://github.com/timroelofs123/face_reaging,2024-02-06T10:58:11+00:00,2025-05-10T13:00:29+00:00,2024-02-08T00:47:01+00:00,Python,22,4,22,1,False,[],Model for aging face photos up or down.
